url,name,asin,image,price,isPrime,offer,customerReview,customerReviewCount
https://www.amazon.com/sspa/click?ie=UTF8&spc=MTozMjc2NTEzNzA3NjgwMDQyOjE3MDc3MDk4Mzk6c3BfYXRmX25leHQ6MzAwMTI5MzI2MDMyNDAyOjowOjo&url=%2FMonitors-Computers-%25F0%259D%2590%2584%25F0%259D%2590%2583%25F0%259D%2590%2588%25F0%259D%2590%2583-%25F0%259D%2590%25AC%25F0%259D%2590%25A2%25F0%259D%2590%25A6%25F0%259D%2590%25AE%25F0%259D%2590%25A5%25F0%259D%2590%259A%25F0%259D%2590%25AD%25F0%259D%2590%25A2%25F0%259D%2590%25A8%25F0%259D%2590%25A7-MLEEDA%2Fdp%2FB0CQ6WTXGG%2Fref%3Dsr_1_257_sspa%3Fkeywords%3Dmouse%26qid%3D1707709839%26sr%3D8-257-spons%26sp_csd%3Dd2lkZ2V0TmFtZT1zcF9hdGZfbmV4dA%26psc%3D1,"KVM Switch 2 Monitors 3 Computers 4K@60Hz 2K@144Hz, 𝐄𝐃𝐈𝐃 𝐬𝐢𝐦𝐮𝐥𝐚𝐭𝐢𝐨𝐧, MLEEDA Dual Monitor KVM Switch HDMI for 3 Computers Share 2 Displays and 4 USB3.0 Port Keyboard Mouse Printer Switch",B0CQ6WTXGG,https://m.media-amazon.com/images/I/710LK7FrsJL._AC_UY218_.jpg,$98.98,True,,3.9 out of 5 stars,88
https://www.amazon.com/sspa/click?ie=UTF8&spc=MTozMjc2NTEzNzA3NjgwMDQyOjE3MDc3MDk4Mzk6c3BfYXRmX25leHQ6MjAwMTM0MTI1NzkwNjk4OjowOjo&url=%2FASUS-ROG-Wireless-Magnetic-Programmable%2Fdp%2FB09726KT4R%2Fref%3Dsr_1_258_sspa%3Fkeywords%3Dmouse%26qid%3D1707709839%26sr%3D8-258-spons%26sp_csd%3Dd2lkZ2V0TmFtZT1zcF9hdGZfbmV4dA%26psc%3D1,"ASUS ROG Spatha X Wireless Gaming Mouse (Magnetic Charging Stand, 12 Programmable Buttons, 19,000 DPI, Push-fit Hot Swap Switch Sockets, ROG Micro Switches&Paracord and Aura RGB lighting),Black",B09726KT4R,https://m.media-amazon.com/images/I/8167lxUe8SL._AC_UY218_.jpg,$109.99,True,,4.3 out of 5 stars,790
https://www.amazon.com/VEGCOO-C10-Wireless-Rechargeable-Optical/dp/B077TRZG6C/ref=sr_1_259?keywords=mouse&qid=1707709839&sr=8-259,"VEGCOO C10 Wireless Gaming Mouse Rechargeable Silent Optical Mice 7 Colors LED Lights, 7 Buttons 2400/1600/800DPI (Black)",B077TRZG6C,https://m.media-amazon.com/images/I/61OEE72w-PL._AC_UY218_.jpg,$14.99,True,,4.4 out of 5 stars,5427
https://www.amazon.com/Macally-Silent-Wired-Mouse-Comfortable/dp/B07HGSKRMG/ref=sr_1_260?keywords=mouse&qid=1707709839&sr=8-260,Macally Silent Wired Mouse - Slim & Compact USB Mouse for Apple Mac or Windows PC Laptop/Desktop - Designed with Optical Sensor & DPI Switch - Simple & Comfortable Wired Computer Mouse (White),B07HGSKRMG,https://m.media-amazon.com/images/I/518kfGoXdjS._AC_UY218_.jpg,$16.99,True,,4.5 out of 5 stars,4490
https://www.amazon.com/TechGarden-Wireless-Bluetooth-Receiver-MacBook/dp/B0BTYN6747/ref=sr_1_261?keywords=mouse&qid=1707709839&sr=8-261,"Wireless Bluetooth Mouse, Dual Mode (Bluetooth 4.0 + USB) Silent Bluetooth Wireless Mouse with USB Nano Receiver, 3 DPI Levels for Laptop, PC, MacBook, iPad, Tablet - Black",B0BTYN6747,https://m.media-amazon.com/images/I/51RqHPa4tXL._AC_UY218_.jpg,$13.99,True,,4.6 out of 5 stars,228
https://www.amazon.com/CHUYI-Wireless-Optical-Receiver-Computer/dp/B00U2JI2KY/ref=sr_1_262?keywords=mouse&qid=1707709839&sr=8-262,Cool SUV Car Shaped Wireless Mouse 1600 DPI Optical Cordless Mice with USB Receiver for Office School Travel for PC Computer Laptop Gift (Red-1 Pack),B00U2JI2KY,https://m.media-amazon.com/images/I/718X-UCjXzL._AC_UY218_.jpg,$12.99,True,,4.3 out of 5 stars,1043
https://www.amazon.com/YXLILI-Wireless-Ergonomic-Computer-Chromebook/dp/B09Y1F1Q6T/ref=sr_1_263?keywords=mouse&qid=1707709839&sr=8-263,"YXLILI Wireless Mouse for Laptop Ergonomic Computer Cordless Mice Portable Silent Optical Mouse with USB Receiver, 1600DPI for Laptop Windows Chromebook Mac Notebook Desktop (Purple)",B09Y1F1Q6T,https://m.media-amazon.com/images/I/51Z4f8+ctiL._AC_UY218_.jpg,$9.99,True,,4.6 out of 5 stars,643
https://www.amazon.com/MicroPack-Trackball-Ergonomic-Rollerball-Adjustable/dp/B0BRX75KQ1/ref=sr_1_264?keywords=mouse&qid=1707709839&sr=8-264,"MicroPack Wireless Trackball Mouse, 2023 New Upgrade Ergonomic Mouse with Wireless Vertical Rollerball Computer Mouse, 3 Adjustable DPI, Easy Thumb Control for PC, Laptop, Mac, Windows - Black",B0BRX75KQ1,https://m.media-amazon.com/images/I/511t06rhaHL._AC_UY218_.jpg,$29.99,True,,3.7 out of 5 stars,232
https://www.amazon.com/Redragon-Wireless-Bluetooth-Programmable-Rechargeable/dp/B0CH834X2K/ref=sr_1_265?keywords=mouse&qid=1707709839&sr=8-265,"Redragon Wireless Gaming Mouse, Tri-Mode 2.4G/USB-C/Bluetooth Mouse Gaming, 10000 DPI, RGB Backlit, Fully Programmable, Rechargeable Wireless Computer Mouse for Laptop PC Mac, White",B0CH834X2K,https://m.media-amazon.com/images/I/61Myax9ZLCL._AC_UY218_.jpg,$37.99,True,,4.5 out of 5 stars,757
https://www.amazon.com/Wireless-TDRTECH-Computer-Notebook-Laptop-Red/dp/B075PWPM7Q/ref=sr_1_266?keywords=mouse&qid=1707709839&sr=8-266,"Wireless Mouse, TDRTECH Cool Sports Car Shaped Mouse 2.4GHz Optical Gaming Mouse for Computer PC Notebook Laptop-Red",B075PWPM7Q,https://m.media-amazon.com/images/I/61-kjsa1QpL._AC_UY218_.jpg,$13.99,True,,4.3 out of 5 stars,580
https://www.amazon.com/sspa/click?ie=UTF8&spc=MTozMjc2NTEzNzA3NjgwMDQyOjE3MDc3MDk4Mzk6c3BfbXRmOjMwMDA2Mzk3MjE3MDYwMjo6MDo6&url=%2FSOLAKAKA-Honeycomb-Programmable-Lightweight-Ergonomic%2Fdp%2FB0CHNVBBLF%2Fref%3Dsr_1_267_sspa%3Fkeywords%3Dmouse%26qid%3D1707709839%26sr%3D8-267-spons%26sp_csd%3Dd2lkZ2V0TmFtZT1zcF9tdGY%26psc%3D1,"SM900 White Wired Gaming Mouse with Honeycomb Shell,12800 DPI,7 Programmable Buttons,Lightweight Gaming Mice Ergonomic Computer Mouse Gaming for Windows/PC/Mac/Laptop Gamer",B0CHNVBBLF,https://m.media-amazon.com/images/I/61wmkh+azPL._AC_UY218_.jpg,$19.89,True,,4.5 out of 5 stars,89
https://www.amazon.com/sspa/click?ie=UTF8&spc=MTozMjc2NTEzNzA3NjgwMDQyOjE3MDc3MDk4Mzk6c3BfbXRmOjMwMDEzNTExMTg4NTIwMjo6MDo6&url=%2FSOLAKAKA-Wireless-Tri-Modes-Rechargeable-Honeycomb%2Fdp%2FB0CRNSCQNM%2Fref%3Dsr_1_268_sspa%3Fkeywords%3Dmouse%26qid%3D1707709839%26sr%3D8-268-spons%26sp_csd%3Dd2lkZ2V0TmFtZT1zcF9tdGY%26psc%3D1,"SM600 Plus Wireless Gaming Mouse with Tri-Modes(BT5.1+2.4G+Wired),Rechargeable RGB Wireless Mouse with Honeycomb Shell,Side Buttons Computer Gaming Mice,Black",B0CRNSCQNM,https://m.media-amazon.com/images/I/61i3Lkz7fQL._AC_UY218_.jpg,$32.89,True,,4.6 out of 5 stars,3
https://www.amazon.com/Wireless-Receiver-Notebook-Computer-MacBook/dp/B083YYYYC3/ref=sr_1_269?keywords=mouse&qid=1707709839&sr=8-269,"Wireless Mouse with Nano Receiver for PC, Laptop, Notebook, Computer, MacBook, Less Noise, Portable Mobile Optical Mice",B083YYYYC3,https://m.media-amazon.com/images/I/51b16lt4ZkL._AC_UY218_.jpg,$12.49,True,,4.5 out of 5 stars,5683
https://www.amazon.com/Sabrent-Travel-Optical-Retractable-MS-OPMN/dp/B01MSJPX06/ref=sr_1_270?keywords=mouse&qid=1707709839&sr=8-270,SABRENT Mini Travel USB Optical Mouse with Retractable Cable (MS-OPMN),B01MSJPX06,https://m.media-amazon.com/images/I/61Iw-Xrrk5L._AC_UY218_.jpg,$7.99,True,,4.4 out of 5 stars,11981
https://www.amazon.com/LeadsaiL-Wireless-Cordless-Optical-Computer/dp/B09H3Z37DW/ref=sr_1_271?keywords=mouse&qid=1707709839&sr=8-271,"LeadsaiL Wireless Mouse for Laptop, 2.4GHz Silent USB Mouse, Slim Optical Mouse with 3 Buttons, 1600 DPI, Works with Windows, Mac, Chrome OS, Linux",B09H3Z37DW,https://m.media-amazon.com/images/I/51eicR8wFLL._AC_UY218_.jpg,$8.99,True,,4.6 out of 5 stars,1291
https://www.amazon.com/HP-Wireless-Mouse-Z3700-7UH87AA/dp/B084Z2F8T1/ref=sr_1_272?keywords=mouse&qid=1707709839&sr=8-272,"HP Wireless Mouse Z3700 (7UH87AA, Natural Silver)",B084Z2F8T1,https://m.media-amazon.com/images/I/41QDlSU6rSL._AC_UY218_.jpg,$16.68,False,,4.6 out of 5 stars,698
https://www.amazon.com/WFB-Bluetooth-Wireless-Rotating-Rechargeable/dp/B0885WYVZ1/ref=sr_1_273?keywords=mouse&qid=1707709839&sr=8-273,"Bluetooth Wireless Mouse for Laptop, Foldable Arc 180° Rotating Silent Click Portable Curved Computer Mice for Home, Office, Travel(Black)",B0885WYVZ1,https://m.media-amazon.com/images/I/41PG5lOTzIL._AC_UY218_.jpg,$32.98,True,,4.2 out of 5 stars,153
https://www.amazon.com/TECKNET-Bluetooth-Adjustable-Compatible-Chromebook/dp/B0BTBYBP9F/ref=sr_1_274?keywords=mouse&qid=1707709839&sr=8-274,"TECKNET Bluetooth Mouse, 3200 DPI Wireless Mouse (BT5.0 & 3.0) 5 Adjustable DPI, 6 Buttons and 2-Year Battery Computer Mouse Compatible with Laptop/Computer/Mac/Windows/Chromebook/Notebook",B0BTBYBP9F,https://m.media-amazon.com/images/I/61BmjPDTV8L._AC_UY218_.jpg,$14.99,True,,4.2 out of 5 stars,16942
https://www.amazon.com/seenda-Wireless-Bluetooth-Jiggler-Build/dp/B0C9DKMWYJ/ref=sr_1_275?keywords=mouse&qid=1707709839&sr=8-275,"seenda Wireless Mouse, Bluetooth Mouse with Jiggler - Multi-Device Light Up Mouse for Laptop with Build-in Jiggler Mover Compatible with Mac OS, Windows, Android Computers - Purple",B0C9DKMWYJ,https://m.media-amazon.com/images/I/61FXBan3fkL._AC_UY218_.jpg,$13.98,True,,4.3 out of 5 stars,75
https://www.amazon.com/Welspo-Wireless-Handheld-Trackball-Pointer/dp/B0BJZQX6CM/ref=sr_1_276?keywords=mouse&qid=1707709839&sr=8-276,Wireless USB Handheld Finger Trackball(Black) Mouse with Laser Pointer,B0BJZQX6CM,https://m.media-amazon.com/images/I/61jmsvPgkML._AC_UY218_.jpg,$29.99,False,,3.8 out of 5 stars,1798
https://www.amazon.com/sspa/click?ie=UTF8&spc=MTozMjc2NTEzNzA3NjgwMDQyOjE3MDc3MDk4Mzk6c3BfYnRmOjMwMDAzMjQxMDExNTAwMjo6MDo6&url=%2FWoddlffy-Computer-Mice-Red%2Fdp%2FB0B1CGHWML%2Fref%3Dsr_1_277_sspa%3Fkeywords%3Dmouse%26qid%3D1707709839%26sr%3D8-277-spons%26sp_csd%3Dd2lkZ2V0TmFtZT1zcF9idGY%26psc%3D1,"Ergonomic Mouse, Rechargeable Vertical Mouse Red Wireless Ergo Mouse with 6 Buttons 3 Adjustable 1000/1200/1600 DPI for Laptop,Desktop,PC,MacBook(Small Hand Right,Red)",B0B1CGHWML,https://m.media-amazon.com/images/I/61rHDDeVPuL._AC_UY218_.jpg,$23.99,True,,4.1 out of 5 stars,2154
https://www.amazon.com/sspa/click?ie=UTF8&spc=MTozMjc2NTEzNzA3NjgwMDQyOjE3MDc3MDk4Mzk6c3BfYnRmOjIwMDAyNDY5NTMzNjg2MTo6MDo6&url=%2FMemzuoix-Wireless-Portable-Receiver-Ergonomic%2Fdp%2FB07WCW1PB3%2Fref%3Dsr_1_278_sspa%3Fkeywords%3Dmouse%26qid%3D1707709839%26sr%3D8-278-spons%26sp_csd%3Dd2lkZ2V0TmFtZT1zcF9idGY%26psc%3D1,"memzuoix 2.4G Wireless Mouse, 1200 DPI Mobile Optical Cordless Mouse with USB Receiver, Portable Computer Mice for Laptop, PC, Desktop, MacBook, 5 Buttons, Red",B07WCW1PB3,https://m.media-amazon.com/images/I/615EiRgcwnL._AC_UY218_.jpg,$15.99,True,,4.5 out of 5 stars,14891
https://www.amazon.com/Mice-Jackie-Sonnenberg-ebook/dp/B09Z7BMT31/ref=sr_1_273?keywords=mouse&qid=1707710019&sr=8-273,Mice,B09Z7BMT31,https://m.media-amazon.com/images/I/91N7GWU5xKL._AC_UY218_.jpg,$0.00,True,,4.0 out of 5 stars,9
https://www.amazon.com/Bluetooth-JOYACCESS-Wireless-Computer-MacBook/dp/B08R5L497P/ref=sr_1_274?keywords=mouse&qid=1707710019&sr=8-274,"Bluetooth Mouse, J JOYACCESS 2.4G Wireless Bluetooth Mouse Dual Mode(Bluetooth 5.0/3.0+USB), Computer Mice for Laptop/Computer MacBook/Windows/MacOS/Android - Gray",B08R5L497P,https://m.media-amazon.com/images/I/519N4GNrHtL._AC_UY218_.jpg,$13.99,True,,4.3 out of 5 stars,1821
https://www.amazon.com/Sabrent-Travel-Optical-Retractable-MS-OPMN/dp/B01MSJPX06/ref=sr_1_275?keywords=mouse&qid=1707710019&sr=8-275,SABRENT Mini Travel USB Optical Mouse with Retractable Cable (MS-OPMN),B01MSJPX06,https://m.media-amazon.com/images/I/61Iw-Xrrk5L._AC_UY218_.jpg,$7.99,True,,4.4 out of 5 stars,11981
https://www.amazon.com/EVGA-Wireless-Customizable-Ergonomic-903-T1-20BK-KR/dp/B08VTN8Y7X/ref=sr_1_276?keywords=mouse&qid=1707710019&sr=8-276,"EVGA X20 Wireless Gaming Mouse, Wireless, Black, Customizable, 16,000 DPI, 5 Profiles, 10 Buttons, Ergonomic 903-T1-20BK-KR",B08VTN8Y7X,https://m.media-amazon.com/images/I/61g+8bcpo1L._AC_UY218_.jpg,$19.99,True,,4.2 out of 5 stars,769
https://www.amazon.com/Bluetooth-MacBook-Rechargeable-Wireless-Notebook/dp/B07WDN5SXD/ref=sr_1_277?keywords=mouse&qid=1707710019&sr=8-277,"Bluetooth Mouse for MacBook/MacBook air/Pro/iPad, Wireless Mouse for Laptop/Notebook/pc/iPad/Chromebook (Purple)",B07WDN5SXD,https://m.media-amazon.com/images/I/41Ukmuc0L-L._AC_UY218_.jpg,$14.99,True,,4.3 out of 5 stars,31452
https://www.amazon.com/YXLILI-Wireless-Ergonomic-Computer-Chromebook/dp/B09Y1F1Q6T/ref=sr_1_278?keywords=mouse&qid=1707710019&sr=8-278,"YXLILI Wireless Mouse for Laptop Ergonomic Computer Cordless Mice Portable Silent Optical Mouse with USB Receiver, 1600DPI for Laptop Windows Chromebook Mac Notebook Desktop (Purple)",B09Y1F1Q6T,https://m.media-amazon.com/images/I/51Z4f8+ctiL._AC_UY218_.jpg,$9.99,True,,4.6 out of 5 stars,643
https://www.amazon.com/Wireless-Receiver-Precision-Portable-Computer/dp/B0B1J1WC26/ref=sr_1_279?keywords=mouse&qid=1707710019&sr=8-279,"Wireless Mouse, 2.4G Silent Mouse with USB Receiver, 18 Month Battery Life, 1600 high DPI Precision- Portable Computer Mice for Windows/Mac/Linux, Black & Silver",B0B1J1WC26,https://m.media-amazon.com/images/I/51mCxo2k6nL._AC_UY218_.jpg,$7.99,True,,4.7 out of 5 stars,98
https://www.amazon.com/usb-c-mouse-mac/dp/B09YD8KY6D/ref=sr_1_280?keywords=mouse&qid=1707710019&sr=8-280,"Macally USB C Mouse Wired - Comfortable and Precise - USB Type C Mouse for MacBook Pro/Air, iMac, Mac Mini/Pro, iPad - Plug and Play Apple USBC Mouse with Ambidextrous Body, Multiple DPI",B09YD8KY6D,https://m.media-amazon.com/images/I/31L2kbsbN6L._AC_UY218_.jpg,$19.99,True,,4.4 out of 5 stars,507
https://www.amazon.com/MicroPack-Trackball-Ergonomic-Rollerball-Adjustable/dp/B0BRX75KQ1/ref=sr_1_281?keywords=mouse&qid=1707710019&sr=8-281,"MicroPack Wireless Trackball Mouse, 2023 New Upgrade Ergonomic Mouse with Wireless Vertical Rollerball Computer Mouse, 3 Adjustable DPI, Easy Thumb Control for PC, Laptop, Mac, Windows - Black",B0BRX75KQ1,https://m.media-amazon.com/images/I/511t06rhaHL._AC_UY218_.jpg,$29.99,True,,3.7 out of 5 stars,232
https://www.amazon.com/Microsoft-RVF-00052-Arc-Touch-Mouse/dp/B009CP4PIW/ref=sr_1_282?keywords=mouse&qid=1707710019&sr=8-282,Microsoft Arc Touch Mouse - BlueTrack - Wireless - Radio Frequency - 2.40 GHz - USB 2.0-1000 dpi - Touch Scroll - Symmetrical,B009CP4PIW,https://m.media-amazon.com/images/I/51lCHizMDfL._AC_UY218_.jpg,,False,,4.4 out of 5 stars,4868
https://www.amazon.com/Wireless-TDRTECH-Computer-Notebook-Laptop-Red/dp/B075PWPM7Q/ref=sr_1_283?keywords=mouse&qid=1707710019&sr=8-283,"Wireless Mouse, TDRTECH Cool Sports Car Shaped Mouse 2.4GHz Optical Gaming Mouse for Computer PC Notebook Laptop-Red",B075PWPM7Q,https://m.media-amazon.com/images/I/61-kjsa1QpL._AC_UY218_.jpg,$13.99,True,,4.3 out of 5 stars,580
https://www.amazon.com/Wireless-Receiver-Notebook-Computer-MacBook/dp/B083YYYYC3/ref=sr_1_284?keywords=mouse&qid=1707710019&sr=8-284,"Wireless Mouse with Nano Receiver for PC, Laptop, Notebook, Computer, MacBook, Less Noise, Portable Mobile Optical Mice",B083YYYYC3,https://m.media-amazon.com/images/I/51b16lt4ZkL._AC_UY218_.jpg,$12.49,True,,4.5 out of 5 stars,5683
https://www.amazon.com/YUMQUA-Optical-Computer-Adjustable-4-Button/dp/B082X1KFGS/ref=sr_1_285?keywords=mouse&qid=1707710019&sr=8-285,"G222 Silent Computer Mouse Wired 2 Pack, Home & Office Optical USB Mouse, 800/1200 DPI Corded Mouse for Laptop Desktop Computer PC Chromebook",B082X1KFGS,https://m.media-amazon.com/images/I/61AnZ1O7c3L._AC_UY218_.jpg,$13.98,True,,4.4 out of 5 stars,984
https://www.amazon.com/Bluetooth-Mouse-MacBook-Wireless-Macboook/dp/B09H2959B2/ref=sr_1_286?keywords=mouse&qid=1707710019&sr=8-286,"LED Bluetooth Mouse,Bluetooth Mouse for MacBook Pro/MacBook Air/iMac/mac/ipad/ipad pro,Wireless Mouse for Macboook Air/MacBook Pro/PC (Black)",B09H2959B2,https://m.media-amazon.com/images/I/51UHJVrdlJL._AC_UY218_.jpg,$14.99,True,,4.4 out of 5 stars,2863
https://www.amazon.com/Wireless-VEGCOO-Rechargeable-Receiver-Adjustable/dp/B09HWZL28Q/ref=sr_1_287?keywords=mouse&qid=1707710019&sr=8-287,"VEGCOO Wireless Gaming Mouse, Rechargeable Silent Wireless Mouse with 4800 DPI Adjustable,Double Click Key, Colorful RGB Lights, Computer Mice with Thumb Rest for PC/Mac Gamer (C26 Black)",B09HWZL28Q,https://m.media-amazon.com/images/I/61k-b0i5vDL._AC_UY218_.jpg,$14.99,True,,4.0 out of 5 stars,817
https://www.amazon.com/HP-Wireless-Mouse-Z3700-7UH87AA/dp/B084Z2F8T1/ref=sr_1_288?keywords=mouse&qid=1707710019&sr=8-288,"HP Wireless Mouse Z3700 (7UH87AA, Natural Silver)",B084Z2F8T1,https://m.media-amazon.com/images/I/41QDlSU6rSL._AC_UY218_.jpg,$16.68,False,,4.6 out of 5 stars,698
https://www.amazon.com/sspa/click?ie=UTF8&spc=MToxMzgzNjAwNDk2MTAwMDQyOjE3MDc3MTAxOTM6c3BfYXRmX25leHQ6MzAwMTI5MzI2MDMyNDAyOjowOjo&url=%2FMonitors-Computers-%25F0%259D%2590%2584%25F0%259D%2590%2583%25F0%259D%2590%2588%25F0%259D%2590%2583-%25F0%259D%2590%25AC%25F0%259D%2590%25A2%25F0%259D%2590%25A6%25F0%259D%2590%25AE%25F0%259D%2590%25A5%25F0%259D%2590%259A%25F0%259D%2590%25AD%25F0%259D%2590%25A2%25F0%259D%2590%25A8%25F0%259D%2590%25A7-MLEEDA%2Fdp%2FB0CQ6WTXGG%2Fref%3Dsr_1_289_sspa%3Fkeywords%3Dmouse%26qid%3D1707710193%26sr%3D8-289-spons%26sp_csd%3Dd2lkZ2V0TmFtZT1zcF9hdGZfbmV4dA%26psc%3D1,"KVM Switch 2 Monitors 3 Computers 4K@60Hz 2K@144Hz, 𝐄𝐃𝐈𝐃 𝐬𝐢𝐦𝐮𝐥𝐚𝐭𝐢𝐨𝐧, MLEEDA Dual Monitor KVM Switch HDMI for 3 Computers Share 2 Displays and 4 USB3.0 Port Keyboard Mouse Printer Switch",B0CQ6WTXGG,https://m.media-amazon.com/images/I/710LK7FrsJL._AC_UY218_.jpg,$98.98,True,,3.9 out of 5 stars,88
https://www.amazon.com/sspa/click?ie=UTF8&spc=MToxMzgzNjAwNDk2MTAwMDQyOjE3MDc3MTAxOTM6c3BfYXRmX25leHQ6MzAwMDMyNDEwMTE1MDAyOjowOjo&url=%2FWoddlffy-Computer-Mice-Red%2Fdp%2FB0B1CGHWML%2Fref%3Dsr_1_290_sspa%3Fkeywords%3Dmouse%26qid%3D1707710193%26sr%3D8-290-spons%26sp_csd%3Dd2lkZ2V0TmFtZT1zcF9hdGZfbmV4dA%26psc%3D1,"Ergonomic Mouse, Rechargeable Vertical Mouse Red Wireless Ergo Mouse with 6 Buttons 3 Adjustable 1000/1200/1600 DPI for Laptop,Desktop,PC,MacBook(Small Hand Right,Red)",B0B1CGHWML,https://m.media-amazon.com/images/I/61rHDDeVPuL._AC_UY218_.jpg,$23.99,True,,4.1 out of 5 stars,2154
https://www.amazon.com/Lenovo-USB-C-Compact-Wired-Mouse/dp/B09LRBWB5P/ref=sr_1_291?keywords=mouse&qid=1707710193&sr=8-291,"Lenovo 400 USB-C Compact Wired Mouse – Pocket Friendly Portable Mouse for Notebook or Large Computer Monitor, Black",B09LRBWB5P,https://m.media-amazon.com/images/I/41sd-YfKAmL._AC_UY218_.jpg,$6.99,True,,4.4 out of 5 stars,279
https://www.amazon.com/Arteck-Wireless-Receiver-Ergonomic-Rechargeable/dp/B0CB88TVMT/ref=sr_1_292?keywords=mouse&qid=1707710193&sr=8-292,Arteck 2.4G Wireless Mouse with Nano USB Receiver Ergonomic Right Hand Silent Clicking with Backward & Forward for Computer/Desktop/PC/Laptop and Windows 10/8/7 Build in Rechargeable Battery,B0CB88TVMT,https://m.media-amazon.com/images/I/61Onm0-HIhL._AC_UY218_.jpg,$13.99,True,,4.5 out of 5 stars,53
https://www.amazon.com/LeadsaiL-Wireless-Portable-Cordless-Adjustable/dp/B07C5RVGSZ/ref=sr_1_293?keywords=mouse&qid=1707710193&sr=8-293,"LeadsaiL Wireless Computer Mouse, 2.4G Portable Slim Cordless Mouse Less Noise for Laptop Optical Mouse with 6 Buttons, USB Mouse for Laptop, Deskbtop, MacBook (Grey)",B07C5RVGSZ,https://m.media-amazon.com/images/I/71v5j-TSFNL._AC_UY218_.jpg,$6.99,True,,4.4 out of 5 stars,14970
https://www.amazon.com/Microsoft-Bluetooth-Ergonomic-Mouse-222-00033/dp/B08J8B962R/ref=sr_1_294?keywords=mouse&qid=1707710193&sr=8-294,"Microsoft Bluetooth Ergonomic Mouse - Peach - with comfortable Ergonomic design, thumb rest, up to 15months battery life. Works with Bluetooth enabled PCs/Laptops Windows/Mac/Chrome computers",B08J8B962R,https://m.media-amazon.com/images/I/41mdkbYkMiL._AC_UY218_.jpg,$39.95,True,,4.4 out of 5 stars,2357
https://www.amazon.com/MSI-Clutch-GM08-Optical-Gaming/dp/B08DDLMGCY/ref=sr_1_295?keywords=mouse&qid=1707710193&sr=8-295,"MSI Clutch GM08 Gaming Mouse, 4200 DPI, Optical Sensor, 3 Adjustable Weights, Red LED Lighting, Symmetrical Design, Black",B08DDLMGCY,https://m.media-amazon.com/images/I/712ptyTCMfL._AC_UY218_.jpg,$16.48,True,,4.6 out of 5 stars,3107
https://www.amazon.com/Logitech-M187-Wireless-Mini-Mouse/dp/B008RN04BM/ref=sr_1_296?keywords=mouse&qid=1707710193&sr=8-296,Logitech M187 Wireless Mini Mouse,B008RN04BM,https://m.media-amazon.com/images/I/61nXxXTc6aL._AC_UY218_.jpg,$13.99,True,,4.5 out of 5 stars,521
https://www.amazon.com/FMOUSE-Computer-Wireless-Bluetooth-Rechargeable/dp/B0BM4WQS3L/ref=sr_1_297?keywords=mouse&qid=1707710193&sr=8-297,"Computer Mouse Wireless, Silent Mouse with RGB Lights Dual Mode 2.4G Wireless & Bluetooth 5.1 2400 DPI USB-C Rechargeable, Compact Mouse for PC Laptop Desktop (Green)",B0BM4WQS3L,https://m.media-amazon.com/images/I/61E2o4mO3pL._AC_UY218_.jpg,$15.99,True,,4.5 out of 5 stars,88
https://www.amazon.com/LeadsaiL-Computer-Wireless-Ergonomic-Adjustable/dp/B08JPXHYPL/ref=sr_1_298?keywords=mouse&qid=1707710193&sr=8-298,"LeadsaiL Wireless Mouse, 2.4GHz USB, Noiseless, Compact, Portable, 12 Months Battery Life",B08JPXHYPL,https://m.media-amazon.com/images/I/61j6Gc42feL._AC_UY218_.jpg,$8.99,True,,4.4 out of 5 stars,2520
https://www.amazon.com/sspa/click?ie=UTF8&spc=MToxMzgzNjAwNDk2MTAwMDQyOjE3MDc3MTAxOTM6c3BfbXRmOjMwMDEzNTExMTg4NTIwMjo6MDo6&url=%2FSOLAKAKA-Wireless-Tri-Modes-Rechargeable-Honeycomb%2Fdp%2FB0CRNSCQNM%2Fref%3Dsr_1_299_sspa%3Fkeywords%3Dmouse%26qid%3D1707710193%26sr%3D8-299-spons%26sp_csd%3Dd2lkZ2V0TmFtZT1zcF9tdGY%26psc%3D1,"SM600 Plus Wireless Gaming Mouse with Tri-Modes(BT5.1+2.4G+Wired),Rechargeable RGB Wireless Mouse with Honeycomb Shell,Side Buttons Computer Gaming Mice,Black",B0CRNSCQNM,https://m.media-amazon.com/images/I/61i3Lkz7fQL._AC_UY218_.jpg,$32.89,True,,4.6 out of 5 stars,3
https://www.amazon.com/sspa/click?ie=UTF8&spc=MToxMzgzNjAwNDk2MTAwMDQyOjE3MDc3MTAxOTM6c3BfbXRmOjMwMDA2Mzk3MjE3MDYwMjo6MDo6&url=%2FSOLAKAKA-Honeycomb-Programmable-Lightweight-Ergonomic%2Fdp%2FB0CHNVBBLF%2Fref%3Dsr_1_300_sspa%3Fkeywords%3Dmouse%26qid%3D1707710193%26sr%3D8-300-spons%26sp_csd%3Dd2lkZ2V0TmFtZT1zcF9tdGY%26psc%3D1,"SM900 White Wired Gaming Mouse with Honeycomb Shell,12800 DPI,7 Programmable Buttons,Lightweight Gaming Mice Ergonomic Computer Mouse Gaming for Windows/PC/Mac/Laptop Gamer",B0CHNVBBLF,https://m.media-amazon.com/images/I/61wmkh+azPL._AC_UY218_.jpg,$19.89,True,,4.5 out of 5 stars,89
https://www.amazon.com/Logitech-Customizable-SilentTouch-Technology-Multi-Device/dp/B09DVP5Q6Q/ref=sr_1_301?keywords=mouse&qid=1707710193&sr=8-301,"Logitech POP Mouse, Wireless optical Mouse with Customizable Emojis, SilentTouch Technology, Precision/Speed Scroll, Compact Design, Bluetooth, Multi-Device, OS Compatible - Blast Yellow",B09DVP5Q6Q,https://m.media-amazon.com/images/I/51Cp4EUcr2L._AC_UY218_.jpg,$19.99,True,,4.7 out of 5 stars,2467
https://www.amazon.com/Woddlffy-Computer-Mice-Green/dp/B0B1CF2FPM/ref=sr_1_302?keywords=mouse&qid=1707710193&sr=8-302,"Ergonomic Mouse,Rechargeable Wireless Mouse Vertical Mice with USB Receiver Small Mouse with 6 Buttons 1000/1200/1600 DPI Computer Mouse for Laptop PC(Blue)",B0B1CF2FPM,https://m.media-amazon.com/images/I/61WsflW4DHL._AC_UY218_.jpg,$23.99,True,,4.1 out of 5 stars,2154
https://www.amazon.com/KLIM-Rechargeable-Gaming-Mouse-Long-Lasting/dp/B0C5XZDB4G/ref=sr_1_303?keywords=mouse&qid=1707710193&sr=8-303,"KLIM Blaze X RGB + New Version 2024 + Rechargeable Wireless Gaming Mouse with Charging Dock + Long-Lasting Battery + Up to 12000 DPI + Wired & Wireless Mouse PC, PS5, PS4, Mac + White",B0C5XZDB4G,https://m.media-amazon.com/images/I/61RqS1CEy9L._AC_UY218_.jpg,$39.97,True,,4.6 out of 5 stars,213
https://www.amazon.com/Macally-Silent-Wired-Mouse-Comfortable/dp/B07HGSKRMG/ref=sr_1_304?keywords=mouse&qid=1707710193&sr=8-304,Macally Silent Wired Mouse - Slim & Compact USB Mouse for Apple Mac or Windows PC Laptop/Desktop - Designed with Optical Sensor & DPI Switch - Simple & Comfortable Wired Computer Mouse (White),B07HGSKRMG,https://m.media-amazon.com/images/I/518kfGoXdjS._AC_UY218_.jpg,$16.99,True,,4.5 out of 5 stars,4490
https://www.amazon.com/Aigeer-Wireless-Bluetooth-Mouse-Pink/dp/B0BKSRM4H8/ref=sr_1_305?keywords=mouse&qid=1707710193&sr=8-305,"Wireless Bluetooth Mouse USB C for MacBook Air Pro, Rechargeable Wireless Mouse Type C, Silent Bluetooth Mouse for iMac Pro Air/Surface Pro/Samsung/Tablet/iPhone",B0BKSRM4H8,https://m.media-amazon.com/images/I/51I9Bqvhp1L._AC_UY218_.jpg,$11.99,True,,4.3 out of 5 stars,690
https://www.amazon.com/Ergonomic-Precision-Vertical-Adjustable-Computer/dp/B074C5PQ8K/ref=sr_1_306?keywords=mouse&qid=1707710193&sr=8-306,Ergonomic Mouse High Precision Optical Vertical Mouse Adjustable DPI 800 / 1200 / 2400 / 3200 Wired Computer Mouse,B074C5PQ8K,https://m.media-amazon.com/images/I/61Fsj6-8e9L._AC_UY218_.jpg,$14.99,True,,4.1 out of 5 stars,259
https://www.amazon.com/SVJEFY-Bluetooth-Rechargeable-Ultra-Thin-Transparent/dp/B0CG9H6Q6T/ref=sr_1_307?keywords=mouse&qid=1707710193&sr=8-307,"3 Mode Wireless Bluetooth Mouse, Rechargeable Ultra-Thin Magnetic Mouse, 2400DPI Transparent Power Display, Silent Mouse for Phones/Tablets/Laptops/PC",B0CG9H6Q6T,https://m.media-amazon.com/images/I/71XCtrJvgKL._AC_UY218_.jpg,$15.69,True,,,1569
https://www.amazon.com/Perixx-PERIMICE-519-Wired-Ergonomic-Vertical/dp/B074P444QL/ref=sr_1_308?keywords=mouse&qid=1707710193&sr=8-308,Perixx PERIMICE-519 Wired Ergonomic Vertical Mouse - Portable Small Design - 105x67x58 mm - Right Handed Black,B074P444QL,https://m.media-amazon.com/images/I/51mitVpApFL._AC_UY218_.jpg,$19.99,True,,4.3 out of 5 stars,2925
https://www.amazon.com/sspa/click?ie=UTF8&spc=MToxMzgzNjAwNDk2MTAwMDQyOjE3MDc3MTAxOTM6c3BfYnRmOjIwMDE1NzIxMDE4MzI5ODo6MDo6&url=%2FWireless-Rechargeable-Bluetooth-Portable-Computer%2Fdp%2FB08SMQB6TF%2Fref%3Dsr_1_309_sspa%3Fkeywords%3Dmouse%26qid%3D1707710193%26sr%3D8-309-spons%26sp_csd%3Dd2lkZ2V0TmFtZT1zcF9idGY%26psc%3D1,"HOTLIFE LED Wireless Mouse, Slim Rechargeable Silent Portable USB Optical 2.4G Wireless Bluetooth Two Mode Computer Mice with USB Receiver and Type C Adapter (Black)",B08SMQB6TF,https://m.media-amazon.com/images/I/61U4Qj2jqmL._AC_UY218_.jpg,$10.86,True,,4.4 out of 5 stars,8861
