,url,name,asin,image,price,isPrime,offer,customerReview,customerReviewCount
0,https://www.amazon.com/Sceptre-Curved-Monitor-Speakers-C248W-1920RN/dp/B07KXSR99Y,"Sceptre Curved 24-inch Gaming Monitor 1080p R1500 98% sRGB HDMI x2 VGA Build-in Speakers, VESA Wall Mount Machine Black (C248W-1920RN Series)",‎1920 x 1080 Pixels,https://images-na.ssl-images-amazon.com/images/I/51qY 4ZLC9L.jpg,$89.97,,,4.6 out of 5 stars,19975
1,https://www.amazon.com/Sceptre-Business-Computer-Speakers-E248W-FPT/dp/B087QRW81Z,"Sceptre IPS 24-Inch Business Computer Monitor 1080p 75Hz with HDMI VGA Build-in Speakers, Machine Black (E248W-FPT)",‎1920 x 1080 Pixels,https://images-na.ssl-images-amazon.com/images/I/41lse4Rpe-L.jpg,$109.54,,,4.6 out of 5 stars,4415
2,https://www.amazon.com/G-STORY-Portable-Extender-11-6-16Inch-Workstation/dp/B0CJF31N48,"G-STORY 14"" Portable Dual Monitor for Laptop Screen Extender 1080P Full HD One USB-A Cable Connect for 11.6-16Inch Laptop Portable Workstation(Dual Screen)",G-STORY,https://images-na.ssl-images-amazon.com/images/I/41jpG24ZoWL.jpg,$129.99,,,4.6 out of 5 stars,22
3,https://www.amazon.com/ViewSonic-VS2247-MH-Monitor-Adaptive-Bezels/dp/B09JLGVL5K,"ViewSonic VS2247-MH 22 Inch 1080p Monitor with 75Hz, Adaptive Sync, Thin Bezels, Eye Care, HDMI, VGA Inputs for Home and Office, Black",‎1920 x 1080,https://images-na.ssl-images-amazon.com/images/I/41oTPTk4QNL.jpg,$89.99,,,4.4 out of 5 stars,181
4,https://www.amazon.com/MAGICRAVEN-2K-Portable-Monitor-14/dp/B0CJRS9QQN,"MAGICRAVEN 2K Portable Monitor, 14"" 3:2 IPS Laptop Monitor, Dual USB C HDMI Second Computer Screen, Gaming Display with 2 Speakers, Travel Monitor for Laptop PS4/5 PC Phone Xbox Switch",MAGICRAVEN,https://images-na.ssl-images-amazon.com/images/I/51TRhZtfzhL.jpg,$109.99,,,4.3 out of 5 stars,74
5,https://www.amazon.com/Sceptre-E248W-19203R-Monitor-Speakers-Metallic/dp/B0773ZY26F,"Sceptre 24-inch Professional Thin 1080p LED Monitor 99% sRGB 2x HDMI VGA Build-in Speakers, Machine Black (E248W-19203R Series)",‎1920 x 1080 Pixels,https://images-na.ssl-images-amazon.com/images/I/51phr7icbyL.jpg,$99.97$83.47,,,4.6 out of 5 stars,31358
6,https://www.amazon.com/Ingnok-Portable-Monitor-Display-Screen/dp/B0CP7XRW9S,"Ingnok Portable Monitor 15.6'' FHD IPS Display, A+Screen USB C HDMI Travel Monitor, Portable Screen for Laptop Mac PC Phone Xbox PS4/5 Switch",Ingnok,https://images-na.ssl-images-amazon.com/images/I/51MLIv0tcxL.jpg,$99.99,,,4.6 out of 5 stars,3
7,https://www.amazon.com/CRUA-1920%C3%971080p-Computer-Monitors-Dormitory/dp/B0CD3C2C4Z,"CRUA 24 Inch Curved Monitor, FHD(1920×1080p) 100HZ 99% sRGB Computer Monitors, LED Filter Blue Light 178° Wide Viewing Angle PC Monitor for Home, Office and Dormitory(HDMI, VGA)-White",womens,https://images-na.ssl-images-amazon.com/images/I/41vW 3nM2gL.jpg,$99.98,,,4.0 out of 5 stars,63
8,https://www.amazon.com/KOORUI-Computer-Adaptive-DisplayPort-Adjustability/dp/B0CC8XKK3N,"KOORUI Gaming Monitor, 27 inch WQHD 2560 x 1440 PC Computer Monitor, Up to 240Hz Refresh, 1ms, Adaptive Sync, HDR10, DCI-P3 90%, 144Hz Monitor, DisplayPort, HDMI, Tilt Adjustability, Black - GN05",KOORUI,https://images-na.ssl-images-amazon.com/images/I/51pQpqMf1VL.jpg,$223.99,,,4.3 out of 5 stars,3327
9,https://www.amazon.com/Samsung-27-Inch-Frameless-Monitor-LC27R500FHNXZA/dp/B07RNMNWSY,"SAMSUNG 27-Inch CR50 Frameless Curved Gaming Monitor (LC27R500FHNXZA) – 60Hz Refresh, Computer Monitor, 1920 x 1080p Resolution, 4ms Response, FreeSync, HDMI,Black",‎1920 x 1080 Pixels,https://images-na.ssl-images-amazon.com/images/I/41g1YW3mlmL.jpg,$168.21$138.99,,,4.6 out of 5 stars,1444
10,https://www.amazon.com/Kenowa-Computer-Monitor-Viewing-Desktop/dp/B0BYV9T1TN,"Kenowa 21.5 Inch Monitor, FHD IPS 1080P Monitor 75Hz 100% sRGB 178° Wide Viewing Angle PC Monitor, HDMI VGA Port, Low Blue Light Desktop Monitor Support VESA Mount, for Home and Office","Shenzhen Konowa Electronics Co., LTD",https://images-na.ssl-images-amazon.com/images/I/51dGN6ADbwL.jpg,$59.99,,,4.3 out of 5 stars,15
11,https://www.amazon.com/MNN-Portable-15-6inch-Ultra-Slim-Speakers/dp/B0B9NNWXVP,"MNN Portable Monitor 15.6inch FHD 1080P USB C HDMI Gaming Ultra-Slim IPS Display w/Smart Cover & Speakers,HDR Plug&Play, External Monitor for Laptop PC Phone Mac Xbox (15.6'' 1080P)",B0B9NNWXVP,https://images-na.ssl-images-amazon.com/images/I/513z-h8ZhaL.jpg,$98.96,,,4.6 out of 5 stars,4929
12,https://www.amazon.com/MSI-Pro-MP273AW-Protection-Displayport/dp/B0CDZHPX6Z,"MSI Pro MP273AW, 27"" Monitor, 1920 x 1080 (FHD), IPS, 100Hz, TUV Certified Eyesight Protection, 4ms, Displayport, HDMI, Tilt, White",‎1920 x 1080,https://images-na.ssl-images-amazon.com/images/I/41BL7mCR56L.jpg,['2 options from $196.98'],,,4.5 out of 5 stars,65
13,https://www.amazon.com/LG-28MQ780-B-DualUp-Monitor-DCI-P3/dp/B09XTD5C7H,"LG 28MQ780-B 28 Inch SDQHD (2560 x 2880) Nano IPS DualUp Monitor with Ergo Stand, DCI-P3 98% (Typ.) with HDR10, USB Type-C (90W PD) - Black",‎2560 x 2880,https://images-na.ssl-images-amazon.com/images/I/51omEyLEUwL.jpg,$589.99$491.04,,,4.5 out of 5 stars,368
14,https://www.amazon.com/Ebmiiprx-Monitor-FreeSync-Adjustable-Display/dp/B0CDM941FG,"Acer CB272U Ebmiiprx 27"" WQHD 2560 x 1440 Home Office Monitor | AMD FreeSync | 1ms VRB | 100Hz | Zero Frame | Height Adjustable Stand with Swivel, Tilt & Pivot (Display Port 1.2 & 2 x HDMI 2.0 Ports)",‎2560 x 1440,https://images-na.ssl-images-amazon.com/images/I/41yjwNYo-EL.jpg,$169.99,,,5.0 out of 5 stars,1
15,https://www.amazon.com/KOORUI-Computer-Adaptive-Compatible-27E6C/dp/B0CC1BMM7W,"KOORUI Curved 27 Inch Gaming Monitor, Full HD 1080p R1800 165Hz VA Computer Monitor, 100% sRGB, Built-in Adaptive Sync, 1 x Display Port 1.2 & 2 x HDMI 1.4, Eye Care, VESA Compatible, Black 27E6C",KOORUI,https://images-na.ssl-images-amazon.com/images/I/51FL0F0qUvL.jpg,$139.99,,,4.4 out of 5 stars,2668
16,https://www.amazon.com/Sceptre-Monitor-Speakers-Edge-Less-C275W-1920RN/dp/B07MTRQ6B3,"Sceptre Curved 27"" FHD 1080p 75Hz LED Monitor HDMI VGA Build-In Speakers, EDGE-LESS Metal Black 2019 (C275W-1920RN)",‎1920 x 1080 Pixels,https://images-na.ssl-images-amazon.com/images/I/51VHKs2fYsL.jpg,$114.79,,,4.6 out of 5 stars,14604
17,https://www.amazon.com/BenQ-GW2780-Optimized-Brightness-Technology/dp/B072XFFQ4K,"BenQ GW2780 Computer Monitor 27"" FHD 1920x1080p | IPS | Eye-Care Tech | Low Blue Light | Anti-Glare | Adaptive Brightness | Tilt Screen | Built-In Speakers | DisplayPort | HDMI | VGA",‎1920x1080 Pixels,https://images-na.ssl-images-amazon.com/images/I/41f1y0Lx--L.jpg,$129.99$103.95,,,4.7 out of 5 stars,18354
18,https://www.amazon.com/Ebmihux-Ultra-Thin-Monitor-FreeSync-Adjustable/dp/B0CD8PGL5G,"Acer SH242Y Ebmihux 23.8"" Full HD 1920 x 1080 Home Office Ultra-Thin Monitor AMD FreeSync 1ms VRB 100Hz Zero Frame Height Adjustable Stand with Swivel & Tilt (USB Type-C & HDMI 1.4 Ports)",‎1920 x 1080,https://images-na.ssl-images-amazon.com/images/I/41xeFSqQG6L.jpg,$129.99,,,4.6 out of 5 stars,42082
19,https://www.amazon.com/Z-Edge-30-inch-Curved-Gaming-Monitor/dp/B08H5K5QYX,"Z-Edge 30 inch 144Hz/200Hz Curved Gaming Monitor, 1080P Computer Monitor, UG30 21:9 Ultra Wide, 1500R/1ms MPRT, Frameless/Slim PC Monitor with HDMI/DP Display Port, Freesync Compatible, VESA",B08H5K5QYX,https://images-na.ssl-images-amazon.com/images/I/51qFniipLIL.jpg,$209.99$191.75,,,4.3 out of 5 stars,528
20,https://www.amazon.com/Sceptre-Monitor-Speakers-Machine-E225W-FPT/dp/B0B4Q16HBS,"Sceptre IPS 22 inch 1080p Gaming Monitor 75Hz HDMI x2 99% sRGB up to 320 Lux Blue Light Filter Build-in Speakers, Machine Black (E225W-FPT Series)",‎1920 x 1080 Pixels,https://images-na.ssl-images-amazon.com/images/I/41dAIfPYxJL.jpg,$89.97,,,4.6 out of 5 stars,531
21,https://www.amazon.com/ZSCMALLS-Portable-Monitor-Laptop-Extended/dp/B0CCV7MV1Y,"ZSCMALLS 4K Portable Monitor, 15.6"" 3840 * 2160 Laptop Extended Monitor, 1500:1 100% sRGB USB-C HDMI Portable Gaming Monitor HDR Travel Monitor with Speakers & Smart for Laptop PS5/4 Xbox Switch",ZSCMALLS,https://images-na.ssl-images-amazon.com/images/I/51C19ZS jXL.jpg,$269.99,,,4.3 out of 5 stars,5313
22,https://www.amazon.com/domyfan-Extender-Portable-Rotation-Compatible/dp/B0C96K8V7G,"domyfan Triple Laptop Screen Extender, 14"" Portable Monitor for Laptop, FHD 1080P IPS Laptop Monitor Extender, 360° Rotation Screen Travel Monitor Laptops, Compatible with Mac/Android/Win",domyfan,https://images-na.ssl-images-amazon.com/images/I/51Bj4kKQFoL.jpg,$399.99,,,4.5 out of 5 stars,319
23,https://www.amazon.com/AOC-Q32V3S-2560x1440-Monitor-Coverage/dp/B099P386QD,"AOC Q32V3S 32"" 2560x1440 2K QHD monitor, IPS Panel, 75Hz refresh rate for casual gaming, 103% sRGB Coverage, VESA, HDMI/DP Ports,Black",‎2560 x 1440 Pixels,https://images-na.ssl-images-amazon.com/images/I/31m68MyCDjL.jpg,$199.99,,,4.3 out of 5 stars,2931
24,https://www.amazon.com/Dell-S3221QS-Ultra-Thin-DisplayPort-Certified/dp/B08G8WMRRP,"Dell S3221QS 32 Inch Curved 4K UHD, VA Ultra-Thin Bezel Monitor, AMD FreeSync, HDMI, DisplayPort, Built in Speakers, VESA Certified, Silver",‎3840 x 2160 Pixels,https://images-na.ssl-images-amazon.com/images/I/41NtJp6JdBL.jpg,$319.99,,,4.4 out of 5 stars,3126
25,https://www.amazon.com/SB242Y-Hbi-Zero-Frame-Technology-Ultra-Thin/dp/B0BS9TD2LD,"Acer SB242Y Hbi 23.8"" Full HD (1920 x 1080) Zero-Frame Gaming Office Monitor | AMD FreeSync Technology | Ultra-Thin Stylish Design | 100Hz | 1ms (VRB) | Low Blue Light | Tilt | HDMI & VGA Ports",‎1920 x 1080 Pixels,https://images-na.ssl-images-amazon.com/images/I/41HF OH17nL.jpg,$127.99,,,4.5 out of 5 stars,2846
26,https://www.amazon.com/ASUS-VG32VQ1B-Supports-Adaptive-sync-DisplayPort/dp/B088MKF848,"ASUS TUF Gaming 32"" 1440P HDR Curved Monitor (VG32VQ1B) - QHD (2560 x 1440), 165Hz (Supports 144Hz), 1ms, Extreme Low Motion Blur, Speaker, FreeSync Premium, VESA Mountable, DisplayPort, HDMI,BLACK",‎2560 x 1440 Pixels,https://images-na.ssl-images-amazon.com/images/I/51PpeycLF6L.jpg,$292.99$239.93,,,4.6 out of 5 stars,7549
27,https://www.amazon.com/Wstirhy-27-Inch-1080p-1920-Monitor/dp/B0CQ49TN8H,"Wstirhy 27-Inch FHD 1080p (1920 x 1080) Monitor, 16:9, 60Hz, IPS Panel, 99% sRGB, HDMI & VGA Port, 5ms Response, VESA Compatible, 178° Wide Viewing Angle, for Computer Xbox, Black",Wstirhy,https://images-na.ssl-images-amazon.com/images/I/41WRsYfAQgL.jpg,$109.90,,,,0
28,https://www.amazon.com/Monitor-Randy-Craig-Mystery-Book-ebook/dp/B00EVIW47E,The Monitor (A Randy Craig Mystery Book 3),"‎ August 29, 2013",https://m.media-amazon.com/images/I/810YuWJwe+L._SY466_.jpg,$9.99,,,3.6 out of 5 stars,10
29,https://www.amazon.com/Dell-22-Inch-LED-Lit-Certified-Refurbished/dp/B00UJVIX3Q,Dell P2214H IPS 22-Inch Screen LED-Lit Monitor Renewed,Dell Computers,https://images-na.ssl-images-amazon.com/images/I/314f66DIn5L.jpg,$89.98 - $79.99,,,4.3 out of 5 stars,117
30,https://www.amazon.com/ASUS-Gaming-1440P-Monitor-VG27AQ3A/dp/B0BZR9TMBJ,"ASUS TUF Gaming 27” 1440P HDR Monitor (VG27AQ3A) – QHD (2560 x 1440), 180Hz, 1ms, Fast IPS, 130% sRGB, Extreme Low Motion Blur Sync, Speakers, Freesync Premium, G-SYNC Compatible, HDMI, DisplayPort",‎2560 x 1440 Pixels,https://images-na.ssl-images-amazon.com/images/I/413W73QJxBL.jpg,$250.12,,,4.6 out of 5 stars,3893
31,https://www.amazon.com/Gawfolk-Computer-Monitors-DisplayPort-Mountable/dp/B0CMZT9KD4,Gawfolk 32 inch Curved Gaming Monitor 144hz/240hz 1500R FHD(1980 * 1020p) Computer Monitors with FreeSync DisplayPort HDMI ，Wall Mountable,"Shenzhen Qinghong Zhuoyue Technology Co., Ltd.",https://images-na.ssl-images-amazon.com/images/I/51x-ke5zfvL.jpg,$229.99,,,4.3 out of 5 stars,808
32,https://www.amazon.com/KTC-FreeSync-120-sRGB-DisplayPort-Computer/dp/B0CHRC5W6Z,"KTC 27 inch Curved Gaming Monitor, 165Hz 1ms MPRT, 2K 1440P 144Hz Monitor, 1500R HVA Display, FreeSync Premium, HDR, 120%sRGB, DisplayPort/HDMI/USB, Vesa Support 3.9x3.9'', Computer Monitor for Gamers",KTC,https://images-na.ssl-images-amazon.com/images/I/41xfCid7DmL.jpg,$229.99,,,4.3 out of 5 stars,141
33,https://www.amazon.com/Pixio-Advanced-Supported-Esports-Adaptive/dp/B0CLBC9VRZ,"Pixio PX259 Advanced White 25"" 260Hz (144Hz Supported) FHD 1080p 1ms GTG VA Esports White Gaming Monitor with Adaptive Sync",Pixio,https://images-na.ssl-images-amazon.com/images/I/411v059GgGL.jpg,$229.99,,,4.4 out of 5 stars,535
34,https://www.amazon.com/SAMSUNG-ViewFinity-Ultrawide-Borderless-LS34C50DGANXZA/dp/B0C6LSD69F,"SAMSUNG 34"" ViewFinity S50GC Series Ultrawide QHD Monitor, 100Hz, 5ms, HDR10, AMD FreeSync, Eye Care, Borderless Design, PIP, PBP, LS34C50DGANXZA, 2023, Black",‎3440X1440 Pixels,https://images-na.ssl-images-amazon.com/images/I/41SeInBpm9L.jpg,$346.66,,,4.4 out of 5 stars,2192
35,https://www.amazon.com/Sunny-Health-Fitness-Stepper-Resistance/dp/B0016BQFSS,Sunny Health & Fitness Mini Stepper for Exercise Low-Impact Stair Step Cardio Equipment with Digital Monitor,Alloy Steel,https://images-na.ssl-images-amazon.com/images/I/31MCkASK0wL.jpg,$69.99,,,4.4 out of 5 stars,28875
36,https://www.amazon.com/Acer-Monitor-FreeSync-ZeroFrame-Mbmiiphx/dp/B0B6JWXZZP,"Nitro by Acer 27"" Full HD 1920 x 1080 1500R Curve PC Gaming Monitor | AMD FreeSync Premium | 165Hz Refresh | 1ms (VRB) | ZeroFrame Design | 1 x Display Port 1.4 & 2 x HDMI 2.0 Ports ED270R Mbmiiphx",‎1920 x 1080,https://images-na.ssl-images-amazon.com/images/I/41pxuI4292L.jpg,$149.99,,,4.6 out of 5 stars,1638
37,https://www.amazon.com/SANSUI-Computer-Frame-Less-Compatible-ES-24X5AL/dp/B0CD253J1Q,"SANSUI Computer Monitor 24 inch IPS Eye Care 1080P Display HDMI,VGA Ports with 178° Viewing Angle/Frame-Less/Tilt/VESA Compatible for Office and Home(ES-24X5AL)",SANSUI,https://images-na.ssl-images-amazon.com/images/I/510wZXsOkkL.jpg,$75.99,,,4.5 out of 5 stars,752
38,https://www.amazon.com/BenQ-MOBIUZ-EX3410R-WQHD-Built/dp/B09NF2QL9W,"BenQ MOBIUZ EX3410R Curved Gaming Monitor 34"" 2K 1440p 144Hz 1ms w/Remote | HDRi | 1000R | Color Optimizer | Freesync Premium Pro | Eye-Care | Height, Swivel & Tilt | 2.1ch w/ 5w Sub | USB Hub",‎3440 x 1440,https://images-na.ssl-images-amazon.com/images/I/41EHbp8EP0L.jpg,$449.99,,,4.4 out of 5 stars,121
39,https://www.amazon.com/SAMSUNG-DisplayHDR-FreeSync-Streaming-LS34BG850SNXZA/dp/B0BLF2RWNV,"SAMSUNG 34"" Odyssey G85SB Series QD-OLED Ultra WQHD Curved Gaming Monitor, 175Hz, 0.03ms, DisplayHDR True Black 400, AMD FreeSync Premium Pro, Advanced Game Streaming, LS34BG850SNXZA, 2023","‎3,440 x 1,440 Pixels",https://images-na.ssl-images-amazon.com/images/I/41is3GaiQEL.jpg,$802.48$793.91,,,4.3 out of 5 stars,7328
40,https://www.amazon.com/ASUS-ZenScreen-Portable-Touchscreen-MB14AHD/dp/B09XJNMVCK,"ASUS ZenScreen Ink 14” 1080P Portable Touchscreen Monitor (MB14AHD) - Full HD, IPS, 10-point touch, Stylus Pen (MPP 2.0), Eye Care, USB Type-C, Micro HDMI, Kickstand, Tripod Mountable, 3-Year Warranty",‎1920 x 1080 Pixels,https://images-na.ssl-images-amazon.com/images/I/41TgmM6fj4L.jpg,$290.43$253.25,,,4.5 out of 5 stars,2664
41,https://www.amazon.com/SANSUI-Computer-Ultra-Slim-Ergonomic-ES-22F1/dp/B0B49JWRBZ,"SANSUI Monitor 22 inch 1080p FHD 75Hz Computer Monitor with HDMI VGA, Ultra-Slim Bezel Ergonomic Tilt Eye Care LED Display for Home Office (ES-22F1 HDMI Cable Included)",SANSUI,https://images-na.ssl-images-amazon.com/images/I/51D2Qh6OlaL.jpg,$69.18,,,4.3 out of 5 stars,2620
42,https://www.amazon.com/ElecLab-Raspberry-Touchscreen-Capacitive-1280x400/dp/B09YJ37SBH,ElecLab 7.4 Inch 1280x400 Touchscreen Monitor HDMI Capacitive LCD Display Speaker Case for RPI 4B 3B+ 3B 3A+ 2B B+,ElecLab,https://images-na.ssl-images-amazon.com/images/I/31cuXQyYQqL.jpg,$39.99,,,3.8 out of 5 stars,70
43,https://www.amazon.com/LG-24GQ50F-B-Ultragear-Reduction-Borderless/dp/B09XVLVRWD,"LG 24GQ50F-B 24-Inch Class Full HD (1920 x 1080) Ultragear Gaming Monitor with 165Hz Refresh Rate and 1ms MBR, AMD FreeSync Premium and 3-Side Virtually Borderless Design,Black",‎1920 x 1080 Pixels,https://images-na.ssl-images-amazon.com/images/I/41u3zqN5ZyL.jpg,$129.99,,,4.6 out of 5 stars,2507
44,https://www.amazon.com/SAMSUNG-Monitor-Streaming-Connectivity-LS32CM501ENXZA/dp/B0C3WNPLF7,"SAMSUNG 32"" M50C Series FHD Smart Monitor w/Streaming-TV, 4ms, 60Hz, HDMI, HDR10, Watch Netflix, YouTube and More, IoT Hub, Mobile Connectivity, LS32CM501ENXZA, White","‎1,920 x 1,080 Pixels",https://images-na.ssl-images-amazon.com/images/I/51Ki8MQmEqL.jpg,$249.99,,,4.2 out of 5 stars,459
45,https://www.amazon.com/Sceptre-24-5-inch-DisplayPort-FreeSync-E255B-FWD240/dp/B0CN1RDB18,"Sceptre New 24.5-inch Gaming Monitor 240Hz 1ms DisplayPort x2 HDMI x2 100% sRGB AMD FreeSync Premium Build-in Speakers, Machine Black 2024 (E255B-FWD240 Series)",‎1920 x 1080 Pixels,https://images-na.ssl-images-amazon.com/images/I/51jlcOjAkRL.jpg,$134.80,,,4.3 out of 5 stars,12
46,https://www.amazon.com/Dell-UltraSharp-24-Inch-Certified-Refurbished/dp/B00UVY63M4,Dell UltraSharp U2414H 24-Inch Screen LED LCD Monitor (Renewed),Dell Computers,https://images-na.ssl-images-amazon.com/images/I/31mV6TmTmgL.jpg,$114.99,,,3.1 out of 5 stars,26
47,https://www.amazon.com/sharanix-Extender-Portable-Plug-Play-Compatible/dp/B0CQ7P7GX3,"sharanix Laptop Screen Extender,14'' Dual Screen Laptop Monitor Extender,FHD 1080P IPS Portable Monitor for 13''to17'' Laptop,USB/Type-C/HDMI Ports Plug-Play,Compatible with Win/Mac/Android/Switch",Sharanix,https://images-na.ssl-images-amazon.com/images/I/51ZDNOZwiXL.jpg,$199.99,,,5.0 out of 5 stars,11
48,https://www.amazon.com/Dell-E2020H-20IN-Monitor/dp/B084BV1WZW,"Dell 20 E2020H 19.5-inch 60Hz Small Thin Monitor for Laptop, Computer & Desktop, HD+ 1600 x 900p, Anti Glare, LED Display, VGA/Displayport Connectivity - Black",‎1600x900,https://images-na.ssl-images-amazon.com/images/I/51vdGlpyRDL.jpg,$89.95,,,4.4 out of 5 stars,71
49,https://www.amazon.com/LG-28MQ750-C-DualUp-Monitor-Height/dp/B0BSLX8H3T,"LG 28MQ750-C 28 Inch SDQHD (2560 x 2880) Nano IPS DualUp Monitor with Tilt/Height/Swivel Stand, DCI-P3 98% (Typ.) HDR10, USB Type-C (90W PD) - Black",‎2560 x 2880,https://images-na.ssl-images-amazon.com/images/I/51wHcbIlk L.jpg,$546.99$483.60,,,4.5 out of 5 stars,368
50,https://www.amazon.com/Feiasia-Portable-Monitor-Computer-Speakers/dp/B09XQL6BNK,Feiasia Portable Monitor Extremely Slim&Lightweight 15.6 Inch 1080P USB-C Laptop HDMI Computer Display Gaming Monitor with Smart Cover&Speakers Travel Monitor for PC Mac Phone Switch,Feiasia,https://images-na.ssl-images-amazon.com/images/I/51oIB-tQ-lL.jpg,$129.99,,,4.4 out of 5 stars,622
51,https://www.amazon.com/ViewSonic-VX2428-FreeSync-Frameless-DisplayPort/dp/B0BZTCY4G6,"ViewSonic Omni VX2428 24 Inch Gaming Monitor 180hz 0.5ms 1080p IPS with FreeSync Premium, Frameless, HDMI, and DisplayPort, Black",‎1920 x 1080,https://images-na.ssl-images-amazon.com/images/I/31GsF50BQfL.jpg,$109.99,,,4.3 out of 5 stars,51
52,https://www.amazon.com/ViewSonic-VX2467-MHD-Monitor-Ultra-Thin-FreeSync/dp/B09B15ZJF6,"ViewSonic VX2467-MHD 24 Inch 1080p Gaming Monitor with 75Hz, 1ms, Ultra-Thin Bezels, FreeSync, Eye Care, HDMI, VGA, and DP, Black",‎1920 x 1080 Pixels,https://images-na.ssl-images-amazon.com/images/I/41C4knPt9XL.jpg,$105.18,,,4.1 out of 5 stars,33
53,https://www.amazon.com/LG-29WN600-W-29-21-UltraWide/dp/B0876DBCBX,"LG UltraWide WFHD 29-Inch FHD 1080p Computer Monitor 29WN600-W, IPS with HDR 10 Compatibility, Silver",‎2560 x 1080 Pixels,https://images-na.ssl-images-amazon.com/images/I/31Be2F8IZ-L.jpg,$199.99,,,4.6 out of 5 stars,4406
54,https://www.amazon.com/HP-FreeSync-Docztorm-1920x1080-Anti-Glare/dp/B0CNM67PVW,"HP M22f 22” 1080P FreeSync Monitor 2D9J9AA#ABA Bundle with Docztorm Dock, 22"" IPS FHD (1920x1080) 75Hz Anti-Glare Display, HDMI, VGA, Ideal for Home & Business, Black & Silver (2023 Latest Model)",HP,https://images-na.ssl-images-amazon.com/images/I/41eP44qMVML.jpg,$129.99,,,1.0 out of 5 stars,1
55,https://www.amazon.com/Sceptre-DisplayPort-FreeSync-Speakers-E275B-FPT165/dp/B08WWKJGDV,"Sceptre 27-inch FHD 1080p IPS Gaming LED Monitor up to 165Hz 144Hz 1ms DisplayPort HDMI, FreeSync FPS RTS Build-in Speakers Gunmetal Black 2022 (E275B-FPT165)",‎1920 x 1080 Pixels,https://images-na.ssl-images-amazon.com/images/I/415VTvsD0iL.jpg,$129.99,,,4.5 out of 5 stars,1638
56,https://www.amazon.com/LG-34WP60C-B-34-Inch-UltraWide-Borderless/dp/B09XTNY742,"LG 34WP60C-B 34-Inch 21:9 Curved UltraWide QHD (3440x1440) VA Display with sRGB 99% Color Gamut and HDR 10, AMD FreeSync Premium and 3-Side Virtually Borderless Screen Curved QHD Tilt,Black",LG,https://images-na.ssl-images-amazon.com/images/I/41LPw TWTlL.jpg,$303.00,,,4.5 out of 5 stars,353
57,https://www.amazon.com/UPERFECT-Portable-Monitor-2560x1440P-Speakers/dp/B0CGV8NSWM,"UPERFECT 2K 144Hz Portable Monitor 17.3 Inch 2560x1440P Portable Gaming Monitor Travel Monitor for Laptop HDR IPS Screen with VESA, Cover Stand, Dual Speakers for PC Phone Game Console Steam Deck",UPERFECT,https://images-na.ssl-images-amazon.com/images/I/519 u2ZRqTL.jpg,$249.98,,,4.5 out of 5 stars,431
58,https://www.amazon.com/KOORUI-Computer-Mountable-Ergonomic-Adjustment/dp/B0CB3QW2GQ,"KOORUI 24 Inch Computer Monitor, Build-in Speakers, FHD 1080p IPS 100Hz, 75 x 75 mm VESA Mountable, Adpitive Sync, Eye Care and Ergonomic Tilt Adjustment",KOORUI,https://images-na.ssl-images-amazon.com/images/I/415maHIU6tL.jpg,$84.97,,,4.3 out of 5 stars,412
59,https://www.amazon.com/KC242Y-Hbi-Zero-Frame-FreeSync-Technology/dp/B0BS9T3FNB,"Acer KC242Y Hbi 23.8"" Full HD (1920 x 1080) Zero-Frame Gaming Office Monitor | AMD FreeSync Technology | 100Hz | 1ms (VRB) | Low Blue Light | Tilt | HDMI & VGA Ports,Black",‎1920 x 1080 Pixels,https://images-na.ssl-images-amazon.com/images/I/41LxjLPpozL.jpg,['2 options from $149.98'],,,4.5 out of 5 stars,4399
60,https://www.amazon.com/Dell-Dual-Screen-Productivity-Switching-Connectivity/dp/B0C8LM4ZZD,"Dell 14-Inch FHD LED Portable Monitor with Dual-Screen Productivity, in-Plane Switching, USB-C Connectivity, Low Blue Light, and Display Manager Software",‎1920 x 1080 Pixels,https://images-na.ssl-images-amazon.com/images/I/51e7ssTp3LL.jpg,$199.99,,,5.0 out of 5 stars,14
61,https://www.amazon.com/acer-Predator-V3bmiiprx-FreeSync-Agile-Splendor/dp/B0CJVK8PF5,"acer Predator XB273U V3bmiiprx 27"" WQHD 2560 x 1440 Gaming Monitor | AMD FreeSync Premium | Agile-Splendor IPS 400 | Up to 180Hz Refresh Rate | Up to 0.5ms | Eyesafe 2.0 | Display Port & 2 x HDMI 2.0",‎2560 x 1440,https://images-na.ssl-images-amazon.com/images/I/31Sm9CkvzCL.jpg,$199.99,,,4.4 out of 5 stars,882
62,https://www.amazon.com/2-5K-Portable-Monitor-2520x1680%EF%BC%8C-1500/dp/B0BTLTY27M,"2.5K Portable Gaming Monitor, 16"" 2520x1680 1500:1 IPS Laptop Monitor, Slim Lightweight USB C HDMI Computer Display, Gaming Screen with Speakers, Travel Monitor for Mac PC Phone PS4/5 Xbox Switch",MAGICRAVEN,https://images-na.ssl-images-amazon.com/images/I/41eXipFJAtL.jpg,$149.99,,,4.5 out of 5 stars,365
63,https://www.amazon.com/PHILIPS-34E1C5600HE-UltraWide-QHD-Built/dp/B0BQQ7H8TZ,"PHILIPS 34E1C5600HE 34"" UltraWide QHD 21:9 Monitor with Built-in Windows Hello Webcam & Noise Canceling Mic, USB-C Docking, Stereo Speakers, 100Hz, 4-Year Advance Replacement",‎3440 x 1440 Pixels,https://images-na.ssl-images-amazon.com/images/I/41PcPtsxPpL.jpg,$351.64,,,4.5 out of 5 stars,4552
64,https://www.amazon.com/Acer-Monitor-FreeSync-Technology-ZeroFrame/dp/B0B6DFG1FQ,"Acer Nitro KG241Y Sbiip 23.8” Full HD (1920 x 1080) VA Gaming Monitor | AMD FreeSync Premium Technology | 165Hz Refresh Rate | 1ms (VRB) | ZeroFrame Design | 1 x Display Port 1.2 & 2 x HDMI 2.0,Black",‎1920 x 1080,https://images-na.ssl-images-amazon.com/images/I/41t-fpXCUUL.jpg,$109.99,,,4.5 out of 5 stars,4867
65,https://www.amazon.com/wisecoco-No-Cable-Needed-Dual-Speaker-Touchscreen-Drive-Free/dp/B0C7BYHN5C,wisecoco No-Cable-Needed Dual-Speaker with OSD 10.1 inch Raspberry Pi LCD Touch Screen Portable Monitor IPS 1024 * 600 HDMI Touchscreen Display for RPi 4B 4 3b+ 3 2 Zero B B+ Windows Drive-Free,wisecoco,https://images-na.ssl-images-amazon.com/images/I/51U3ZWABaIL.jpg,$71.99,,,4.0 out of 5 stars,24
66,https://www.amazon.com/LG-45GR65DC-B-UltragearTM-DisplayHDRTM-DisplayPort/dp/B0CF6RXZJX,"LG 45GR65DC-B 45"" Ultragear™ QHD 1ms 200Hz Curved Gaming Monitor with VESA DisplayHDR™ 600 (DisplayPort,HDMI), Black",‎5120 x 1440,https://images-na.ssl-images-amazon.com/images/I/41bkzJ4oKdL.jpg,$699.99,,,4.5 out of 5 stars,972
67,https://www.amazon.com/MSI-Modern-MD2412PW-Adaptive-Synch-Adjustable/dp/B0CNM4LTVJ,"MSI Modern MD2412PW 24-inch IPS 1920 x 1080 (FHD) Computer Monitor, 100Hz, Adaptive-Synch, HDR Ready, HDMI, USBC 15W Power Delivery, Speaker, VESA Mountable, Height Adjustable, 1ms, White",‎1920 x 1080 Pixels,https://images-na.ssl-images-amazon.com/images/I/41eHGnZsJAL.jpg,$109.99,,,,0
68,https://www.amazon.com/ASUS-ZenScreen-Portable-Monitor-MB16AH-Z/dp/B0B78CCZTF,"ASUS ZenScreen 15.6” 1080P Portable USB Monitor (MB16AH-Z) - FHD, IPS, USB Type-C, Micro-HDMI, Eye Care, Speakers, Tripod Mountable, Anti-Glare Surface, Protective Sleeve, 3-Year Warranty",‎1920 x 1080 Pixels,https://images-na.ssl-images-amazon.com/images/I/41CuHYnSPcL.jpg,$171.16,,,4.2 out of 5 stars,67
69,https://www.amazon.com/Samsung-24-Inch-Computer-Compatible-LF24T374FWNXGO/dp/B08YFMYWG8,"SAMSUNG T37F Series 24-Inch FHD 1080p Computer Monitor, 75Hz, IPS Panel, HDMI, Display Port, VESA Compatible, 3 Yr WRNTY (LF24T374FWNXGO),Blue/Black",‎1920 x 1080 Pixels,https://images-na.ssl-images-amazon.com/images/I/41Uk9izL-9S.jpg,$139.99,,,4.6 out of 5 stars,111
70,https://www.amazon.com/Sceptre-FreeSync-DisplayPort-Speakers-E248B-FPT168/dp/B088VMY23M,"Sceptre IPS 24” Gaming Monitor 165Hz 144Hz Full HD (1920 x 1080) FreeSync Eye Care FPS RTS DisplayPort HDMI Build-in Speakers, Machine Black 2020 (E248B-FPT168),IPS 24"" 165Hz",‎1920 x 1080 Pixels,https://images-na.ssl-images-amazon.com/images/I/51x-2lZwWSL.jpg,$121.65,,,4.5 out of 5 stars,4737
