,url,name,asin,image,price,isPrime,offer,customerReview,customerReviewCount
141,https://www.amazon.com/MSI-G321CU-Monitor-FreeSync-Displayport/dp/B0BRM4K518,"MSI G321CU, 32"" Gaming Monitor, 3840 x 2160 (UHD), VA, 144Hz, FreeSync Premium, HDR Ready, HDMI, Displayport, Tilt,Black",‎4096 x 2160,https://images-na.ssl-images-amazon.com/images/I/41Xv-yaeKjL.jpg,$379.99,,,4.3 out of 5 stars,96
142,https://www.amazon.com/LG-27MP400-B-Virtually-Borderless-FreeSync/dp/B097NXN7RF,"LG 27MP400-B 27 Inch Monitor Full HD (1920 x 1080) IPS Display with 3-Side Virtually Borderless Design, AMD FreeSync and OnScreen Control – Black",‎1920 x 1080,https://images-na.ssl-images-amazon.com/images/I/41nxRN3tVgL.jpg,$129.99,,,4.6 out of 5 stars,1333
143,https://www.amazon.com/HTNZIR-Portable-Resolution-External-Kickstand/dp/B0C9LD46VM,"HTNZIR 15.6"" 144Hz Portable Gaming Monitor, 1920 * 1080 Resolution, USB-C/HDMI Ports, Travel Monitor External Screen for Laptop, PC, PS5, Mac, Xbox Built-in Speakers and VESA Kickstand","Shenzhen Konowa Electronics Co., LTD",https://images-na.ssl-images-amazon.com/images/I/51LGSWTQwQL.jpg,$89.99,,,3.5 out of 5 stars,3
144,https://www.amazon.com/KOORUI-Inch-Gaming-Monitor-165Hz/dp/B0CDL2X9QG,"KOORUI 27 Inch Full HD Gaming Monitor 165Hz, 1ms, 3000:1, DCI-P3 90% Color Gamut, FreeSync G-Sync Compatible, (1920 x 1080, HDMI, DisplayPort) Black",KOORUI,https://images-na.ssl-images-amazon.com/images/I/41PPj6X-6JL.jpg,$139.99,,,4.1 out of 5 stars,1462
145,https://www.amazon.com/LG-27-inch-Gaming-Monitor-FreeSync/dp/B093MTSTKD,LG 27-inch QHD 165Hz 1ms Nano IPS Gaming Monitor with G-SYNC/FreeSync,‎2560 x 1440,https://images-na.ssl-images-amazon.com/images/I/31Bk4aaS52L.jpg,$286.00$274.56,,,4.6 out of 5 stars,1509
146,https://www.amazon.com/CAPERAVE-Portable-Touchscreen-Tempered-Kickstand/dp/B0CQC2WSVJ,"CAPERAVE 15.6'' Portable Monitor Touchscreen, FHD IPS Touch Screen with Tempered Glass, Travel Monitor with Kickstand & Speaker, HDMI USB C External Monitor for Laptop Phone Computer Xbox Switch PS4/5",CAPERAVE,https://images-na.ssl-images-amazon.com/images/I/41rF5t2hLUL.jpg,$169.99,,,4.8 out of 5 stars,70
147,https://www.amazon.com/ApoloSign-StandMe-Portable-Rotatable-Rotation/dp/B0CMQT5F6Y,"ApoloSign StandMe 32-Inch Portable Smart Screen 1080p Rotatable Monitor with Incell Touch Screen, Android OS(Support Google Store), Built-in Battery(4-6H), Full Swivel Rotation, Voice Remote Control",ElcSign,https://images-na.ssl-images-amazon.com/images/I/31Rh3 rioVL.jpg,"$1,019.99",,,5.0 out of 5 stars,3
148,https://www.amazon.com/InnoView-Portable-Monitor-Extender-Speakers/dp/B0C4GVY7BB,InnoView Portable Monitor for Laptop [New Upgrade] 15.6 Inch FHD IPS Laptop Screen Extender Eye Care with Powerful Stable Cover Plug & Play HDR Travel Monitor for Laptop MacBook PS4/5 Xbox Switch,InnoView,https://images-na.ssl-images-amazon.com/images/I/41W6EGEi9EL.jpg,$99.99,,,4.5 out of 5 stars,548
149,https://www.amazon.com/Norcent-Monitor-Flicker-Free-Speakers-Adjustment/dp/B0CD32MQNK,"Norcent 22 Inch Monitor with HDMI VGA Port, 1080P 75Hz Full HD VA LED Ultra Thin Bezel Display, Flicker-Free, Blue Light Filter, Built-in Speakers, Tilt Adjustment",Norcent,https://images-na.ssl-images-amazon.com/images/I/61yezqnxooL.jpg,$69.99,,,4.5 out of 5 stars,212
150,https://www.amazon.com/InnoView-Extender-Monitors-Portable-Automatic/dp/B0CPXCHZC8,"InnoView Laptop Screen Extender 15.6"" Dual Monitors Stacked Folding Triple Monitor (Wins/Mac) 1080P Triple Portable Monitor for Laptop 90°/180° Automatic Rotation Black",InnoView,https://images-na.ssl-images-amazon.com/images/I/51ULjzmNeAL.jpg,$379.99,,,4.4 out of 5 stars,399
151,https://www.amazon.com/Lenovo-L22e-40-Everyday-Bluelight-Certified/dp/B0CGSSNBGH,"Lenovo L22e-40 – Everyday Monitor - 21.45"" FHD Display - 75Hz - 4ms–16ms Response Time - AMD FreeSync - Low Bluelight Certified - Tilt Stand - HDMI 1.4 - VGA - Audio Out",‎1920 x 1080 Pixels,https://images-na.ssl-images-amazon.com/images/I/4131xEYPLKL.jpg,$99.99,,,3.3 out of 5 stars,5
152,https://www.amazon.com/SAMSUNG-Adjustable-TUV-Certified-Intelligent-LS24A600NWNXGO/dp/B08YGVZRBD,"SAMSUNG 24 Inch QHD Computer Monitor, 75Hz, HDMI Monitor, Vertical, 1440p IPS Monitor, HDR10 (1 Billion Colors), TUV-Certified Intelligent Eye Care, S60A (LS24A600NWNXGO)",‎2560 x 1440 Pixels,https://images-na.ssl-images-amazon.com/images/I/51GHMtSsrfL.jpg,$199.99,,,4.1 out of 5 stars,331
153,https://www.amazon.com/MSI-Refresh-Monitor-G244F-E2/dp/B0CRLXS8ZH,"MSI FHD Rapid IPS Gaming Free Sync 1ms 1920 x 1080 180Hz Refresh Rate 24"" Gaming Monitor (Optix G244F E2)",MSI,https://images-na.ssl-images-amazon.com/images/I/41hqkiQx55L.jpg,$129.99,,,4.4 out of 5 stars,61
154,https://www.amazon.com/HP-E24d-G4-Integration-Dock/dp/B0CQN8W7JQ,"HP E24d G4 Advanced Docking Monitor (Pefect Integration of Monitor and Docking Station), 24"" Full HD (1920 x 1080) IPS Display, IR Webcam, RJ-45, DP, HDMI, USB-C, USB 3, Audio Port, with Docztorm Dock",B0CQN8W7JQ,https://images-na.ssl-images-amazon.com/images/I/41NJT7OzfoL.jpg,$249.99,,,,0
155,https://www.amazon.com/Acer-Monitor-FreeSync-Premium-M3bmiiprx/dp/B0C4Z8RFY9,"Acer Nitro 27"" WQHD 2560 x 1440 PC Gaming IPS Monitor | AMD FreeSync Premium Up to 180Hz Refresh 0.5ms DCI-P3 95% 1 Display Port 1.2 & 2 HDMI 2.0 XV271U M3bmiiprx,Black",‎2560 x 1440,https://images-na.ssl-images-amazon.com/images/I/51djiMLP1kL.jpg,$199.99,,,4.3 out of 5 stars,1032
156,https://www.amazon.com/Maxfree-S2-Extender-Portable-Compatible/dp/B0CG9XBTRX,"Maxfree S2 Triple Monitor for Laptop, 14'' Laptop Monitor Extender Plug & Play, 1080P HD Portable Laptop Screen Extender for 13-17'' Laptops, Compatible with Windows/Mac/Surface/Android/Switch",Maxfree,https://images-na.ssl-images-amazon.com/images/I/51vSz-4O15L.jpg,$234.98,,,4.0 out of 5 stars,149
157,https://www.amazon.com/domyfan-Monitor-Extender-Windows-Android/dp/B0CGQZX9LP,"domyfan 14"" Laptop Monitor Extender, FHD 1080P IPS Dual Laptop Screen Extender, HDMI/USB-A/Type-C Plug and Play for Windows, Mac, Chrome, Android, Xbox, Switch, PS5, Work with 13.3”-17” Laptops",B0CGQZX9LP,https://images-na.ssl-images-amazon.com/images/I/41kKm9rvkWL.jpg,$199.90,,,4.9 out of 5 stars,133
158,https://www.amazon.com/Monitor-1920x1080-Frameless-Freesync-Speakers/dp/B0C2C9KP1F,"Z-Edge 24.5"" Gaming Monitor, Z-Edge UG25I FHD 1920x1080 240Hz Gaming Monitor, 1ms Frameless LED, AMD Freesync Premium Display Port HDMI Built-in Speakers",Z Z-Edge,https://images-na.ssl-images-amazon.com/images/I/41OZFb v7HL.jpg,$159.99,,,4.3 out of 5 stars,239
159,https://www.amazon.com/GIGABYTE-G24F-Monitor-Response-DisplayPort/dp/B0B5VY6ZFC,"GIGABYTE G24F 2- 24"" 165Hz/180Hz(OC) 1080P Gaming Monitor, 1920 x 1080 SS IPS Display, 1ms (MPRT) Response Time, 95% DCI-P3, 125% sRGB, 1x DisplayPort 1.2 (HDR ready), 2x HDMI 2.0, 3x USB 3.2",GIGABYTE,https://images-na.ssl-images-amazon.com/images/I/41x7vrlz44L.jpg,$149.99$137.08,,,4.4 out of 5 stars,352
160,https://www.amazon.com/LG-32UN500-W-Compatibility-Virtually-Borderless/dp/B08FPLLX6Y,"LG 32UN500-W Monitor 32"" UltraFine (3840 x 2160) Display, AMD FreeSync, DCI-P3 90% Color Gamut, HDR10, Built-in Speakers, 3-Side Virtually Borderless Design - Silver/White",‎3840 x 2160 Pixels,https://images-na.ssl-images-amazon.com/images/I/41kVjgYnr2L.jpg,$299.99,,,4.4 out of 5 stars,1224
161,https://www.amazon.com/ASUS-XG27AQV-Black/dp/B0BHL1YYPJ,"ASUS ROG Strix XG27AQV 27"" 16:9 WQHD 170Hz Curved IPS LED HDR Gaming Monitor, Black",‎2560 x 1440 Pixels,https://images-na.ssl-images-amazon.com/images/I/516mY 7rwVL.jpg,['1 option from $335.77'],,,4.6 out of 5 stars,1287
162,https://www.amazon.com/ViewSonic-VX2718-2KPC-MHD/dp/B08DLC9HBG,"ViewSonic OMNI VX2718-2KPC-MHD 27 Inch Curved 1440p 1ms 165Hz Gaming Monitor with Adaptive Sync, Eye Care, HDMI and Display Port, Black",‎2560 x 1440 Pixels,https://images-na.ssl-images-amazon.com/images/I/41-GG5ywBsL.jpg,$179.99,,,4.4 out of 5 stars,1435
163,https://www.amazon.com/LG-34GP83A-B-Inch-Ultragear-Compatibility/dp/B08DWD38VX,"LG UltraGear QHD 34-Inch Curved Gaming Monitor 34GP83A-B, Nano IPS 1ms (GtG) with VESA DisplayHDR 400, NVIDIA G-SYNC, and AMD FreeSync Premium, 144Hz, Black",‎3440 x 1440 Pixels,https://images-na.ssl-images-amazon.com/images/I/41lRuJTbSqL.jpg,$569.99,,,4.4 out of 5 stars,2411
164,https://www.amazon.com/Sceptre-30-inch-Curved-Gaming-Monitor/dp/B07TXM7K4T,"Sceptre 30-inch Curved Gaming Monitor 21:9 2560x1080 Ultra Wide/ Slim HDMI DisplayPort up to 200Hz Build-in Speakers, Metal Black (C305B-200UN1)",‎2560 x 1080 Pixels,https://images-na.ssl-images-amazon.com/images/I/51ea9ueoKcL.jpg,$206.56,,,4.5 out of 5 stars,11109
165,https://www.amazon.com/GTEK-Computer-Frameless-Professional-Mountable/dp/B0BV511T41,"GTek 24 Inch 75Hz Computer Monitor Frameless, FHD 1080p LED Display, Office Professional Business LCD Screen, HDMI VGA, Refresh Rate, VESA Mountable - F2407V-D03",GTEK Electronics Corp,https://images-na.ssl-images-amazon.com/images/I/41SyMnvOHxL.jpg,$86.97,,,4.6 out of 5 stars,414
166,https://www.amazon.com/InnoView-Monitor-Computer-Display-Gaming/dp/B0BD76GZG3,InnoView 24 Inch FHD 100HZ Eyes Care Built-in Speakers Frameless 4000:1 Contrast Ratio Ultra Thin Bezel Professional Computer Office Gaming Monitor,InnoView,https://images-na.ssl-images-amazon.com/images/I/51NX1pYLjtL.jpg,$89.99,,,4.4 out of 5 stars,515
167,https://www.amazon.com/SAMSUNG-DisplayPort-Mini-LED-DisplayHDR-LS57CG952NNXZA/dp/B0CDQM55C9,"SAMSUNG 57"" Odyssey Neo G9 Series Dual 4K UHD 1000R Curved Gaming Monitor, 240Hz, 1ms with DisplayPort 2.1, Quantum Mini-LED, DisplayHDR 1000, AMD FreeSync Premium Pro, LS57CG952NNXZA, 2023",‎7680 x 2160 Pixels,https://images-na.ssl-images-amazon.com/images/I/41YvRrPl-mL.jpg,"$1,799.99$1,727.99",,,3.7 out of 5 stars,68
168,https://www.amazon.com/Gawfolk-Computer-Frameless-DisplayPort-Compatible/dp/B0CP54W6VP,"Gawfolk 25 Inch Gaming Monitor, 144hz/180hz Computer Monitor FHD 1080P PC Monitors,Frameless Curved Monitors VA,sRGB 100%, DisplayPort, HDMI,Eye Care, Wall Mount Compatible (Black)","Shenzhen Qinghong Zhuoyue Technology Co., Ltd.",https://images-na.ssl-images-amazon.com/images/I/41UXvq0Cz3L.jpg,$129.99,,,4.6 out of 5 stars,107
169,https://www.amazon.com/Sceptre-Monitor-DisplayPort-Speakers-U275W-UPT/dp/B098HQ8YRX,"Sceptre 4K IPS 27"" 3840 x 2160 UHD Monitor up to 70Hz DisplayPort HDMI 99% sRGB Build-in Speakers, Black 2021 (U275W-UPT)",‎3840 x 2160 Pixels,https://images-na.ssl-images-amazon.com/images/I/41URcXrndAL.jpg,$169.97,,,4.4 out of 5 stars,977
170,https://www.amazon.com/MSI-Non-Glare-Super-Narrow-Bezel/dp/B0CBQSVPPF,"MSI 27” FHD (1920 x 1080) Non-Glare with Super Narrow Bezel 75Hz 1ms 16:9 HDMI/DP AMD Radeon FreeSync IPS Gaming Monitor (G2712V),Black",‎1920 x 1080,https://images-na.ssl-images-amazon.com/images/I/41H0aA0CVBL.jpg,$109.99,,,4.5 out of 5 stars,359
171,https://www.amazon.com/Sceptre-27-Inch-Gaming-Monitor-Speakers/dp/B078HSKBG3,"Sceptre 27-Inch FHD LED Gaming Monitor 75Hz 2X HDMI VGA Build-in Speakers, Ultra Slim Metal Black",‎1920 x 1080 Pixels,https://images-na.ssl-images-amazon.com/images/I/41lcjAOAcRS.jpg,$119.97,,,4.5 out of 5 stars,3540
172,https://www.amazon.com/Zero-Frame-Monitor-FreeSync-Technology-Refresh/dp/B0BY9NPLP4,"Acer KB272 EBI 27"" IPS Full HD (1920 x 1080) Zero-Frame Gaming Office Monitor | AMD FreeSync Technology | Up to 100Hz Refresh | 1ms (VRB) | Low Blue Light | Tilt | HDMI & VGA Ports,Black",‎1920 x 1080,https://images-na.ssl-images-amazon.com/images/I/41YjX1Rk CL.jpg,$109.99,,,4.6 out of 5 stars,2639
173,https://www.amazon.com/Portable-Monitor-Extended-Outdoors-178%C2%B0Full/dp/B0B1ZFK1JR,"NIUTO Portable Monitor for Laptop HDMI USB C, Extended Monitor Outdoors or Travel minitor Laptop Screen FHD 1080P IPS Screen 178°Full View, for MacBook/Android Xbox Switch PS5 13inch Monitor",NIUTO,https://images-na.ssl-images-amazon.com/images/I/41bim 65H-L.jpg,$64.99,,,4.0 out of 5 stars,86
174,https://www.amazon.com/ASUS-1080P-Monitor-VA27DQ-Adaptive-sync/dp/B093F8589L,"ASUS 27” 1080P Monitor (VA27DQ) - Full HD, IPS, 75Hz, Speakers, Adaptive-sync/FreeSync™, Low Blue Light, Flicker Free, VESA Mountable, Frameless, HDMI, VGA, DisplayPort, Tilt Adjustable, BLACK",‎1920 x 1080 Pixels,https://images-na.ssl-images-amazon.com/images/I/41dWXBFaFxS.jpg,$124.00,,,4.6 out of 5 stars,2157
175,https://www.amazon.com/VILVA-Portable-Monitor-Laptop-Portable-Speakers/dp/B0BTSFVMLV,VILVA Portable-Monitor-for-Laptop - 15.6'' 1080P FHD IPS Display USB-C&HDMI Portable Monitor for Laptop with Cover and Speakers External Monitor for Laptop/PC/Mac/Phone/Xbox Switch/PS4,VILVA,https://images-na.ssl-images-amazon.com/images/I/511ScqoY5JL.jpg,$98.89,,,4.6 out of 5 stars,2300
176,https://www.amazon.com/HONGO-Portable-Monitors-Computer-External/dp/B0BZ4GXCC7,"HONGO Portable Monitor 15.6'' 1080P FHD USB-C Portable Laptop Monitors Smart Cover & Dual Speaker, HDMI Computer Display IPS HDR External Gaming Monitor for PC Phone Mac Xbox PS4 Switch",HONGO,https://images-na.ssl-images-amazon.com/images/I/51qx4TBvXoL.jpg,$129.99$72.10,,,4.3 out of 5 stars,1652
177,https://www.amazon.com/2K-Portable-Gaming-Monitor-14/dp/B0CM6FZ4VJ,"2K Portable Gaming Monitor, 14"" 3:2 QHD IPS Laptop Monitor, Dual USB C HDMI Laptop Screen Extender, Gaming Display with 2 Speakers, Travel Monitor for Laptop PS4/5 PC Phone Xbox Switch",Pornitor,https://images-na.ssl-images-amazon.com/images/I/51SGSVnahQL.jpg,$129.99,,,4.9 out of 5 stars,30
178,https://www.amazon.com/KEEPTIME-Portable-Monitor-Computer-Speakers/dp/B0CJLGFCPZ,"KEEPTIME 4K Portable Monitor 13.3"" 3840 x 2160 UHD USB-C HDMI Laptop Monitor, 100% sRGB IPS Computer Gaming Display HDR Travel Monitor w/Speakers & Smart Cover for Laptop Xbox PS5 Switch PC Phone",KEEPTIME,https://images-na.ssl-images-amazon.com/images/I/51PvZYVdWXL.jpg,$159.99,,,4.5 out of 5 stars,43
179,https://www.amazon.com/Amazon-Basics-75hz-Panel-Monitor/dp/B08WJ3GYC9,"Amazon Basics 27 Inch Monitor Powered with AOC Technology, FHD 1080P, 75hz, VESA Compatible, Built-in Speakers, Black",‎1920x1080,https://images-na.ssl-images-amazon.com/images/I/41JVE87ytBS.jpg,$149.99,,,4.5 out of 5 stars,402
180,https://www.amazon.com/ASUS-VG27AQA1A/dp/B0BHKCQBMN,"ASUS TUF Gaming 27” 1440P Monitor (VG27AQA1A) - QHD (2560 x 1440), 170Hz (Supports 144Hz), 1ms, Extreme Low Motion Blur, Freesync Premium, Eye Care, HDMI, DisplayPort, Shadow Boost, Speakers, HDR",‎2560 x 1440 Pixels,https://images-na.ssl-images-amazon.com/images/I/415-KEcZ6qL.jpg,$199.99,,,4.5 out of 5 stars,46
181,https://www.amazon.com/SANSUI-Computer-100Hz-DisplayPort-FHD/dp/B0CCCPC5QW,"SANSUI 24 inch Monitor, IPS Display Computer Monitor with Built-in Speakers, 100Hz Monitor VESA Mount with DisplayPort HDMI VGA Inputs, FHD Monitor for Home Office (ES-24x3A HDMI Cable Included)",SANSUI,https://images-na.ssl-images-amazon.com/images/I/51927FXkJPL.jpg,$88.99,,,4.4 out of 5 stars,306
182,https://www.amazon.com/MSI-Pro-MP243XW-Monitor-Non-Glare/dp/B0CC6LFK9L,"MSI Pro MP243XW, 24"" Monitor IPS FHD (1920 x 1080) Non-Glare with Super Narrow Bezel 100HZ 1ms 16:9 with Tilt Stand, White",‎1920 x 1080,https://images-na.ssl-images-amazon.com/images/I/31qGU4VwcTL.jpg,$109.99,,,4.8 out of 5 stars,13
183,https://www.amazon.com/SAMSUNG-Computer-DisplayPort-Adjustable-LF24T454FQNXGO/dp/B08WGLL83S,"SAMSUNG FT45 Series 24-Inch FHD 1080p Computer Monitor, 75Hz, IPS Panel, HDMI, DisplayPort, USB Hub, Height Adjustable Stand, 3 Yr WRNTY (LF24T454FQNXGO),Black",‎1920 x 1080 Pixels,https://images-na.ssl-images-amazon.com/images/I/515q-Qg7PjL.jpg,$129.99,,,4.5 out of 5 stars,2014
184,https://www.amazon.com/AOC-24G15N-180Hz-Gaming-Monitor/dp/B0CGVY3YYB,"AOC 24G15N 24"" 180Hz 1ms Gaming Monitor - Full HD, Adaptive-Sync, 3-Sided Frameless, HDR Ready, 3-Year Zero-Bright-Dot",‎1920 x 1080 Pixels,https://images-na.ssl-images-amazon.com/images/I/41myuewNQfL.jpg,$99.99,,,4.7 out of 5 stars,15122
185,https://www.amazon.com/MSI-G274RW-Compatible-Displayport-Adjustable/dp/B0B11NDG75,"MSI G274RW, 27"" Gaming Monitor, 1920 x 1080 (FHD), IPS, 1ms, 170Hz, G-Sync Compatible, HDR Ready, HDMI, Displayport, Tilt, Swivel, Height Adjustable, White",‎1920 x 1080,https://images-na.ssl-images-amazon.com/images/I/41laqze6 DL.jpg,$219.99,,,4.5 out of 5 stars,83
186,https://www.amazon.com/kasorey-Portable-Monitor-Extender-Plug-Play/dp/B0CQ818GDD,"kasorey Portable Monitor for Laptop, 12"" Laptop Screen Extender, Mini HDMI/Type-C Plug-Play Dual Laptop Screen for Windows, Chrome, Mac, Switch and PS4/5",kasorey,https://images-na.ssl-images-amazon.com/images/I/41KSaFQnk8L.jpg,$69.99,,,5.0 out of 5 stars,18
187,https://www.amazon.com/Alienware-AW3423DW-34-18-inch-3440x1440-Curvature/dp/B09VQ48X5Q,"Alienware AW3423DW Curved Gaming Monitor 34.18 inch Quantom Dot-OLED 1800R Display, 3440x1440 Pixels at 175Hz, True 0.1ms Gray-to-Gray, 1M:1 Contrast Ratio, 1.07 Billions Colors - Lunar Light",‎175 Hz,https://images-na.ssl-images-amazon.com/images/I/41tEzNcVVYL.jpg,$999.99$810.71,,,4.2 out of 5 stars,607
188,https://www.amazon.com/ViewSonic-VA1903H-19-Inch-WXGA-1366x768p/dp/B086XMFNW6,"ViewSonic VA1903H 19-Inch WXGA 1366x768p 16:9 Widescreen Monitor with Enhanced View Comfort, Custom ViewModes and HDMI for Home and Office,Black",‎1366 x 768 Pixels,https://images-na.ssl-images-amazon.com/images/I/41LvuoCWZnL.jpg,$69.99,,,4.3 out of 5 stars,495
189,https://www.amazon.com/ViewSonic-VX3218-PC-MHD-Monitor-Adaptive-Sync-Frameless/dp/B08V85DH1R,"ViewSonic OMNI VX3218-PC-MHD 32 Inch Curved 1080p 1ms 165Hz Gaming Monitor with Adaptive Sync, Eye Care, HDMI and Display Port, Black",‎1920 x 1080 Pixels,https://images-na.ssl-images-amazon.com/images/I/41N4uCykbAL.jpg,$179.99,,,4.5 out of 5 stars,603
190,https://www.amazon.com/AOC-24G2S-Frameless-Adaptive-Sync-Height-Adjustable/dp/B0B148Y16K,"AOC Gaming 24G2S 24” Frameless Gaming Monitor, Full HD 1920x1080, 165Hz 1ms, Adaptive-Sync, Height Adjustable Stand, Black",‎1920 x 1080 Pixels,https://images-na.ssl-images-amazon.com/images/I/41lQ0VZrODL.jpg,$119.99,,,4.5 out of 5 stars,701
191,https://www.amazon.com/WUAWE-Portable-External-Computer-Freesync/dp/B0C7QRHDX7,"WUAWE 15.6"" Portable Monitor, 1080P 72% NTSC 100% sRGB USB C HDMI Travel Monitor for Laptop, External Second Computer Monitor with HDR Freesync Low Blue Light for PC Mac Phone PS5 Xbox Switch",WUAWE,https://images-na.ssl-images-amazon.com/images/I/415vq3RAy6L.jpg,$109.99$69.74$109.99,,,4.5 out of 5 stars,82
192,https://www.amazon.com/LG-32GN650-B-Ultragear-Reduction-FreeSync/dp/B08LLF9NS1,"LG 32GN650-B Ultragear Gaming Monitor 32” QHD (2560 x 1440) Display, 165Hz Refresh Rate, 1ms MBR, HDR 10, sRGB 95% Color Gamut, AMD FreeSync – Black",‎2560 x 1440 Pixels,https://images-na.ssl-images-amazon.com/images/I/41hekzTnFvL.jpg,$239.00,,,4.6 out of 5 stars,1722
193,https://www.amazon.com/wisecoco-Secondary-NV126B5M-N41-Stretched-1920X515/dp/B0BRZ2GXZT,wisecoco 12.6 Inch Secondary Screen FHD IPS Touch Second Screen Stretched Bar LCD Display 1920X515 Mini HDMI for Laptop Computer Health Speed Windows Aida64 Sub CPU GPU Display,wisecoco,https://images-na.ssl-images-amazon.com/images/I/41hytbjYmiL.jpg,$149.99,,,4.3 out of 5 stars,25
194,https://www.amazon.com/Dell-inch-Monitor-1920-1080/dp/B096MYB1H1,"Dell SE2722HX Monitor - 27 inch FHD (1920 x 1080) 16:9 Ratio with Comfortview (TUV-Certified), 75Hz Refresh Rate, 16.7 Million Colors, Anti-Glare Screen with 3H Hardness - Black",‎1920 x 1080,https://images-na.ssl-images-amazon.com/images/I/41zrOLvncFL.jpg,$134.99,,,4.6 out of 5 stars,3191
195,https://www.amazon.com/Sceptre-27-inch-FreeSync-DisplayPort-Speakers/dp/B0CCQDXJC1,"Sceptre 27-inch 240Hz Gaming Monitor 1ms 99% sRGB AMD FreeSync Premium DisplayPort x2 HDMI x2 Build-in Speakers, Machine Black 2023",‎1920 x 1080 Pixels,https://images-na.ssl-images-amazon.com/images/I/51LsxVj3b8L.jpg,$220.43,,,4.6 out of 5 stars,721
196,https://www.amazon.com/Dell-S2722QC-Response-Integrated-Speakers/dp/B09DTDRJWP,"Dell S2722QC 27-inch 4K USB-C Monitor - UHD (3840 x 2160) Display, 60Hz Refresh Rate, 8MS Grey-to-Grey Response Time (Normal Mode), Built-in Dual 3W Speakers, 1.07 Billion Colors Platinum Silver",‎3840 x 2160,https://images-na.ssl-images-amazon.com/images/I/51aEFzeGY2L.jpg,$329.99,,,4.3 out of 5 stars,1517
197,https://www.amazon.com/Leudaich-Extender-Portable-Plug-Play-Dual-Screen/dp/B0CP8XMDJF,"Leudaich 14'’ Laptop Monitor Extender for Dual Monitor Dispaly, FHD IPS Portable Monitor for 13”-16” Laptops, HDMI/USB-A/Type-C Plug-Play Dual-Screen for Windows, Chrome, Mac and Switch",Leudaich,https://images-na.ssl-images-amazon.com/images/I/515uOxif6GL.jpg,$199.99,,,4.6 out of 5 stars,53
198,https://www.amazon.com/Dell-S2421HS-Adjustable-Technology-DisplayPort/dp/B09SQYR4MM,"Dell S2421HS Full HD 1920 x 1080, 24-Inch 1080p LED, 75Hz, Desktop Monitor with Adjustable Stand, 4ms Grey-to-Grey Response Time, AMD FreeSync, IPS Technology, HDMI, DisplayPort, Silver, 24.0"" FHD",‎1920 x 1080,https://images-na.ssl-images-amazon.com/images/I/518rG9dBMQL.jpg,$159.99,,,4.6 out of 5 stars,1171
199,https://www.amazon.com/GIGABYTE-GS27QC-Monitor-Response-FreeSync/dp/B0CCSX399J,"GIGABYTE GS27QC 27"" 165Hz 1440P Curved Gaming Monitor, 2560 x 1440 VA 1500R Display, 1ms (MPRT) Response Time, HDR Ready, FreeSync Premium, 1x Display Port 1.4, 2X HDMI 2.0,Black",‎2560 x 1440 Pixels,https://images-na.ssl-images-amazon.com/images/I/41UZXmFhIuL.jpg,$189.99,,,4.5 out of 5 stars,644
