,url,name,asin,image,price,isPrime,offer,customerReview,customerReviewCount
71,https://www.amazon.com/ROADOM-Raspberry-Responsive-Compatible-Versatile/dp/B0CJNHY3X3,"ROADOM Touch Screen Monitor with Case, 7’’ Raspberry Pi Screen, IPS FHD 1024×600,Responsive and Smooth Touch,Dual Built-in Speakers,HDMI Input,Compatible with Raspberry Pi 5/4/3/Zero,Versatile Stand",ROADOM,https://images-na.ssl-images-amazon.com/images/I/41cIdhmQNRL.jpg,$89.99,,,4.7 out of 5 stars,58
72,https://www.amazon.com/SideTrak-Portable-Monitor-Freestanding-Single/dp/B092W7Y8XT,"SideTrak Solo Pro 15.8"" Portable Monitor - FHD 1080P LED Anti-Glare IPS Screen, Dual Display, for Mac, PC, Chrome Laptops, Game Consoles, USB or Mini HDMI Power, Double DisplayPort, Speakers, and HDR",Stand Steady,https://images-na.ssl-images-amazon.com/images/I/41fouZh2RhL.jpg,$249.99,,,4.3 out of 5 stars,450
73,https://www.amazon.com/HMTECH-Raspberry-Pi-Monitor-Non-Touch/dp/B09MFNLRQQ,HMTECH 7 Inch Raspberry Pi Screen 800x480 HDMI Portable Monitor IPS LCD Display for 4/3/2/Zero/B/B+ Win11/10/8/7 (Non-Touch),hengmiao,https://images-na.ssl-images-amazon.com/images/I/41jE5p7qhxL.jpg,$39.99,,,4.0 out of 5 stars,479
74,https://www.amazon.com/FLYTOCCA-Extender-Portable-Monitor-P1S-11-6/dp/B0C4H2L3CM,"FLYTOCCA Laptop Screen Extender, Portable Monitor Laptop Monitor, 1080P FHD Laptop Monitor Extender, Plug and Play No Driver (P1S-11.6"" Dual)",FLYTOCCA,https://images-na.ssl-images-amazon.com/images/I/41erYLb5EVL.jpg,$63.99,,,4.2 out of 5 stars,37
75,https://www.amazon.com/aiuouog-Portable-Monitor-Computer-Extender/dp/B0CLRR3L8P,"aiuouog Portable Monitor, 15.6 inch Computer Monitor, Gaming Monitor with Speaker HDMI, Laptop Screen Extender MacBook Surface PC Xbox PS5 Switch",aiuouog,https://images-na.ssl-images-amazon.com/images/I/41yPABhfpAL.jpg,$73.99,,,4.3 out of 5 stars,72
76,https://www.amazon.com/Z-Edge-1920x1080-Backlight-Eye-Care-Technology/dp/B08L3H5DSR,"Z-Edge 24-inch Curved Gaming Monitor, Full HD 1080P 1920x1080 LED Backlight Monitor, with 75Hz Refresh Rate and Eye-Care Technology, U24C 178° Wide View Angle, Built-in Speakers, VGA+HDMI",B08L3H5DSR,https://images-na.ssl-images-amazon.com/images/I/61cm0ClvcTL.jpg,$129.99,,,4.4 out of 5 stars,723
77,https://www.amazon.com/SAMSUNG-Odyssey-2560x1440-Ultrawide-LS32AG500PNXZA/dp/B09Q7NC1RW,"SAMSUNG Odyssey G50A Series 32-Inch WQHD (2560x1440) Gaming Monitor, 165Hz, 1ms, IPS Panel, G-Sync, HDR10 (1 Billion Colors), Ultrawide Game View (LS32AG500PNXZA)",SAMSUNG,https://images-na.ssl-images-amazon.com/images/I/41e0PP-qzvL.jpg,$322.00,,,4.4 out of 5 stars,9500
78,https://www.amazon.com/SAMSUNG-27-inch-Border-Less-FreeSync-LF27T350FHNXZA/dp/B08FF3JQ28,"SAMSUNG 27"" T35F Series FHD 1080p Computer Monitor, 75Hz, IPS Panel, HDMI, VGA (D-Sub), 3-Sided Border-Less, FreeSync, LF27T350FHNXZA",‎1920 x 1080 Pixels,https://images-na.ssl-images-amazon.com/images/I/41uWXRXYqxL.jpg,$123.81$99.99,,,4.5 out of 5 stars,4301
79,https://www.amazon.com/ARWOEIS-Portable-Monitor-15-6inch-External/dp/B0CNXKYDG8,"ARWOEIS Portable Monitor 15.6inch 1080P 60Hz 178° IPS Screen Travel Monitor USB-C HDMI Second External Monitor for Laptop,PC,Mac Phone,Xbox,Swich,PS4/5,Premium Smart Cover",ARWOEIS,https://images-na.ssl-images-amazon.com/images/I/41ulszdV0zL.jpg,$73.86,,,3.9 out of 5 stars,8
80,https://www.amazon.com/ViewSonic-VX3276-MHD-Frameless-Widescreen-DisplayPort/dp/B0787WGCXT,"ViewSonic VX3276-MHD 32 Inch 1080p Widescreen IPS Monitor with Ultra-Thin Bezels, Screen Split Capability HDMI and DisplayPort",‎1920 x 1080 Pixels,https://images-na.ssl-images-amazon.com/images/I/413m-MKxTeL.jpg,$169.99,,,4.6 out of 5 stars,7359
81,https://www.amazon.com/LG-27UN850-W-DisplayHDR-Borderless-Adjustable/dp/B08CVTTNN4,"LG UltraFine UHD 27-Inch 4K UHD 2160p Computer Monitor 27UN850-W, IPS with VESA DisplayHDR 400, AMD FreeSync, and USB-C, White,Silver",‎3840 x 2160 Pixels,https://images-na.ssl-images-amazon.com/images/I/41C5V46ORzL.jpg,$353.18,,,4.5 out of 5 stars,2016
82,https://www.amazon.com/LG-38WR85QC-W-UltraWide-VESADisplayHDR-DisplayPort/dp/B0CNFK3RLV,LG 38WR85QC-W 38 inch Curved UltraWide WQHD Nano IPS VESADisplayHDR 600 144Hz 1ms USB Type-C 90W Computer Monitor NVIDIA G-SYNC AMD FreeSync Premium Pro HDMI DisplayPort Tilt/Height/Swivel Stand White,‎3840 x 1600,https://images-na.ssl-images-amazon.com/images/I/41m wZjxqCL.jpg,$999.99,,,5.0 out of 5 stars,2
83,https://www.amazon.com/Sceptre-24-5-inch-DisplayPort-Speakers-C255B-FWT240/dp/B0BTKJFRDV,"Sceptre Curved 24.5-inch Gaming Monitor up to 240Hz 1080p R1500 1ms DisplayPort x2 HDMI x2 Blue Light Shift Build-in Speakers, Machine Black 2023 (C255B-FWT240)",‎1920 x 1080 Pixels,https://images-na.ssl-images-amazon.com/images/I/51gwoHMZT L.jpg,$149.97,,,4.5 out of 5 stars,2639
84,https://www.amazon.com/Acer-XFA243Y-Monitor-FreeSync-Technology/dp/B0BKMPJK3K,"Acer Nitro XFA243Y Sbiipr 23.8” Full HD (1920 x 1080) VA Gaming Monitor | AMD FreeSync Premium Technology | 165Hz Refresh Rate | 1ms VRB | HDR 10 | 1 Display Port 1.2 & 2 HDMI 2.0 Ports,Black",‎1920 x 1080 Pixels,https://images-na.ssl-images-amazon.com/images/I/41O4Vs44ZdL.jpg,$99.99,,,4.5 out of 5 stars,5315
85,https://www.amazon.com/siaviala-Extender-Monitor-Extension-Portable/dp/B0CPHYXFRC,"siaviala Laptop Screen Extender,14"" IPS Triple Monitor for Laptop Extension- FHD 1080P Travel Portable Monitor Screen for 13""-17.3"" Laptops HDMI/USB-A/Type-C Plug & Play for Wins/Mac/Chrome/Switch","Shenzhen Baijiayoupu Technology Co., Ltd",https://images-na.ssl-images-amazon.com/images/I/41AQmWYOXdL.jpg,$289.99,,,5.0 out of 5 stars,1
86,https://www.amazon.com/Portable-Monitor-Upgraded-1920X1080-Computer/dp/B07TWGBG3P,"UPERFECT Portable Monitor, 2023 [NewVersion No MiniDP Port] 15.6"" IPS HDR 1920X1080 FHD Eye Care Screen USB C Gaming Monitor, Dual Speaker Computer Display HDMI Type-C VESA for Laptop PC Phone w/Case",UPERFECT,https://images-na.ssl-images-amazon.com/images/I/51J8o3Es03L.jpg,$99.99,,,4.4 out of 5 stars,5282
87,https://www.amazon.com/ASUS-Strix-Gaming-Monitor-XG256Q/dp/B09TV5JZ6Z,"ASUS ROG Strix 24.5” 1080P Gaming Monitor (XG256Q) - Full HD, Fast IPS, 180Hz, 1ms, G-Sync Compatible/FreeSync, DisplayPort, HDMI, DisplayHDR400 , BLACK",‎1920 x 1080 Pixels,https://images-na.ssl-images-amazon.com/images/I/51pH42pSo4L.jpg,$189.99,,,4.5 out of 5 stars,1089
88,https://www.amazon.com/SANSUI-Ultra-Thin-Adjustable-Compatible-ES-22X3/dp/B0BRV913KF,SANSUI Monitor 22 Inch IPS 75Hz FHD 1080P HDMI VGA Ports Computer Monitor Ultra-Thin Tilt Adjustable VESA Mount Compatible with Eye Comfort 178° Wide Viewing Angle for Game and Office(ES-22X3),‎1920 x 1080,https://images-na.ssl-images-amazon.com/images/I/41JOYIggM9L.jpg,$69.99,,,4.4 out of 5 stars,810
89,https://www.amazon.com/ViewSonic-VX4381-4K-Monitor-Widescreen-DisplayPort/dp/B097J4J1Z7,"ViewSonic VX4381-4K 43 Inch Ultra HD MVA 4K Monitor Widescreen with HDR10 Support, Eye Care, HDMI, USB, DisplayPort for Home and Office, Black",‎3840 x 2160 Pixels,https://images-na.ssl-images-amazon.com/images/I/419Fns0G-nL.jpg,$499.99,,,4.0 out of 5 stars,47
90,https://www.amazon.com/Lenovo-FreeSync-Compatible-NearEdgeless-66C2GCC1US/dp/B08Z5JNL1C,"Lenovo G27-20 27-inch Gaming Monitor, FHD, IPS, 144Hz, 1ms, FreeSync Premium and NVIDIA G-SYNC Compatible, NearEdgeless, VESA Mount, Height and Tilt Adjust, HDMI, DP",‎1920 x 1080 Pixels,https://images-na.ssl-images-amazon.com/images/I/51rOF zuWIL.jpg,$129.99,,,4.0 out of 5 stars,39
91,https://www.amazon.com/SAMSUNG-ViewFinity-3840x2160-Adjustable-LS27A80DUNNXZA/dp/B0CMVWB7N8,"SAMSUNG S80UA 27-Inch ViewFinity 4K UHD (3840x2160) Computer Monitor, HDMI, USB Hub with USB-C, HDR10 (1 Billion Colors), Built-in Speakers, Height Adjustable Stand (LS27A80DUNNXZA)",‎3840 x 2160 Pixels,https://images-na.ssl-images-amazon.com/images/I/51o6nNc6miL.jpg,$399.99,,,1.5 out of 5 stars,2
92,https://www.amazon.com/LG-24MP400-B-Computer-FreeSync-Borderless/dp/B097NWD3TL,"LG 24MP400-B FHD (1920 x 1080) 24 Inch Computer Monitor, IPS, AMD FreeSync, 3-Side Borderless Design, 75Hz, 5ms, Reader Mode, Smart Energy Saving, OnScreen Control, HDMI, D-Sub, Black",‎1920 x 1080,https://images-na.ssl-images-amazon.com/images/I/41RRKCcXLZL.jpg,$99.99,,,4.5 out of 5 stars,788
93,https://www.amazon.com/CRUA-Monitor-Computer-Adjustment-Install/dp/B0CPKYH5N6,"CRUA 22 Inch White Monitor, FHD 1080P 95% sRGB 75Hz Computer Monitor Support Low Blue Light, Tilt Adjustment, Wall Mount Install. Desktop PC Display for Office or Gaming(HDMI/VGA Ports)",CRUA,https://images-na.ssl-images-amazon.com/images/I/41eL7DlsAbL.jpg,$79.99,,,4.3 out of 5 stars,117
94,https://www.amazon.com/3840x2160-Professional-Computer-Creators-Adjustable/dp/B0CDJBXNGW,"Acer CB272K 27"" UHD 3840x2160 IPS Professional Computer Monitor for Creators 99% sRGB Color Accuracy Delta E<1 HDR10 Height Adjustable Stand - Tilt, Swivel, Pivot |USB Type-C, DP & HDMI Ports",‎3840 x 2160,https://images-na.ssl-images-amazon.com/images/I/41z8UT hj-L.jpg,$279.99,,,4.4 out of 5 stars,3053
95,https://www.amazon.com/HotYeah-Portable-Monitor-External-Computer/dp/B0CLHFKVLK,"HotYeah Portable Monitor, 16.1in 1080P FHD Laptop Monitor USB-C HDMI External Computer Display HDR IPS Gaming Monitor w/Smart Cover & Speaker, 2nd Screen for PC Mac Phone Switch PS5",HotYeah,https://images-na.ssl-images-amazon.com/images/I/51gZ2- 0l L.jpg,$84.99,,,4.7 out of 5 stars,203
96,https://www.amazon.com/Sceptre-34-Inch-Ultrawide-DisplayPort-C345B-QUT168/dp/B0BTK1C533,"Sceptre 34-Inch Curved Ultrawide WQHD Monitor 3440 x 1440 R1500 up to 165Hz DisplayPort x2 99% sRGB 1ms Picture by Picture, Machine Black 2023 (C345B-QUT168)",‎3440 x 1440 Pixels,https://images-na.ssl-images-amazon.com/images/I/51 FZDWGjzL.jpg,$239.97,,,4.5 out of 5 stars,2639
97,https://www.amazon.com/LG-22MP410-B-Display-FreeSync-OnScreen/dp/B09RQCJVN1,"LG 22MP410-B 22” Full HD (1920 x 1080) VA Display with AMD FreeSync, OnScreen Control - Black",LG,https://images-na.ssl-images-amazon.com/images/I/41ea0EJkJkL.jpg,$66.99,,,4.5 out of 5 stars,470
98,https://www.amazon.com/ViewSonic-TD2455-Dual-Hinge-Ergonomics-DisplayPort/dp/B081FJRQJL,"ViewSonic TD2455 24 Inch 1080p IPS 10-Point Multi Touch Screen Monitor with Advanced Dual-Hinge Ergonomics USB C HDMI and DisplayPort Out,Black, 12.6"" x 21.2"" x 2""",‎1920 x 1080 Pixels,https://images-na.ssl-images-amazon.com/images/I/41K4s 2HtQL.jpg,$359.99,,,4.0 out of 5 stars,95
99,https://www.amazon.com/27SA2-Hbi-Zero-Frame-Technology-Ultra-Thin/dp/B0BS9R3Q5X,"AOPEN 27SA2 Hbi 27"" Full HD (1920 x 1080) Zero-Frame Gaming Office Monitor | AMD FreeSync Technology | Ultra-Thin Stylish Design | 100Hz | 1ms-TVR | Low Blue Light | Tilt | HDMI & VGA Ports,Black",‎1920 x 1080 Pixels,https://images-na.ssl-images-amazon.com/images/I/41rTi0dVSbL.jpg,$89.99,,,4.6 out of 5 stars,981
100,https://www.amazon.com/SAMSUNG-24-Inch-Computer-Wideview-LS24A336NHNXZA/dp/B09VR3T3KK,"SAMSUNG S33A Series 24-Inch FHD 1080p Computer Monitor, HDMI, VA Panel, Wideview Screen, Eye Saver & Game Mode (LS24A336NHNXZA), Black",Samsung Electronics,https://images-na.ssl-images-amazon.com/images/I/41bD0vc QjL.jpg,$110.57,,,4.6 out of 5 stars,313
101,https://www.amazon.com/LG-32MR50C-B-FreeSync-OnScreen-Stabilizer/dp/B0CMC2FZFD,"LG 32MR50C-B 32-inch FHD Curved Monitor 100Hz, AMD FreeSync, OnScreen Control, Dynamic Action Sync, Black Stabilizer, Tilt Stand (HDMI), 2023",‎1920 x 1080,https://images-na.ssl-images-amazon.com/images/I/41cLN7YWPTL.jpg,$159.99,,,4.3 out of 5 stars,35
102,https://www.amazon.com/MSI-G32C4X-FreeSync-DisplayPort-Adjustable/dp/B0CJK6P8R4,"MSI G32C4X, 32"" Gaming Monitor, 1920 x 1080 (FHD) Curved Gaming Monitor, 1 ms, 250Hz, FreeSync, 1500R, HDMI, DisplayPort, Tilt Adjustable, Black",‎1920 x 1080,https://images-na.ssl-images-amazon.com/images/I/41P25X0HmgL.jpg,['6 options from $169.41'],,,4.6 out of 5 stars,631
103,https://www.amazon.com/BOSII-Laptop-Screen-Extender-Portable/dp/B0CK2NTZ5K,"BOSII Laptop Screen Extender Portable - 14 Inch Triple IPS FHD 1080P HDMI/USB-A/Type-C Extended Monitor for Laptops (Maximum Length: 15.74"") Compatible with Windows Mac Travel Gaming Work",BOSII,https://images-na.ssl-images-amazon.com/images/I/41U1BLZmXML.jpg,$299.99,,,4.5 out of 5 stars,87
104,https://www.amazon.com/Sceptre-E205W-16003R-Frameless-Speakers-Metallic/dp/B07743412C,"Sceptre 20"" 1600x900 75Hz Ultra Thin LED Monitor 2x HDMI VGA Built-in Speakers, Machine Black Wide Viewing Angle 170° (Horizontal) / 160° (Vertical)",‎1600 x 900 Pixels,https://images-na.ssl-images-amazon.com/images/I/41UW0nzowBS.jpg,$69.97,,,4.4 out of 5 stars,28018
105,https://www.amazon.com/kasorey-Extender-Plug-Play-Portable-Attachment/dp/B0CQX61G7P,"kasorey Laptop Screen Extender, 14'' FHD 1080P IPS Dual Laptop Monitor Extender Display, HDMI/USB-A/USB-C Plug-Play Portable Monitor Attachment for Windows, Chrome, Mac and Switch",kasorey,https://images-na.ssl-images-amazon.com/images/I/41b0JcplKyL.jpg,$199.97,,,5.0 out of 5 stars,18
106,https://www.amazon.com/SAMSUNG-PurColor-Q-Symphony-Xcelerator-UN50CU8000/dp/B0BVMZ5NH2,"SAMSUNG 50-Inch Class Crystal UHD 4K CU8000 Series PurColor, Object Tracking Sound Lite, Q-Symphony, Motion Xcelerator, Ultra Slim, Solar Remote, Smart TV with Alexa Built-in (UN50CU8000, 2023 Model)","8.9""D x 44""W x 27""H",https://images-na.ssl-images-amazon.com/images/I/51BJGCBRTNL.jpg,$397.99$369.99,,,4.4 out of 5 stars,1329
107,https://www.amazon.com/Tpsmtdis-15-6-Portable-Extender-Monitors/dp/B0C5JWQ47K,"Tpsmtdis 15.6"" Portable Monitor,1080P Screen Extender Plug&Play IPS FHD Laptop Second Monitors,HDR USB-C HDMI Travel Gaming Display for PC Mac Phone PS4/5 Switch Xbox,w/Smart Cover Dual Speakers",Tpsmtdis,https://images-na.ssl-images-amazon.com/images/I/51LBIsoAcwL.jpg,$74.99,,,4.3 out of 5 stars,159
108,https://www.amazon.com/SB272-Zero-Frame-FreeSync-Technology-Ultra-Thin/dp/B0BS9RH7GX,"Acer SB272 EBI 27"" Full HD (1920 x 1080) IPS Zero-Frame Gaming Office Monitor | AMD FreeSync Technology |",‎1920 x 1080 Pixels,https://images-na.ssl-images-amazon.com/images/I/41ooLCUfIgL.jpg,$99.99,,,4.5 out of 5 stars,2846
109,https://www.amazon.com/Laptomo-S3-Extender-Portable-Compatible/dp/B0CRNY6HW1,"Laptomo S3 Laptop Screen Extender, 14'' Triple Portable Monitor for Laptop Plug and Play, 1080P FHD IPS Dual Monitor Extender for 13''-17'' Laptops Compatible with MacOS, Windows, Chrome, Switch, PS5",Laptomo,https://images-na.ssl-images-amazon.com/images/I/51e0KqzekuL.jpg,$319.99,,,4.5 out of 5 stars,14
110,https://www.amazon.com/Acer-Frame-Office-Computer-Monitor/dp/B0148NNKTC,Acer 23.8” Full HD 1920 x 1080 IPS Zero Frame Home Office Computer Monitor - 178° Wide View Angle - 16.7M - NTSC 72% Color Gamut - Low Blue Light - Tilt Compatible - VGA HDMI DVI R240HY bidx,‎1920 x 1080 Pixels,https://images-na.ssl-images-amazon.com/images/I/519rzl-wIQL.jpg,$99.99,,,4.6 out of 5 stars,15456
111,https://www.amazon.com/SAMSUNG-Odyssey-FreeSync-Ultrawide-DisplayPort/dp/B09ZH3WM47,"SAMSUNG 32"" Odyssey Neo G8 4K UHD 240Hz 1ms G-Sync 1000R Curved Gaming Monitor, Quantum HDR2000, AMD FreeSync Premium Pro, Matte Display, Ultrawide Game View, DisplayPort, Black & White, 2022",‎3840 x 2160 Pixels,https://images-na.ssl-images-amazon.com/images/I/41xt-MjqHXL.jpg,$999.99$794.47,,,3.9 out of 5 stars,1919
112,https://www.amazon.com/Westinghouse-Monitor-Refresh-FreeSync-Computer/dp/B0B9CLB81R,"Westinghouse 27 Inch Gaming Monitor, 165Hz, 1ms, 1440p, IPS Display, AMD Freesync Premium Adaptive Sync, QHD White Computer Monitor with x2 DisplayPort, x2 HDMI, & RGB Backlight",Westinghouse,https://images-na.ssl-images-amazon.com/images/I/31GC2DmLo6L.jpg,$199.99,,,4.6 out of 5 stars,78
113,https://www.amazon.com/HAMTYSAN-Raspberry-Screen-Display-Window/dp/B0BGXB2Y67,"HAMTYSAN Raspberry Pi Screen 7 Inch HDMI Monitor 800x480 LCD Screen Display Mini Small Monitor for Raspberry Pi 4/3/2/Zero/B/B+ Win11/10/8/7 (Non-Touch), Driver Free",HAMTYSAN,https://images-na.ssl-images-amazon.com/images/I/41Xz1u8X1ML.jpg,$39.99,,,4.3 out of 5 stars,48
114,https://www.amazon.com/MSI-MD2712PW-Adaptive-Synch-Mountable-Adjustable/dp/B0CMCGXRLY,"MSI Modern MD2712PW 27-inch IPS 1920 x 1080 (FHD) Computer Monitor, Adaptive-Synch, HDR Ready, HDMI, USBC 15W Power Delivery, Speaker, VESA Mountable, Height Adjustable, 1ms, White",‎1920 x 1080,https://images-na.ssl-images-amazon.com/images/I/41oVZo1YlHL.jpg,$139.99,,,,0
115,https://www.amazon.com/ARZOPA-Portable-Kickstand-External-Switch-A1S/dp/B0CDQ5FWYM,"ARZOPA Portable Monitor Kickstand, 14.0"" Ultra Slim Portable Laptop Monitor FHD 1080P External Display with Dual Speakers Second Screen for Laptop PC Phone Xbox PS4/5 Switch-A1S",B0CDQ5FWYM,https://images-na.ssl-images-amazon.com/images/I/415b1yr382L.jpg,$99.99,,,4.4 out of 5 stars,1369
116,https://www.amazon.com/Vizta-Monitor-V27GDH1-1920x1080-Display/dp/B0912N5P99,"Vizta Monitor V27GDH1 27"" Curve Gaming Monitor 1800R 144Hz 1920x1080 1ms HDMI/Display Port Speaker Retail",Vizta,https://images-na.ssl-images-amazon.com/images/I/41s3XMrxXCL.jpg,$119.12,,,4.0 out of 5 stars,1
117,https://www.amazon.com/ASUS-PA247CV-DisplayPort-Daisy-Chaining-Anti-Glare/dp/B08K2NT2G7,"ASUS ProArt Display PA247CV 23.8 inch Monitor – IPS, Full HD (1920 x 1080), 100% sRGB, 100% Rec. 709, Color Accuracy ΔE < 2, Calman Verified, USB-C, Compatible With Laptop & Mac Monitor,BLACK",‎1920 x 1080 Pixels,https://images-na.ssl-images-amazon.com/images/I/51 NCPHB1gL.jpg,$199.00$164.85,,,4.4 out of 5 stars,1176
118,https://www.amazon.com/ViewSonic-VX2728J-2K-FreeSync-Ergonomics-DisplayPort/dp/B0BZTBVKKW,"ViewSonic Omni VX2728J-2K 27 Inch Gaming Monitor 1440p 180hz 0.5ms IPS w/FreeSync Premium, Advanced Ergonomics, HDMI, and DisplayPort, Black",‎2560 x 1440 Pixels,https://images-na.ssl-images-amazon.com/images/I/416jmF18aVL.jpg,$199.99,,,4.1 out of 5 stars,74
119,https://www.amazon.com/Alienware-AW2523HF-Gaming-Monitor-Adjustability/dp/B0BDPCQ7PG,"Alienware AW2523HF Gaming Monitor - 24.5-inch (1920x1080) 360Hz Display, AMD Free Sync, Height/Tilt/Swivel/Pivot Adjustability, Dark Side of The Moon",‎360 Hz,https://images-na.ssl-images-amazon.com/images/I/51dqd8PRO L.jpg,$349.99,,,4.5 out of 5 stars,370
120,https://www.amazon.com/MSI-MP251-24-5-inch-Adaptive-Synch-Mountable/dp/B0CJKVT223,"MSI PRO MP251 24.5-inch IPS 1920 x 1080 (FHD) Computer Monitor, 100Hz, Adaptive-Synch, HDMI, VGA Port, VESA Mountable, Tilt, Speaker, 1ms, Black",‎1920 x 1080,https://images-na.ssl-images-amazon.com/images/I/416fUFzpzoL.jpg,$79.99,,,4.5 out of 5 stars,263
121,https://www.amazon.com/BenQ-Computer-Subwoofer-Optimizer-Adjustable/dp/B09C2TD9T4,"BenQ MOBIUZ EX2710Q Gaming Monitor 27"" QHD 1440p 165Hz 1ms | IPS | HDRi | DCI-P3 | Freesync Premium | Eye-Care Tech | Adjustable Height, Swivel & Tilt | 2.1 Speakers | DisplayPort | HDMI | USB Hub",‎2560 x 1440,https://images-na.ssl-images-amazon.com/images/I/51sZJGKT3tL.jpg,$299.99$269.99,,,4.7 out of 5 stars,1503
122,https://www.amazon.com/SAMSUNG-Odyssey-Gaming-Curved-Monitor/dp/B0BJHQ4LXR,"SAMSUNG 32"" Odyssey G65B QHD 240Hz 1ms (GTG) HDR 600 Gaming Hub 1000R Curved Gaming Monitor,Black","‎2,560 x 1,440 Pixels",https://images-na.ssl-images-amazon.com/images/I/41 Vrh5XlZL.jpg,$465.53,,,4.1 out of 5 stars,131
123,https://www.amazon.com/ViewSonic-VX1655-Portable-Monitor-Speakers/dp/B0CFYWK9YR,"ViewSonic VX1655 15.6 Inch 1080p FHD Portable LED IPS Monitor with 2 Way Powered 60W USB C, Mini HDMI, Dual Speakers, and Built-in Stand with Tripod Mount,Black",‎1920 x 1080 Pixels,https://images-na.ssl-images-amazon.com/images/I/41PxRkBrH9L.jpg,$149.99,,,4.3 out of 5 stars,901
124,https://www.amazon.com/D3bmiprcx-1920x1080-Computer-Monitor-Adjustable/dp/B0CQKJ3T5C,"Acer Vero CB242Y D3bmiprcx 23.8"" FHD 1920x1080 Zero Frame IPS Home Office Computer Monitor | 100Hz | 99% sRGB | FHD Webcam | Height Adjustable Stand - Swivel, Tilt & Pivot | Display Port, HDMI & VGA",acer,https://images-na.ssl-images-amazon.com/images/I/41IWVP1OicL.jpg,$157.99,,,,0
125,https://www.amazon.com/AOC-22B3HM-Monitor-Adaptive-Sync-LowBlue/dp/B0CP6F4ZB7,"AOC 22B3HM 22"" Class Full HD 75Hz Monitor, Adaptive-Sync, HDR Mode, for Home and Office, HDMI, VGA, LowBlue, VESA",‎1920 x 1080 Pixels,https://images-na.ssl-images-amazon.com/images/I/419kdrTgQRL.jpg,$69.00,,,4.6 out of 5 stars,3441
126,https://www.amazon.com/PHILIPS-Computer-Monitors-Replacement-221V8LN/dp/B0BRR4ZGNP,"PHILIPS 22 inch Class Thin Full HD (1920 x 1080) 75Hz Monitor, VESA, HDMI & VGA Port, 4 Year Advance Replacement Warranty, 221V8LN",‎1920 x 1080,https://images-na.ssl-images-amazon.com/images/I/5131mT07zUL.jpg,$69.99$66.99,,,4.6 out of 5 stars,2457
127,https://www.amazon.com/MAGICRAVEN-Portable-Lightweight-Computer-Speakers/dp/B0BYTFM5HR,"MAGICRAVEN 4K Portable Monitor, 13.3"" UHD IPS Laptop Monitor, Slim Lightweight Dual USB C HDMI Computer Monitor Gaming Display with Speakers, Travel Monitor for PC Phone PS5/4 Xbox Switch(No Cover)",MAGICRAVEN,https://images-na.ssl-images-amazon.com/images/I/51Rp1W35NyL.jpg,$189.99,,,4.3 out of 5 stars,21
128,https://www.amazon.com/Portable-Monitor-Upgraded-Ultra-Slim-Speakers/dp/B088TLQR3K,"KYY Portable Monitor 15.6'' FHD 1080P USB C HDMI Gaming Monitor Ultra-Slim IPS Display w/Smart Cover & Speakers, Plug&Play, External Monitor for Laptop PC Phone Mac Xbox PS4",B088TLQR3K,https://images-na.ssl-images-amazon.com/images/I/51zvuRNUGoL.jpg,$109.99$81.59,,,4.5 out of 5 stars,3768
129,https://www.amazon.com/MSI-PRO-MP223-Adaptive-Synch-Mountable/dp/B0CTSHK7H7,"MSI PRO MP223, 22-inch VA 1920 x 1080 (FHD) Computer Monitor, 100Hz, Adaptive-Synch, HDMI, Video Port, VESA Mountable, Tilt, 1ms, Black",MSI,https://images-na.ssl-images-amazon.com/images/I/316wJe-J34L.jpg,$96.64,,,,0
130,https://www.amazon.com/SAMSUNG-Border-Less-Compatible-Adjustable-LS24AG302NNXZA/dp/B096N2MV3H,"SAMSUNG Odyssey G3 FHD Gaming Monitor, 144hz, HDMI, Vertical Monitor, AMD FreeSync Premium, G30A (LS24AG302NNXZA),24-Inch",‎1920 x 1080 Pixels,https://images-na.ssl-images-amazon.com/images/I/41KhryXjB9S.jpg,$149.99,,,4.6 out of 5 stars,2442
131,https://www.amazon.com/UPERFECT-Portable-2560x1600-FreeSync-External/dp/B0CRDSV638,"UPERFECT 2K Portable Monitor, 16"" 2560x1600 QHD Portable Gaming Monitor HDR FreeSync Laptop Monitor w/VESA & Smart Case Matte IPS Eye Care External Second Screen for PC Laptop Phone Game Console",UPERFECT,https://images-na.ssl-images-amazon.com/images/I/41RIBia3QML.jpg,$149.99,,,4.5 out of 5 stars,710
132,https://www.amazon.com/ASUS-ProArt-Display-24-1-viewable/dp/B0BQPRWS8M,"ASUS ProArt Display 24” (24.1” viewable) 16:10 HDR Professional Monitor (PA248CRV) - IPS, (1920 x 1200), 97% DCI-P3, ΔE < 2, Calman Verified, USB-C PD 96W, DisplayPort, Daisy-Chain, Height Adjustable",‎1920 x 1200 Pixels,https://images-na.ssl-images-amazon.com/images/I/51ENmpFc8WL.jpg,$279.00$213.09,,,4.4 out of 5 stars,1176
133,https://www.amazon.com/Samsung-LC27F398FWNXZA-C27F398-Curved-Monitor/dp/B01CX26WIG,"SAMSUNG 27"" CF39 Series FHD 1080p Curved Computer Monitor, Ultra Slim Design, AMD FreeSync, 4ms response, HDMI, DisplayPort, VESA Compatible, Wide Viewing Angle, LC27F398FWNXZA, Black",‎1920x1080 Pixels,https://images-na.ssl-images-amazon.com/images/I/51HXHFAQmtL.jpg,$159.99,,,4.6 out of 5 stars,25287
134,https://www.amazon.com/SAMSUNG-34-Inch-Ultra-Wide-FreeSync-LC34G55TWWNXZA/dp/B08MVBYWGQ,"SAMSUNG 34"" Odyssey G5 Ultra-Wide Gaming Monitor with 1000R Curved Screen, 165Hz, 1ms, FreeSync Premium, WQHD, LC34G55TWWNXZA, 2020, Black",‎3440 x 1440 Pixels,https://images-na.ssl-images-amazon.com/images/I/414SwZuVZ5L.jpg,$400.14$349.00,,,4.4 out of 5 stars,9500
135,https://www.amazon.com/COOLHOOD-Portable-Monitor-Computer-External/dp/B0CSFNCX64,"COOLHOOD Portable Monitor 15.6'', 1080P FHD Plug&Play Travel Laptop Monitor w/Smart Cover, USB-C HDR Portable Second Computer Display, Portable Game External Screen for PC Phone Mac Xbox PS4/5 Switch",COOLHOOD,https://images-na.ssl-images-amazon.com/images/I/51 LmKbjTzL.jpg,$119.99,,,4.8 out of 5 stars,76
136,https://www.amazon.com/LAEFLAEK-Portable-Monitor-Extender-Display/dp/B0BLSM9PZG,"LAEFLAEK Portable Monitor, 15.6"" 1080P for Laptop, HDMI USB-C Travel HDR Monitor Extender for Display PC Mac Phone PS5 Xbox Switch with Smart Cover",LAEFLAEK,https://images-na.ssl-images-amazon.com/images/I/51RuDwGssWL.jpg,$79.99,,,4.5 out of 5 stars,206
137,https://www.amazon.com/INNOCN-Monitor-Desktop-Computer-Adjustable/dp/B0CHYDC5LQ,"INNOCN 27"" 4K Monitor UHD 3840 x 2160 IPS PC Desktop Computer Display HDMI, Display Port, USB C, 99% sRGB, Tilt Adjustable Stand, PIP/PBP, Black, 27C1U-L","Guangxi Century Innovation Display Electronics Co.,Ltd",https://images-na.ssl-images-amazon.com/images/I/61ECOG6JHjL.jpg,$165.71,,,4.2 out of 5 stars,543
138,https://www.amazon.com/Portable-Monitor-Upgraded-1920x1080-Computer/dp/B07ZLY26FW,"cocopar Portable Monitor 15.6 Inch 1080P Travel Monitor with Speaker HDMI USB-C External Monitor for Laptop MacBook Surface PC Xbox PS5 Switch, with Cover Stand VESA",cocopar,https://images-na.ssl-images-amazon.com/images/I/31rTrkw15US.jpg,$179.99,,,4.8 out of 5 stars,5967
139,https://www.amazon.com/MSI-MP271CAW-Free-Synch-DisplayPort-Mountable/dp/B0CQRVRJNT,"MSI PRO MP271CAW 27-inch Curved VA 1920 x 1080 (FHD) Computer Monitor, 75Hz, Free-Synch, HDMI, DisplayPort, VESA Mountable, Tilt,Speaker, 1ms, White",MSI,https://images-na.ssl-images-amazon.com/images/I/416NwBnXFrL.jpg,$129.99,,,5.0 out of 5 stars,1
140,https://www.amazon.com/LG-32UL500-W-Display-FreeSync-Compatibility/dp/B088G1PKKN,"LG UltraFine 32-Inch Computer Monitor 32UL500-W, VA with HDR 10 Compatibility and AMD FreeSync, White",‎3840 x 2160 Pixels,https://images-na.ssl-images-amazon.com/images/I/41mfGt43TeL.jpg,$246.99,,,4.5 out of 5 stars,1616
