url,name,asin,image,price,isPrime,offer,customerReview,customerReviewCount
https://www.amazon.com/WLIVE-Dresser-Dressers-Entryway-Rustic-Brown/dp/B09533BNWB/ref=sr_1_1?keywords=furniture&qid=1707635878&sr=8-1,"WLIVE Dresser for Bedroom with 5 Drawers, Wide Chest of Drawers, Fabric Dresser, Storage Organizer Unit with Fabric Bins for Closet, Living Room, Hallway, Rustic Brown Wood Grain Print",B09533BNWB,https://m.media-amazon.com/images/I/81OV2Z8KefL._AC_UL320_.jpg,2 sizes,True,,4.2 out of 5 stars,28187
https://www.amazon.com/Huuger-Nightstand-Charging-Station-Drawers/dp/B0C1Y5VL8D/ref=sr_1_2?keywords=furniture&qid=1707635878&sr=8-2,"Nightstand with Charging Station, Side Table with Fabric Drawers, End Table with Open Shelf, Bedside Table with USB Ports and Outlets, Night Stand for Bedroom, Rustic Brown and Black",B0C1Y5VL8D,https://m.media-amazon.com/images/I/81V4U+q6qtL._AC_UL320_.jpg,$47.99,True,Join Prime to buy this item at $39.99$59.99,4.4 out of 5 stars,771
https://www.amazon.com/Yoobure-Tree-Bookshelf-Standing-Organizer/dp/B0BQBZSK7F/ref=sr_1_3?keywords=furniture&qid=1707635878&sr=8-3,"Yoobure Tree Bookshelf - 6 Shelf Retro Floor Standing Bookcase, Tall Wood Book Storage Rack for CDs/Movies/Books, Utility Book Organizer Shelves for Bedroom, Living Room, Home Office",B0BQBZSK7F,https://m.media-amazon.com/images/I/61pfi70XekL._AC_UL320_.jpg,$49.99,True,15% coupon applied at checkoutSave 15% with coupon$59.99,4.5 out of 5 stars,1054
https://www.amazon.com/EUDELE-Adhesive-Organizer-Rustproof-Stainless/dp/B0BLSCY6PR/ref=sr_1_4?keywords=furniture&qid=1707635878&sr=8-4,"Shower Caddy 5 Pack,Adhesive Shower Organizer for Bathroom Storage&Home Decor&Kitchen,No Drilling,Large Capacity,Rustproof Stainless Steel Bathroom Organizer,Shower Shelves for Inside Shower",B0BLSCY6PR,https://m.media-amazon.com/images/I/81RLgrUwG5L._AC_UL320_.jpg,$19.98,True,10% coupon applied at checkoutSave 10% with coupon$69.99,4.7 out of 5 stars,12490
https://www.amazon.com/SPACEKEEPER-Organizer-Bathroom-Dividers-Multi-purpose/dp/B09TT962MB/ref=sr_1_5?keywords=furniture&qid=1707635878&sr=8-5,"SPACEKEEPER Under Sink Organizer, Sliding Cabinet Basket Organizer 2 Tier Under Bathroom Storage Rack with Hooks, Hanging Cup, Dividers, Multi-purpose for Bathroom Kitchen, Grey, 2 Pack",B09TT962MB,https://m.media-amazon.com/images/I/81qQR-rHqjL._AC_UL320_.jpg,$24.99,True,List:$49.99,4.4 out of 5 stars,7658
https://www.amazon.com/WLIVE-Compartment-Adjustable-Storage-Tabletop/dp/B084ZH1LYN/ref=sr_1_6?keywords=furniture&qid=1707635878&sr=8-6,"WLIVE Wood Lift Top Coffee Table with Hidden Compartment and Adjustable Storage Shelf, Lift Tabletop Dining Table for Home Living Room, Office, Rustic Oak",B084ZH1LYN,https://m.media-amazon.com/images/I/81xhCy8yQ6L._AC_UL320_.jpg,2 sizes,True,List:$129.99,4.3 out of 5 stars,6278
https://www.amazon.com/AOJEZOR-Bathroom-Furniture-Storage-Organizer/dp/B0CBVGPX1G/ref=sr_1_7?keywords=furniture&qid=1707635878&sr=8-7,"AOJEZOR Bathroom Furniture Sets,Small Bathroom Storage Cabinet Great for Toilet Paper Holder,Toilet Paper Cabinet for Small Spaces,White Bathroom Organizer",B0CBVGPX1G,https://m.media-amazon.com/images/I/71U1oLi7IFL._AC_UL320_.jpg,5 sizes,False,40% coupon applied at checkoutSave 40% with coupon,4.1 out of 5 stars,505
https://www.amazon.com/OKD-Bathroom-Cabinet-Farmhouse-Storage/dp/B0BRKP6CDV/ref=sr_1_8?keywords=furniture&qid=1707635878&sr=8-8,"OKD Bathroom Floor Cabinet, Farmhouse Storage Cabinet with Sliding Barn Door & Storage Drawers, Small Storage Cabinet for Bathroom, Kitchen, Living Room, Rustic Oak with Antique White",B0BRKP6CDV,https://m.media-amazon.com/images/I/81VVe+de5qL._AC_UL320_.jpg,5 sizes,False,$10.00 coupon applied at checkoutSave $10.00 with coupon$179.99,4.5 out of 5 stars,951
https://www.amazon.com/SONGMICS-Folding-Storage-Ottoman-ULSF077R01/dp/B0BRYZV953/ref=sr_1_9?keywords=furniture&qid=1707635878&sr=8-9,"SONGMICS 43 Inches Folding Storage Ottoman Bench, Storage Chest, Foot Rest Stool, Bedroom Bench with Storage, Light Taupe ULSF077R01",B0BRYZV953,https://m.media-amazon.com/images/I/8102FJsehaL._AC_UL320_.jpg,3 sizes,True,Save 5% on 2 select item(s),4.6 out of 5 stars,21477
https://www.amazon.com/Nightstand-Charging-Station-Farmhouse-Furniture/dp/B0BNKJLPJ9/ref=sr_1_10?keywords=furniture&qid=1707635878&sr=8-10,"Nightstand with Charging Station, Bedroom End Table with USB Ports and outlets, Modern Bedside Table for Living Room Farmhouse, Dark Grey",B0BNKJLPJ9,https://m.media-amazon.com/images/I/61cuwEXzdIL._AC_UL320_.jpg,$39.99,True,,4.4 out of 5 stars,1506
https://www.amazon.com/EKWQ-Cushion-Fluffy-Velvet-Furniture/dp/B09TYVZF12/ref=sr_1_11?keywords=furniture&qid=1707635878&sr=8-11,"5 6 7 FT Bean Bag Chair Cover Chair Cushion, Big Round Soft Fluffy PV Velvet Sofa Bed Cover(it was only a Cover, not a Full Bean Bag) Living Room Furniture Lazy Sofa Bed Cover, Black, 5FT",B09TYVZF12,https://m.media-amazon.com/images/I/71gJksnI4WS._AC_UL320_.jpg,3 sizes,True,,3.6 out of 5 stars,89
https://www.amazon.com/Yaheetech-Charging-Stations-Upholstered-Headboard/dp/B0CBDL6F1H/ref=sr_1_12?keywords=furniture&qid=1707635878&sr=8-12,"Yaheetech Full Size Bed Frame with 2 USB Charging Stations/Port for Type A&Type C/3 Storage Drawers, Leather Upholstered Platform Bed with Headboard/Solid Wood Slat Support/No Box Spring Needed/Beige",B0CBDL6F1H,https://m.media-amazon.com/images/I/81UqSIA+3bL._AC_UL320_.jpg,$169.98,False,$30.00 coupon applied at checkoutSave $30.00 with coupon,4.3 out of 5 stars,676
https://www.amazon.com/Rolanstar-Charging-Station-Nightstand-Storage/dp/B0BKZ7QRMF/ref=sr_1_13?keywords=furniture&qid=1707635878&sr=8-13,"Rolanstar End Table with Charging Station, Set of 2 Nightstand with 3 Storage Shelves, Narrow Side Table with USB Ports & Power Outlets, Small Sofa Table for Living Room or Bedroom, Greige",B0BKZ7QRMF,https://m.media-amazon.com/images/I/71KiUiEMQwL._AC_UL320_.jpg,$69.99,True,Join Prime to buy this item at $58.99$79.99,4.5 out of 5 stars,1930
https://www.amazon.com/WLIVE-Dresser-Bedroom-Organization-Entryway/dp/B09MVQG66C/ref=sr_1_14?keywords=furniture&qid=1707635878&sr=8-14,"WLIVE Dresser for Bedroom with 8 Drawers, Wide Fabric Dresser for Storage and Organization, Bedroom Dresser, Chest of Drawers for Living Room, Closet, Entryway, Rustic Brown Wood Grain Print",B09MVQG66C,https://m.media-amazon.com/images/I/91lddc8cgBL._AC_UL320_.jpg,$70.99,True,,4.3 out of 5 stars,2536
https://www.amazon.com/Tromlycs-Cushion-Support-Sagging-Furniture/dp/B0C7GCRBS7/ref=sr_1_15?keywords=furniture&qid=1707635878&sr=8-15,Tromlycs Couch Sofa Cushion Support for Sagging Seat Arched Furniture Seat Under Cushion Sag Repair Set of 2,B0C7GCRBS7,https://m.media-amazon.com/images/I/615j1g+DrxL._AC_UL320_.jpg,$30.77,True,,4.1 out of 5 stars,348
https://www.amazon.com/WLIVE-Nightstand-Dresser-Furniture-Entryway/dp/B0C9PTMGRN/ref=sr_1_16?keywords=furniture&qid=1707635878&sr=8-16,"WLIVE Nightstand, 2 Drawer Dresser for Bedroom, Small Dresser with 2 Drawers, Bedside Furniture, Night Stand, End Table with Fabric Bins for Bedroom, Closet, Entryway, College Dorm, White",B0C9PTMGRN,https://m.media-amazon.com/images/I/61e9UZjW3NL._AC_UL320_.jpg,4 sizes,True,List:$33.99,4.4 out of 5 stars,15316
https://www.amazon.com/Best-Choice-Products-Adjustable-Recliners/dp/B0BTKHQKPY/ref=sr_1_17?keywords=furniture&qid=1707635878&sr=8-17,Best Choice Products Set of 2 Adjustable Steel Mesh Zero Gravity Lounge Chair Recliners w/Pillows and Cup Holder Trays - Gray Stripes,B0BTKHQKPY,https://m.media-amazon.com/images/I/81VRKRKIWDL._AC_UL320_.jpg,$89.99,True,List:$45.00,4.5 out of 5 stars,56987
https://www.amazon.com/OLIXIS-Modern-Furniture-Storage-Compartment/dp/B0CGLBJ7GL/ref=sr_1_18?keywords=furniture&qid=1707635878&sr=8-18,OLIXIS Modern Lift Top Coffee Table Wooden Furniture with Storage Shelf and Hidden Compartment for Living Room Office (Black),B0CGLBJ7GL,https://m.media-amazon.com/images/I/81dU7TRlU8L._AC_UL320_.jpg,$64.98,True,List:$69.99,4.3 out of 5 stars,319
https://www.amazon.com/Furniture-Adhesive-Cuttable-Protectors-Hardwoods/dp/B08RBJ13ZB/ref=sr_1_19?keywords=furniture&qid=1707635878&sr=8-19,"Yelanon Felt Furniture Pads -182 Pcs Furniture Pads Self Adhesive,Cuttable Felt Chair Pads,Anti Scratch Floor Protectors for Furniture Feet Chair Legs, Felt Pads for Hardwoods Floors,Black & Brown",B08RBJ13ZB,https://m.media-amazon.com/images/I/81AgTHpjpKL._AC_UL320_.jpg,$8.99,True,Typical:$9.99,4.5 out of 5 stars,12891
https://www.amazon.com/Kitchen-Multifunction-Organizer-Shelving-Lockable/dp/B0CMX452Q4/ref=sr_1_20?keywords=furniture&qid=1707635878&sr=8-20,"3-Tier Kitchen Storage Cart with Handle, Multifunction Utility Rolling Cart Kitchen Storage Organizer, Mobile Shelving Unit Cart with Lockable Wheels for Office, Living Room, Kitchen - White",B0CMX452Q4,https://m.media-amazon.com/images/I/61HinWYnjrL._AC_UL320_.jpg,$16.99,True,List:$19.99,3.0 out of 5 stars,5
https://www.amazon.com/QEEIG-Bathroom-Shelves-Floating-Farmhouse/dp/B0C8HK3KS8/ref=sr_1_21?keywords=furniture&qid=1707635878&sr=8-21,QEEIG Black Bathroom Shelves Over Toilet Wall Mounted Floating Shelves Farmhouse Shelf Toilet Paper Holder Small 16 inch Set of 3 (019-B3),B0C8HK3KS8,https://m.media-amazon.com/images/I/71VQu0ZBURL._AC_UL320_.jpg,2 sizes,True,Typical:$12.62,4.7 out of 5 stars,683
https://www.amazon.com/SHPMXUPW-Bathroom-Garbage-Wastebasket-Bedroom/dp/B0CFB69Y8P/ref=sr_1_22?keywords=furniture&qid=1707635878&sr=8-22,"3 Pack Bathroom Small Trash Can with Lid,10L / 2.6 Gallon Slim Garbage Bin Wastebasket with Pop-Up Lid for Bedroom, Office, Kitchen, Craft Room, Fits Under Desk/Cabinet/Sink/",B0CFB69Y8P,https://m.media-amazon.com/images/I/61Zs48KwJvL._AC_UL320_.jpg,$23.99,True,,4.3 out of 5 stars,1940
https://www.amazon.com/Gyfimoie-Dresser-Drawers-Charging-Included/dp/B0C6K76Z5L/ref=sr_1_23?keywords=furniture&qid=1707635878&sr=8-23,"6 Drawer Double Dresser with Power Outlet, Accent Chests of Drawers with LED Light, Modern White Storage Dresser with Charging Station, (Mirror Not Included) (White)",B0C6K76Z5L,https://m.media-amazon.com/images/I/71Vp5dBKiwL._AC_UL320_.jpg,$189.99,False,Typical:$199.99,4.0 out of 5 stars,99
https://www.amazon.com/Stackable-Furniture-Organizer-Entryway-Vertical/dp/B0CFV9Y5RP/ref=sr_1_24?keywords=furniture&qid=1707635878&sr=8-24,"6 Tier Narrow Shoe Rack, Small Stackable Shoe Stand, Space Saving Furniture Shoe Storage Organizer for Entryway, Closet, Vertical Shoe Tower Rack",B0CFV9Y5RP,https://m.media-amazon.com/images/I/81XHUbYbddL._AC_UL320_.jpg,2 sizes,True,Typical:$23.99,3.8 out of 5 stars,586
https://www.amazon.com/FATORRI-Organizer-Bookshelf-Industrial-Horizontal/dp/B08LDHGG6D/ref=sr_1_25?keywords=furniture&qid=1707635878&sr=8-25,"FATORRI 8 Cube Storage Organizer Bookshelf, Rustic Wood Cubby Bookcase, Industrial Horizontal Long Shelf for Living Room (Walnut Brown, 62 Inch)",B08LDHGG6D,https://m.media-amazon.com/images/I/71DB6xI-4gS._AC_UL320_.jpg,$229.99,True,$20.00 coupon applied at checkoutSave $20.00 with coupon,4.9 out of 5 stars,649
https://www.amazon.com/Homhedy-Litter-Enclosure-Furniture-Washroom/dp/B0CC9NW6F5/ref=sr_1_26?keywords=furniture&qid=1707635878&sr=8-26,"Cat Litter Box Enclosure,Litter Box Furniture Hidden with Barn Door,Wooden Cat Washroom Furniture,Cat House,Fit Most of Litter Box, Black",B0CC9NW6F5,https://m.media-amazon.com/images/I/71hPC+IpK5L._AC_UL320_.jpg,$89.99,True,($89.99$89.99/Count)$89.99,4.5 out of 5 stars,537
https://www.amazon.com/Stuffed-Animal-Net-Hammock-Organizer/dp/B0BXL2HB9T/ref=sr_1_27?keywords=furniture&qid=1707635878&sr=8-27,"Stuffed Animal Net or Hammock - Hanging Stuffed Animal Hammock Storage - Toy Hammock Holder Boho Wall Corner Hammock Organizer inc LED Light and Hooks, Black",B0BXL2HB9T,https://m.media-amazon.com/images/I/81ES2cRaEIL._AC_UL320_.jpg,2 sizes,True,List:$23.99,4.7 out of 5 stars,2080
https://www.amazon.com/Youmumeub-Sectional-Storage-Ottoman-Apartment/dp/B0CRPBHHKS/ref=sr_1_28?keywords=furniture&qid=1707635878&sr=8-28,"Sectional Sofa Couch, 78"" Long 3-Seat Sofa with Storage Ottoman, Small Sofas & Couches for Living Room, Bedroom and Apartment, Beige",B0CRPBHHKS,https://m.media-amazon.com/images/I/81G+u9U2-8L._AC_UL320_.jpg,$285.00,True,,4.6 out of 5 stars,6
https://www.amazon.com/AMADA-HOMEFURNISHING-Freestanding-Configurations-AMWCR01/dp/B0CHYD183Q/ref=sr_1_29?keywords=furniture&qid=1707635878&sr=8-29,"AMADA HOMEFURNISHING Coat Rack Stand, Wooden Coat Rack Freestanding with 8 Hooks, Coat Tree with 3 Height Configurations for Entryway, Hallway, Bedroom, Office, AMWCR01",B0CHYD183Q,https://m.media-amazon.com/images/I/517dpKhDhwL._AC_UL320_.jpg,$27.99,True,$3.00 coupon applied at checkoutSave $3.00 with coupon,4.7 out of 5 stars,62
https://www.amazon.com/Hzuaneri-Blanket-Ladder-Decorative-Removable/dp/B0CC2BGQTJ/ref=sr_1_30?keywords=furniture&qid=1707635878&sr=8-30,"Blanket Ladder - for Bedroom, Decorative Wood Quilt Rack with 4 Removable Hooks, 5-Tier Farmhouse Ladder Holder Organizer for Bathroom Living Room, Greige and Black BR02105B",B0CC2BGQTJ,https://m.media-amazon.com/images/I/71gR1BgXE7L._AC_UL320_.jpg,2 sizes,True,Join Prime to buy this item at $35.99$46.99,4.6 out of 5 stars,111
https://www.amazon.com/Mavivegue-10-Tiers-Organizer-Stackable/dp/B0C4B13QD7/ref=sr_1_31?keywords=furniture&qid=1707635878&sr=8-31,"Mavivegue 10 Tiers Shoe Rack Tall Shoe Organizer Shoe Storage 55-65 Pairs Vertical Shoe Shelf Large Shoe Rack Organizer Stackable Shoe Racks for Entryway, Closet, Garage, Bedroom,Cloakroom -Black",B0C4B13QD7,https://m.media-amazon.com/images/I/81LMqa63GZL._AC_UL320_.jpg,6 sizes,True,List:$44.99,4.5 out of 5 stars,4372
https://www.amazon.com/Cat-Furniture-Protector-12-Protector-Self-Adhesive/dp/B0BM38JZL8/ref=sr_1_32?keywords=furniture&qid=1707635878&sr=8-32,"Anti Cat Scratch Furniture Protector-12 Pack Single Side Couch Protector for Cats, Self-Adhesive Cat Tape for Furniture, Clear Cat Scratch Deterrent for Furniture Door Walls (12P+52 Pins)",B0BM38JZL8,https://m.media-amazon.com/images/I/81EJlt1CzqL._AC_UL320_.jpg,$17.99,True,List:$20.99,4.4 out of 5 stars,938
https://www.amazon.com/Bookshelf-Mid-Century-Bookshelves-Organizer-Bookcases/dp/B097BQZFCW/ref=sr_1_33?keywords=furniture&qid=1707635878&sr=8-33,"LEYAOYAO Cube Bookshelf 3 Tier Mid-Century Rustic Brown Modern Bookcase with Legs,Retro Wood Bookshelves Storage Organizer Shelf,Freestanding Open Book Shelves for Bedroom,Living Room,Office",B097BQZFCW,https://m.media-amazon.com/images/I/71IYyDFg3BL._AC_UL320_.jpg,8 sizes,True,$15.00 coupon applied at checkoutSave $15.00 with coupon$139.99,4.5 out of 5 stars,1909
https://www.amazon.com/Yomeie-Rechargeable-Remover-Electric-Furniture/dp/B0CH33ZQZ8/ref=sr_1_34?keywords=furniture&qid=1707635878&sr=8-34,"Rechargeable Fabric Shaver, Lint Remover, Electric Lint Shaver for Furniture & Clothes, Sweater Shaver & Pill Remover - Effivent, Effortlessly Remove Pilling, Lint, Fuzz from Woolen Coat, Gray",B0CH33ZQZ8,https://m.media-amazon.com/images/I/71wvaluYW6L._AC_UL320_.jpg,$14.90,True,Join Prime to buy this item at $12.50$18.88,4.3 out of 5 stars,173
https://www.amazon.com/BOWERBIRD-Clear-Toy-Blockers-Furniture/dp/B08TGZJ4N4/ref=sr_1_35?keywords=furniture&qid=1707635878&sr=8-35,Clear Toy Blockers for Furniture - Stop Things from Going Under Couch Sofa Bed and Other Furniture - Suit for Hard Surface Floors Only,B08TGZJ4N4,https://m.media-amazon.com/images/I/71QBc9EIWSL._AC_UL320_.jpg,$19.99,True,List:$2.50,4.0 out of 5 stars,6652
https://www.amazon.com/Tribesigns-Console-Entryway-Industrial-Hallway/dp/B09TVJCF2X/ref=sr_1_36?keywords=furniture&qid=1707635878&sr=8-36,"Tribesigns Long Console Sofa Table, 70.89 inches, 3 Tier, Industrial Large Storage Rustic Behind Couch Accent Table for Entryway Hallway Living Room Garage",B09TVJCF2X,https://m.media-amazon.com/images/I/81LDisN0IuL._AC_UL320_.jpg,$159.99,False,$10.00 coupon applied at checkoutSave $10.00 with coupon,4.5 out of 5 stars,137
https://www.amazon.com/gogobunny-Double-Sided-Waterproof-Furniture-Reversible/dp/B0B1298YJ6/ref=sr_1_37?keywords=furniture&qid=1707635878&sr=8-37,"gogobunny 100% Double-Sided Waterproof Dog Bed Cover Pet Blanket Sofa Couch Furniture Protector for Kids Children Dog Cat, Reversible (52x82 Inch (Pack of 1), Dark Beige/Light Beige)",B0B1298YJ6,https://m.media-amazon.com/images/I/91+fN1GH7OL._AC_UL320_.jpg,9 sizes,True,10% coupon applied at checkoutSave 10% with coupon$25.99,4.5 out of 5 stars,6500
https://www.amazon.com/Set-Conversation-Coffee-Table-Bistro/dp/B07NZNZXMV/ref=sr_1_38?keywords=furniture&qid=1707635878&sr=8-38,"FDW Patio Furniture Set 4 Pieces Outdoor Rattan Chair Wicker Sofa Garden Conversation Bistro Sets for Yard,Pool or Backyard",B07NZNZXMV,https://m.media-amazon.com/images/I/61ig4fmnenL._AC_UL320_.jpg,$129.99,False,$10.00 coupon applied at checkoutSave $10.00 with coupon$199.99,4.3 out of 5 stars,5891
https://www.amazon.com/Furniture-Adhesive-Hardwood-Protectors-Sliders/dp/B09DCH6Z8Q/ref=sr_1_39?keywords=furniture&qid=1707635878&sr=8-39,"Felt Furniture Pads, 258 Pack, Self Adhesive Hardwood Floor Protectors, Easy Furniture Sliders for Chairs, Table, Bed... 222 Pcs Beige Thick Pads + 36 Pcs Cabinet Bumpers",B09DCH6Z8Q,https://m.media-amazon.com/images/I/71+DisXJhxL._AC_UL320_.jpg,$9.99,True,($0.04$0.04/Count)$0.04,4.5 out of 5 stars,476
https://www.amazon.com/4our-Kiddies-Furniture-Adjustable-Earthquake/dp/B0CFVGPDP2/ref=sr_1_40?keywords=furniture&qid=1707635878&sr=8-40,"4our Kiddies Furniture Straps (6 Pack) Baby Proofing Anti Tip Furniture Anchors Kit, Cabinet Wall Anchors Protect Toddlers from Falling Furniture, Adjustable Child Safety Straps Earthquake Resistant",B0CFVGPDP2,https://m.media-amazon.com/images/I/81UVZ95XJNL._AC_UL320_.jpg,$7.99,True,,4.6 out of 5 stars,6489
https://www.amazon.com/Hansleep-Mattress-Cooling-Breathable-Charcoal/dp/B0CC25B4CG/ref=sr_1_41?keywords=furniture&qid=1707635878&sr=8-41,"Hansleep Memory Foam Twin Size Mattress Topper, Twin Cooling Mattress Pad with Deep Pocket, Breathable Air Twin Mattress Cover, 39x75 Inches, Charcoal",B0CC25B4CG,https://m.media-amazon.com/images/I/71MMw2DPCgL._AC_UL320_.jpg,7 sizes,True,Typical:$42.99,4.3 out of 5 stars,5518
https://www.amazon.com/Yoobure-Shaped-Spaces-Living-Bedroom/dp/B0BNBRRRLP/ref=sr_1_42?keywords=furniture&qid=1707635878&sr=8-42,"Yoobure C Table End Table Set of 2, Side Tables Living Room, C Shaped Side Table, Couch Tables That Slide Under Couch Table with Metal Frame, Rustic Snack Table for Bedroom/Small Spaces Large Desktop",B0BNBRRRLP,https://m.media-amazon.com/images/I/61GgOnQInfL._AC_UL320_.jpg,$44.94,True,List:$52.99,4.6 out of 5 stars,726
https://www.amazon.com/Vertical-Organizer-Entryway-Bedroom-Stackable/dp/B0CBHGX21M/ref=sr_1_43?keywords=furniture&qid=1707635878&sr=8-43,"Bamboo Shoe Rack 17 Tier- Vertical Shoe Rack for Small Spaces, Tall Narrow Shoe Rack Organizer for Closet Entryway Corner Garage and Bedroom,Skinny Shoe Shelf with Free Stackable DIY",B0CBHGX21M,https://m.media-amazon.com/images/I/71fmKhpu+BL._AC_UL320_.jpg,3 sizes,True,,3.7 out of 5 stars,236
https://www.amazon.com/Devoko-Furniture-All-Weather-Sectional-Conversation/dp/B07M6VPZ19/ref=sr_1_44?keywords=furniture&qid=1707635878&sr=8-44,Devoko 5 Pieces Patio Furniture Sets All Weather Outdoor Sectional Patio Sofa Manual Weaving Wicker Rattan Patio Seating Sofas with Cushion and Glass Table(Beige),B07M6VPZ19,https://m.media-amazon.com/images/I/71+8aYgLfML._AC_UL320_.jpg,$279.99,False,List:$438.99,4.2 out of 5 stars,6852
https://www.amazon.com/Playpen-Toddlers-Playards-Nursery-Furniture/dp/B0C5M8WRMN/ref=sr_1_45?keywords=furniture&qid=1707635878&sr=8-45,Baby Playpen with Mat Small Playpen Play Pin for Babies and Toddlers 50 x 50 inch Baby Fence Playards Nursery Furniture Set,B0C5M8WRMN,https://m.media-amazon.com/images/I/71kd+MqC2lL._AC_UL320_.jpg,$79.99,True,10% coupon applied at checkoutSave 10% with coupon,4.4 out of 5 stars,1269
https://www.amazon.com/HOMIDEC-Organizer-Organizers-Portable-Wardrobe/dp/B09PH8G69M/ref=sr_1_46?keywords=furniture&qid=1707635878&sr=8-46,"HOMIDEC Closet Organizer, 9-Cube , Portable Storage Shelves for Garment Racks, Closet, Wardrobe",B09PH8G69M,https://m.media-amazon.com/images/I/81NhY9hu5rL._AC_UL320_.jpg,$31.98,True,Save 5% on 2 select item(s)$35.99,4.4 out of 5 stars,3409
https://www.amazon.com/HOOBRO-Charging-Station-Nightstand-BK09UBZP201/dp/B0BTLJN4HQ/ref=sr_1_47?keywords=furniture&qid=1707635878&sr=8-47,"Side Table with Charging Station, Set of 2 End Tables with USB Ports and Outlets, Nightstand with 2-Layer Storage Shelves for Small Spaces, Living Room, Bedroom, Black BK09UBZP201",B0BTLJN4HQ,https://m.media-amazon.com/images/I/71nrOzguiPL._AC_UL320_.jpg,$49.99,True,10% coupon applied at checkoutSave 10% with coupon$65.99,4.5 out of 5 stars,888
https://www.amazon.com/Bedroom-Fluffy-Circle-Carpet-Nursery/dp/B086L74N8V/ref=sr_1_48?keywords=furniture&qid=1707635878&sr=8-48,"Hot Pink Fluffy Circle Round Rug 4'X4' for Kids Room, Furry Carpet for Teen Girls Bedroom, Shaggy Circular Rug for Nursery Room,Fuzzy Plush Rug for Dorm,Pink Carpet,Cute Room Decor",B086L74N8V,https://m.media-amazon.com/images/I/81fBD0Z8X+L._AC_UL320_.jpg,5 sizes,True,10% coupon applied at checkoutSave 10% with coupon$1.42,4.5 out of 5 stars,31239
