url,name,asin,image,price,isPrime,offer,customerReview,customerReviewCount
https://www.amazon.com/Leeleberd-Bedroom-Changing-Control-Bluetooth/dp/B0C2MHG632/ref=sr_1_1?keywords=bedroom&qid=1707637076&sr=8-1,"Led Lights for Bedroom 100 ft (2 Rolls of 50ft) Music Sync Color Changing RGB Led Strip Lights with Remote App Control Bluetooth Led Strip, Led Lights for Room Home Kitchen Decor Party",B0C2MHG632,https://m.media-amazon.com/images/I/815sBbUN7LL._AC_UL320_.jpg,$9.99,True,Typical:$12.99,4.4 out of 5 stars,15395
https://www.amazon.com/Jucaifu-Stackable-Entryway-Hallway-Organization/dp/B09PBFL4QY/ref=sr_1_2?keywords=bedroom&qid=1707637076&sr=8-2,"Stackable Small Shoe Rack, Entryway, Hallway and Closet Space Saving Storage and Organization (4-Tier, Black)",B09PBFL4QY,https://m.media-amazon.com/images/I/71VWRoUwqoL._AC_UL320_.jpg,3 sizes,True,List:$14.99,4.0 out of 5 stars,6281
https://www.amazon.com/JEOYOO-Frameless-Bedroom-shatterproof-Mirror%EF%BC%8C32/dp/B0BXKGBL4Q/ref=sr_1_3?keywords=bedroom&qid=1707637076&sr=8-3,"Full Length Wall Mirror Tiles, 8'' x 8'' x 8 PCS, Frameless Full Body Mirror Tiles for Bedroom,shatterproof Non Glass Mirrors Wall Mounted for Home Gym, Over The Door, Kids Mirror，32""x16""",B0BXKGBL4Q,https://m.media-amazon.com/images/I/51zGlDqUPqL._AC_UL320_.jpg,8 sizes,True,Join Prime to buy this item at $14.39,3.7 out of 5 stars,1256
https://www.amazon.com/VZINO-Organizer-Cosmetics-Stationery-Countertops/dp/B09WMSDYLT/ref=sr_1_4?keywords=bedroom&qid=1707637076&sr=8-4,"Drawer Makeup Organizer for Vanity, Large White Desk Organizer for Cosmetics, Skincare, or Stationery, Perfect for Bedroom and Office Countertops",B09WMSDYLT,https://m.media-amazon.com/images/I/61Q0IOiIl5S._AC_UL320_.jpg,$21.99,True,5% coupon applied at checkoutSave 5% with coupon$23.99,4.2 out of 5 stars,463
https://www.amazon.com/AMHANCIBLE-Nightstands-Charging-Station-Outlets/dp/B0B1781M5L/ref=sr_1_5?keywords=bedroom&qid=1707637076&sr=8-5,"AMHANCIBLE Night Stand, Nightstands Set of 2 with Charging Station, Small End Tables with USB Ports & Outlets, Slim Bedside Table with Fabric Drawer for Bedroom, Small Spaces, Gerige, HET03SDPGY",B0B1781M5L,https://m.media-amazon.com/images/I/81WjYPCkjaL._AC_UL320_.jpg,$69.99,True,List:$99.99,4.3 out of 5 stars,1320
https://www.amazon.com/Toneed-Fluffy-Bedroom-Nursery-Decorative/dp/B0C3QZKV76/ref=sr_1_6?keywords=bedroom&qid=1707637076&sr=8-6,"Fluffy Runner Rug for Bedroom Living Room, 2 x 6 Feet Gray Shaggy Rug Super Soft Modern Indoor Area Rug Fuzzy Plush Carpet for Dorm Nursery Kids Room Home Decorative",B0C3QZKV76,https://m.media-amazon.com/images/I/81ffL3DD+sL._AC_UL320_.jpg,4 sizes,True,10% coupon applied at checkoutSave 10% with coupon,4.3 out of 5 stars,1867
https://www.amazon.com/VTRIN-Organizer-Entryway-Storage-Durable/dp/B09L6Z6679/ref=sr_1_7?keywords=bedroom&qid=1707637076&sr=8-7,VTRIN Narrow Shoe Rack with Covers 10 Tiers Tall Shoe Rack for Closet Entryway Sturdy Shoe Rack Organizer Holds 20-22 Pairs Free Standing Shoe Storage Cabinet with Dustproof Cover Shoe Shelf,B09L6Z6679,https://m.media-amazon.com/images/I/61jiYKWngZL._AC_UL320_.jpg,$29.99,True,"Buy any 2, Save 3%$39.99",4.4 out of 5 stars,1384
https://www.amazon.com/Durmmur-Baseball-Stainless-Organizer-Adhesive/dp/B0C4H3Z6K7/ref=sr_1_8?keywords=bedroom&qid=1707637076&sr=8-8,"2 Pack Hat Racks for Baseball Caps, Stainless Steel Hat Organizer for Baseball Cap, Hat Holder Storage Organizer, Hat Hanger Strong Adhesive/Wall Drilled for Door,Bedroom,Closet(Black)",B0C4H3Z6K7,https://m.media-amazon.com/images/I/715X-O-Y0NL._AC_UL320_.jpg,$7.99,True,($4.00$4.00/Count)$4.00,4.4 out of 5 stars,690
https://www.amazon.com/Yoobure-Tree-Bookshelf-Standing-Organizer/dp/B0BQBZSK7F/ref=sr_1_9?keywords=bedroom&qid=1707637076&sr=8-9,"Yoobure Tree Bookshelf - 6 Shelf Retro Floor Standing Bookcase, Tall Wood Book Storage Rack for CDs/Movies/Books, Utility Book Organizer Shelves for Bedroom, Living Room, Home Office",B0BQBZSK7F,https://m.media-amazon.com/images/I/61pfi70XekL._AC_UL320_.jpg,$49.99,True,15% coupon applied at checkoutSave 15% with coupon$59.99,4.5 out of 5 stars,1054
https://www.amazon.com/Rolanstar-Charging-Station-Nightstand-Storage/dp/B09W9KJL78/ref=sr_1_10?keywords=bedroom&qid=1707637076&sr=8-10,"Rolanstar End Table with Charging Station, Nightstand with 3 Storage Shelves, Narrow Side Table with USB Ports & Power Outlets, Small Sofa Table for Living Room or Bedroom, Rustic Brown",B09W9KJL78,https://m.media-amazon.com/images/I/71rjHrnjuDL._AC_UL320_.jpg,$39.99,True,Join Prime to buy this item at $35.99$45.99,4.5 out of 5 stars,1930
https://www.amazon.com/Portable-Blackout-Transparent-Temporary-Night-ShifSt/dp/B0B9SFY685/ref=sr_1_11?keywords=bedroom&qid=1707637076&sr=8-11,"100% Blackout Curtains for Bedroom, Portable DIY Window Blinds, No Drill Window Shades & Blackout Blinds with Stickers & Tabs for Baby Nursery, Travel, Dorm Room (118"" x 57"")",B0B9SFY685,https://m.media-amazon.com/images/I/71R+lLeFhlL._AC_UL320_.jpg,2 sizes,True,List:$39.99,4.3 out of 5 stars,747
https://www.amazon.com/KANTUTOE-Backlights-Bluetooth-Control-Powered/dp/B0C9ZGSWXG/ref=sr_1_12?keywords=bedroom&qid=1707637076&sr=8-12,"TV Backlights, 13.1FT LED Lights for 32-65 Inch TV, RGB TV LED Lights Behind, Music Sync Bluetooth APP and Remote Control TV LED Strip Lights USB Powered for Gaming/Bedroom",B0C9ZGSWXG,https://m.media-amazon.com/images/I/71Zx3H2AsvL._AC_UL320_.jpg,$9.99,True,List:$0.76,4.4 out of 5 stars,1585
https://www.amazon.com/Ninestars-DZT-12-5PK-Automatic-Touchless-Rectangular/dp/B077GWL4T2/ref=sr_1_13?keywords=bedroom&qid=1707637076&sr=8-13,"Ninestars DZT-12-5PK Bedroom or Bathroom Automatic Touchless Infrared Motion Sensor Trash Can, 3 Gal 12 L, ABS Plastic (Rectangular, Pink) Trashcan",B077GWL4T2,https://m.media-amazon.com/images/I/71cxrAaex-L._AC_UL320_.jpg,$26.62,True,,4.5 out of 5 stars,12811
https://www.amazon.com/Charging-3-Tiered-Storage-Combination-Standing/dp/B07VL7ZD9H/ref=sr_1_14?keywords=bedroom&qid=1707637076&sr=8-14,"SHINE HAI 3-in-1 Shelf Floor Lamp with 1 USB&Type C&1 AC Outlet, 3-Tiered LED Shelf Lamp, Shelf & Storage Floor Lamp Combination Modern Standing Light",B07VL7ZD9H,https://m.media-amazon.com/images/I/61OAVuNmpJL._AC_UL320_.jpg,$55.99,True,Join Prime to buy this item at $40.99$79.99,4.5 out of 5 stars,6697
https://www.amazon.com/Digital-Display-Charger-Brightness-Electronic/dp/B099NTPWWD/ref=sr_1_15?keywords=bedroom&qid=1707637076&sr=8-15,"SZELAM Digital Alarm Clock,LED and Mirror Desk Clock Large Display,with Dual USB Charger Ports,3 Levels Brightness,12/24H,Modern Electronic Clock for Bedroom Home Living Room Office - Gold",B099NTPWWD,https://m.media-amazon.com/images/I/61JsbsKt7wS._AC_UL320_.jpg,$22.95,True,10% coupon applied at checkoutSave 10% with coupon$24.95,4.3 out of 5 stars,29951
https://www.amazon.com/HONJIN-Key-Mail-Holder-Wall/dp/B0BQLGJGQS/ref=sr_1_16?keywords=bedroom&qid=1707637076&sr=8-16,Key and Mail Holder for Wall: Rustic Key Hanger Key Rack Organizer with 5 Sturdy Key Hooks for Entryway Bedroom Kitchen House Decor (Grey),B0BQLGJGQS,https://m.media-amazon.com/images/I/71JcGpL-rpL._AC_UL320_.jpg,$9.98,True,,4.6 out of 5 stars,2593
https://www.amazon.com/Lifewit-Removable-Collapsible-Dividers-Bathroom/dp/B08DFLJL24/ref=sr_1_17?keywords=bedroom&qid=1707637076&sr=8-17,"Lifewit Double Laundry Hamper with Lid and Removable Laundry Bags, Large Collapsible 2 Dividers Dirty Clothes Basket with Handles for Bedroom, Laundry Room, Closet, Bathroom, College, Grey",B08DFLJL24,https://m.media-amazon.com/images/I/81nEZu54AvL._AC_UL320_.jpg,$29.96,True,,4.5 out of 5 stars,11278
https://www.amazon.com/Greenco-Corner-Shelves-Espresso-Finish/dp/B01GIJBK50/ref=sr_1_18?keywords=bedroom&qid=1707637076&sr=8-18,"Corner Shelf, Greenco 5 Tier Shelves for Wall Storage, Easy-to-Assemble Floating Wall Mount Shelves for Offices, Bedrooms, Bathrooms, Kitchens, Living Rooms and Dorm Rooms, Espresso Finish",B01GIJBK50,https://m.media-amazon.com/images/I/718cQsxYvQL._AC_UL320_.jpg,$28.21,True,List:$29.99,4.5 out of 5 stars,61843
https://www.amazon.com/Ophanie-Fluffy-Non-Slip-Bedroom-Nursery/dp/B08C2QFZLJ/ref=sr_1_19?keywords=bedroom&qid=1707637076&sr=8-19,"Ophanie Area Rugs for Bedroom Living Room, 4x6 Black Fluffy Fuzzy Shag Shaggy Carpet Soft Plush Furry Bedside Rug, Indoor Floor Rug for Kids Girls Boys Home Decor Aesthetic, Dorm Nursery",B08C2QFZLJ,https://m.media-amazon.com/images/I/81Q6JKYkbhL._AC_UL320_.jpg,7 sizes,True,Join Prime to buy this item at $24.99$1.32,4.3 out of 5 stars,25378
https://www.amazon.com/Noahas-Fluffy-Bedroom-Living-Nursery/dp/B09TDC6XJL/ref=sr_1_20?keywords=bedroom&qid=1707637076&sr=8-20,"Noahas Fluffy Bedroom Rug Carpet,4x5.3 Feet Shaggy Fuzzy Rugs for Bedroom,Soft Rug for Kids Room,Plush Nursery Rug for Baby,Thick Black Area Rugs for Living Room,Cute Room Decor for Girls Boys",B09TDC6XJL,https://m.media-amazon.com/images/I/81jbe3OpfGL._AC_UL320_.jpg,9 sizes,True,20% coupon applied at checkoutSave 20% with coupon,4.3 out of 5 stars,19515
https://www.amazon.com/Upsimples-Home-Floating-Shelves-Different/dp/B09P2P7CFC/ref=sr_1_21?keywords=bedroom&qid=1707637076&sr=8-21,"Upsimples Home Floating Shelves for Wall Decor Storage, Wall Shelves Set of 5, Wall Mounted Wood Shelves for Bedroom, Living Room, Bathroom, Kitchen, Small Picture Ledge Shelves, Black",B09P2P7CFC,https://m.media-amazon.com/images/I/71-Tit-1KCL._AC_UL320_.jpg,2 sizes,True,$2.00 coupon applied at checkoutSave $2.00 with coupon$35.99,4.5 out of 5 stars,3937
https://www.amazon.com/Chicrug-Bedroom-Shedding-Children-Decorative/dp/B097479QQY/ref=sr_1_22?keywords=bedroom&qid=1707637076&sr=8-22,"Chicrug Soft Runner Rugs for Bedroom Living Room Plush Fluffy Rug 2x6 Feet, Shag Furry Area Rug Carpet Non Shedding for Nursery Children Kids Girls Room Home Decorative, Grey",B097479QQY,https://m.media-amazon.com/images/I/81P4e+zxnHL._AC_UL320_.jpg,11 sizes,True,List:$1.53,4.1 out of 5 stars,4717
https://www.amazon.com/Easy-Eco-Life-Accessories-Organizer/dp/B07BPVQZ3H/ref=sr_1_23?keywords=bedroom&qid=1707637076&sr=8-23,"EHKIT Bedside Shelf Accessories Organizer- Wall Mount Self Stick On,Ideal for Glasses,Remote,Earphone, Cell Phone Charger,Manicure Kit",B07BPVQZ3H,https://m.media-amazon.com/images/I/81J1yT9lqUL._AC_UL320_.jpg,$9.99,True,List:$19.99,4.5 out of 5 stars,10779
https://www.amazon.com/Purifiers-Bedroom-FULMINARE-Cleaner-Microns/dp/B0B4ZSKPNL/ref=sr_1_24?keywords=bedroom&qid=1707637076&sr=8-24,"Air Purifiers for Bedroom, FULMINARE H13 True HEPA Air Filter, Quiet Air Cleaner With Night Light,Portable Small Air Purifier for Home, Office, Living Room",B0B4ZSKPNL,https://m.media-amazon.com/images/I/71QchmbOFLL._AC_UL320_.jpg,$38.99,True,$37.04 with Subscribe & Save discount5% coupon applied at checkoutSave 5% with coupon$69.99,4.4 out of 5 stars,2859
https://www.amazon.com/Bedroom-Control-Changing-Festival-Decoration/dp/B0932M1666/ref=sr_1_25?keywords=bedroom&qid=1707637076&sr=8-25,"Led Lights for Bedroom 100ft (2 Rolls of 50ft) Music Sync Color Changing Strip Lights with Remote and App Control RGB Strip, for Room Home Party Decoration",B0932M1666,https://m.media-amazon.com/images/I/71hrEz6LYvL._AC_UL320_.jpg,$9.99,True,10% coupon applied at checkoutSave 10% with coupon$12.99,4.4 out of 5 stars,72886
https://www.amazon.com/DAYBETTER-Lights-Changing-Bedroom-Decoration/dp/B0BYN7F7Y2/ref=sr_1_26?keywords=bedroom&qid=1707637076&sr=8-26,"DAYBETTER Led Strip Lights 130ft (2 Rolls of 65.6ft) Color Changing Lights Strip for Bedroom, Desk, Indoor Room Bedroom Valentine Decor, with Remote and 24V Power Supply",B0BYN7F7Y2,https://m.media-amazon.com/images/I/813vxzjiChL._AC_UL320_.jpg,$9.97,True,List:$29.99,4.4 out of 5 stars,135036
https://www.amazon.com/Stuffed-Storage-Light-Macrame-Organizer-Decoration-Hanging/dp/B0BWJNKCCK/ref=sr_1_27?keywords=bedroom&qid=1707637076&sr=8-27,"Stuffed Animal Toy Storage Hammock with LED Light-Macrame Jumbo Doll Room Corner Organizer Mesh Decoration-Hanging Storage Nets Kids Bedroom, (X-Large Size)",B0BWJNKCCK,https://m.media-amazon.com/images/I/71q6TchhMYL._AC_UL320_.jpg,2 sizes,True,,4.7 out of 5 stars,2080
https://www.amazon.com/Sweetcrispy-Standing-Hanging-Aluminum-Cloakroom/dp/B0CQRRYL5G/ref=sr_1_28?keywords=bedroom&qid=1707637076&sr=8-28,"Sweetcrispy Arched Full Length Mirror 59""x16"" Full Body Floor Mirror Standing Hanging or Leaning Wall, Arch Wall Mirror with Stand Aluminum Alloy Thin Frame for Bedroom Cloakroom,Black",B0CQRRYL5G,https://m.media-amazon.com/images/I/71T7iC8kZvL._AC_UL320_.jpg,3 sizes,False,List:$49.99,4.4 out of 5 stars,297
https://www.amazon.com/Humidifiers-Humidifier-Ultrasonic-Filterless-Shut-Off/dp/B0B9MCCY1K/ref=sr_1_29?keywords=bedroom&qid=1707637076&sr=8-29,"Humidifiers for Bedroom, Cool Mist Humidifier for Home Plant and Baby Nursery, Quiet Ultrasonic Humidifier with 360° Nozzle, Auto Shut-Off, Filterless, Black",B0B9MCCY1K,https://m.media-amazon.com/images/I/51seA872XqL._AC_UL320_.jpg,$21.99,True,List:$32.99,4.3 out of 5 stars,4146
https://www.amazon.com/Krisler-Adjustable-Anti-Shake-Headboard-Headboards/dp/B07ZQM2QX9/ref=sr_1_30?keywords=bedroom&qid=1707637076&sr=8-30,"Adjustable Threaded Bed Frame Anti-Shake Tool, Headboard Stoppers, Bedside Headboards Prevent loosening Anti-Shake Fixer, Easy Install (30-112mm)",B07ZQM2QX9,https://m.media-amazon.com/images/I/71W+-eHphQL._AC_UL320_.jpg,$9.99,True,,4.3 out of 5 stars,7897
https://www.amazon.com/Wall-Sconces-Set-Battery-Operated/dp/B0C2Y8T46V/ref=sr_1_31?keywords=bedroom&qid=1707637076&sr=8-31,Wall Sconces Set of Two Battery Operated: Magnetic Wall Lamp Rechargeable Wall Lights 16 RGB Colors Dimmable with Fabric Linen Shade Remote Control Wall Decor for Bedroom Living Room Hallway,B0C2Y8T46V,https://m.media-amazon.com/images/I/71cjxDlk1JL._AC_UL320_.jpg,$33.99,True,Join Prime to buy this item at $27.99,4.1 out of 5 stars,167
https://www.amazon.com/StorageRight-Containers-Organizing-Comforter-Organizer/dp/B09LMBKTZ8/ref=sr_1_32?keywords=bedroom&qid=1707637076&sr=8-32,"StorageRight Storage Bins Clothes Storage, Foldable Blanket Storage Bags, Under Bed Storage Containers for Organizing, Clothing, Bedroom, Comforter, Closet, Dorm, Quilts, Organizer, 3-Pack Black",B09LMBKTZ8,https://m.media-amazon.com/images/I/71GCoeMXU5L._AC_UL320_.jpg,4 sizes,True,10% coupon applied at checkoutSave 10% with coupon$6.66,4.2 out of 5 stars,5969
https://www.amazon.com/Purivortex-Purifiers-Bedroom-A11ergies-Certificaion/dp/B0B9SL7894/ref=sr_1_33?keywords=bedroom&qid=1707637076&sr=8-33,"Air Purifiers for Bedroom, H13 True HEPA Filter for A11ergies, Pollen, Dusts, Pets Dander, Odor, Hair, Ozone Free, 20db Quiet for Home, Room, Kitchen, SGS Certificaion - AC400 Black",B0B9SL7894,https://m.media-amazon.com/images/I/71SOtLaSt8L._AC_UL320_.jpg,$39.99,True,$10.00 coupon applied at checkoutSave $10.00 with coupon$49.99,4.5 out of 5 stars,1236
https://www.amazon.com/upsimples-Floating-Shelves-Brackets-Bathroom/dp/B0BX59CFN1/ref=sr_1_34?keywords=bedroom&qid=1707637076&sr=8-34,"upsimples Floating Shelves for Wall Decor Storage, Dark Brown Wall Mounted Shelves Set of 5, Sturdy Small Wood Shelves Hanging for Bedroom, Living Room, Bathroom, Kitchen, Corner, Book",B0BX59CFN1,https://m.media-amazon.com/images/I/71dh0MG5W0L._AC_UL320_.jpg,$22.99,True,10% coupon applied at checkoutSave 10% with coupon,4.7 out of 5 stars,960
https://www.amazon.com/HXWEIYE-Curtain-Controller-Weddings-Decorations%EF%BC%889-8x9-8Ft/dp/B085Y1J85P/ref=sr_1_35?keywords=bedroom&qid=1707637076&sr=8-35,"HXWEIYE 300LED Fairy Curtain Lights, 9.8x9.8Ft Warm White USB Plug in 8 Modes Christmas String Hanging Lights with Remote for Bedroom, Indoor, Outdoor, Weddings, Party",B085Y1J85P,https://m.media-amazon.com/images/I/71b7xntFFTL._AC_UL320_.jpg,$9.99,True,List:$15.99,4.3 out of 5 stars,10140
https://www.amazon.com/Projection-Rotatable-Projector-Brightness-Progressive/dp/B0B45XH44P/ref=sr_1_36?keywords=bedroom&qid=1707637076&sr=8-36,"Projection Alarm Clock, Digital Clock with 180° Rotatable Projector, 3-Level Brightness Dimmer, Clear LED Display, USB Charger, Progressive Volume, 9mins Snooze,12/24H, for Bedroom",B0B45XH44P,https://m.media-amazon.com/images/I/71LRPXmn1-L._AC_UL320_.jpg,$19.99,True,$3.00 coupon applied at checkoutSave $3.00 with coupon$35.99,4.5 out of 5 stars,5452
https://www.amazon.com/Lifewit-Laundry-Removable-Foldable-Bathroom/dp/B0BK81Q817/ref=sr_1_37?keywords=bedroom&qid=1707637076&sr=8-37,"Lifewit 100L Laundry Basket with Lid, Clothes Hampers for Laundry with Bamboo Handles and A Removable Laundry Bag, Large Foldable Laundry Hamper for Bedroom, Bathroom, Dorm, Laundry Room, Black",B0BK81Q817,https://m.media-amazon.com/images/I/61RkhD6TlrL._AC_UL320_.jpg,$24.99,True,,4.3 out of 5 stars,869
https://www.amazon.com/JARLINK-Organizer-Organizers-Cosmetics-Stationery/dp/B09B6XK8B7/ref=sr_1_38?keywords=bedroom&qid=1707637076&sr=8-38,"JARLINK 2 Pack 5-Shelf Over Door Hanging Organizer, Foldable Wall Mount 4 Big Pocket Large Capacity Storage with PVC Clear Window for Bedroom, Kitchen, Cosmetics, Toys, Sundries, etc (Black)",B09B6XK8B7,https://m.media-amazon.com/images/I/81UDKukHQ6L._AC_UL320_.jpg,$35.99,True,Join Prime to buy this item at $24.20$18.00,4.6 out of 5 stars,1067
https://www.amazon.com/YJ-GWL-Bedroom-Shedding-Nursery-Bedside/dp/B0BNDS6HLM/ref=sr_1_39?keywords=bedroom&qid=1707637076&sr=8-39,"YJ.GWL Fluffy Runner Rugs for Bedroom Living Room Soft Shag Rug 2x6 Feet, Grey Plush Carpet Non Slip for Nursery Dorm, Fuzzy Bedside Rug for Kids Boys Girls Room Home Decor",B0BNDS6HLM,https://m.media-amazon.com/images/I/81SERDh4GRL._AC_UL320_.jpg,8 sizes,True,List:$19.98,4.3 out of 5 stars,3704
https://www.amazon.com/AstroAI-Skincare-Thermoelectric-Cosmetics-Christmas/dp/B0CJ2DL4J4/ref=sr_1_40?keywords=bedroom&qid=1707637076&sr=8-40,"AstroAI Mini Fridge 2.0 Gen, 6 Liter/8 Cans Makeup Skincare Fridge 110V AC/ 12V DC Portable Thermoelectric Cooler and Warmer Little Tiny Fridge for Bedroom, Cosmetics, Christmas (Dark Black)",B0CJ2DL4J4,https://m.media-amazon.com/images/I/71b9glQdhcL._AC_UL320_.jpg,$49.29,True,List:$62.99,4.4 out of 5 stars,3153
https://www.amazon.com/Ambimall-Bedroom-Temperature-Standing-Included/dp/B0BW2HBWRG/ref=sr_1_41?keywords=bedroom&qid=1707637076&sr=8-41,"Ambimall Dimmable Floor Lamp for Bedroom - 3 Color Temperature Light Bulb with Pull Chain Switch, Modern Corner Floor Lamps for Living Room, Office, Kids Room, Reading",B0BW2HBWRG,https://m.media-amazon.com/images/I/71uJOAuekOL._AC_UL320_.jpg,$39.99,True,Join Prime to buy this item at $28.49,4.6 out of 5 stars,346
https://www.amazon.com/Wakaye-6-Shelf-Over-Door-Organizer/dp/B0C2QJ8WMY/ref=sr_1_42?keywords=bedroom&qid=1707637076&sr=8-42,"6-Shelf Over the Door Organizer - Hanging Storage with 8 Large Capacity Pockets for Pantry, Nursery, Bathroom, Bedroom, Kitchen, Dorm, and Camper, Black",B0C2QJ8WMY,https://m.media-amazon.com/images/I/71lii1VNLyL._AC_UL320_.jpg,$23.99,True,20% coupon applied at checkoutSave 20% with coupon$25.99,4.5 out of 5 stars,865
https://www.amazon.com/Frigidaire-EFMIS129-EFMIS129-Portable-Freon-Free/dp/B09X9L419Z/ref=sr_1_43?keywords=bedroom&qid=1707637076&sr=8-43,"Frigidaire Pink EFMIS129- AMZ EFMIS129 Mini Portable Fridge, 4 litres Capacity Chills Six 12oz Cans, 100% Freon-Free & Eco Friendly, Beverage Cooler",B09X9L419Z,https://m.media-amazon.com/images/I/61jPL1itxPL._AC_UL320_.jpg,$37.99,True,List:$49.99,4.3 out of 5 stars,14825
https://www.amazon.com/Sweetcrispy-Standing-Aluminum-Hanging-Cloakroom/dp/B0CJ2JM7T1/ref=sr_1_44?keywords=bedroom&qid=1707637076&sr=8-44,"Sweetcrispy 59""x16"" Floor Standing Mirror, Wall Mirror with Stand, Full Length Aluminum Alloy Thin Frame Hanging or Leaning for Living Room Bedroom Cloakroom, Gold",B0CJ2JM7T1,https://m.media-amazon.com/images/I/81W0PQLLF+L._AC_UL320_.jpg,3 sizes,True,List:$49.99,4.3 out of 5 stars,618
https://www.amazon.com/Bedroom-Charging-Adjustable-Dimmable-Sleepers/dp/B087WNWL9V/ref=sr_1_45?keywords=bedroom&qid=1707637076&sr=8-45,"Alarm Clock for Bedroom, 2 Alarms Loud LED Big Display Plug in Simple Basic Digital Clock with USB Charging Port, Adjustable Volume, Dimmable, Snooze for Deep Sleepers Kids Elderly Home Office",B087WNWL9V,https://m.media-amazon.com/images/I/71ihKcbXByL._AC_UL320_.jpg,$14.99,True,Join Prime to buy this item at $12.99$19.99,4.4 out of 5 stars,22597
https://www.amazon.com/ZOZOO-Bedroom-Changing-Festival-Decoration/dp/B0BZVVB63N/ref=sr_1_46?keywords=bedroom&qid=1707637076&sr=8-46,"100ft Led Lights for Bedroom(2 Rolls of 50ft), Smart RGB Led Strip Lights with 44-Key Remote & APP Control Music Sync with Color Changing for Home Party Festival Decoration",B0BZVVB63N,https://m.media-amazon.com/images/I/81O22OYw+TL._AC_UL320_.jpg,$9.99,True,List:$19.99,4.4 out of 5 stars,10541
https://www.amazon.com/Sweetcrispy-Dresser-Bedroom-Drawers-Organizer/dp/B0CKXC263J/ref=sr_1_47?keywords=bedroom&qid=1707637076&sr=8-47,"Sweetcrispy Dresser for Bedroom with 5 Drawers, Wide Chest of Drawers, Long Fabric Dresser, Storage Organizer Unit for Closet, Bedroom, Living Room, Hallway, Nursery, Rustic Brown",B0CKXC263J,https://m.media-amazon.com/images/I/71sfbdNiMUL._AC_UL320_.jpg,$35.96,True,List:$39.96,4.1 out of 5 stars,197
https://www.amazon.com/Small-Bedroom-Lamps-Color-Temperatures/dp/B0BHVP949X/ref=sr_1_48?keywords=bedroom&qid=1707637076&sr=8-48,"Small Bedroom Lamps with USB C and A Ports 3 Color Temperatures - 2700K 3500K 5000K Pull Chain White Nightstand Bedside Table Lamps with AC Outlet, Metal Base for Kids Reading",B0BHVP949X,https://m.media-amazon.com/images/I/71C-9a3M-jL._AC_UL320_.jpg,$21.99,True,"Buy 2, save 3%$28.99",4.6 out of 5 stars,2276
