url,name,asin,image,price,isPrime,offer,customerReview,customerReviewCount
https://www.amazon.com/JC-Toys-Washable-Children-Berenguer/dp/B002APDYV0/ref=sr_1_1?keywords=toy+dolls&qid=1708158083&sr=8-1,Caucasian 11-inch Small Soft Body Baby Doll | JC Toys - La Baby | Washable |Removable Pink Outfit w/ Hat & Blanket | For Children 12 Months +,B002APDYV0,https://m.media-amazon.com/images/I/61TXxjZwD8L._AC_UL320_.jpg,$11.99,True,List:$26.29,4.7 out of 5 stars,18499
https://www.amazon.com/Enjoyin-Pacifier-Microfabric-Blanket-Feeding/dp/B09QRYLDK3/ref=sr_1_2?keywords=toy+dolls&qid=1708158083&sr=8-2,"12'' Baby Doll in Gift Box with Pink Cloths, Pacifier, 13''x13'' Microfabric Blanket, and Feeding Bottle. Gift Idea for Ages 3+",B09QRYLDK3,https://m.media-amazon.com/images/I/610pjMAPMIL._AC_UL320_.jpg,$23.95,True,,4.6 out of 5 stars,579
https://www.amazon.com/Disappearing-Feeding-Stroller-Bottles-Pacifier/dp/B07PQBSH8S/ref=sr_1_3?keywords=toy+dolls&qid=1708158083&sr=8-3,"fash n kolor®, My Sweet Baby Disappearing Doll Feeding Set | Baby Care 6 Piece Doll Feeding Set for Toy Stroller | 2 Milk & Juice Bottles with 2 Toy Pacifier for Baby Doll",B07PQBSH8S,https://m.media-amazon.com/images/I/81WqvyDwonL._AC_UL320_.jpg,$9.97,True,List:$15.99,4.7 out of 5 stars,14974
https://www.amazon.com/sspa/click?ie=UTF8&spc=MTo1MDU0NTQ4NzU0MzcxMDQ3OjE3MDgxNTgwODM6c3Bfc2VhcmNoX3RoZW1hdGljOjMwMDExOTg2OTcwMzcwMjo6MDo6&url=%2FJOYIN-Dinosaur-Vehicles-Transport-Helicopter%2Fdp%2FB0B9HV6SVG%2Fref%3Dsxin_14_pa_sp_search_thematic_sspa%3Fcontent-id%3Damzn1.sym.9877e0e3-4e2c-4fe3-bc39-5d1afac8a97a%253Aamzn1.sym.9877e0e3-4e2c-4fe3-bc39-5d1afac8a97a%26cv_ct_cx%3Dtoy%2Bdolls%26keywords%3Dtoy%2Bdolls%26pd_rd_i%3DB0B9HV6SVG%26pd_rd_r%3Dbff774b2-4c3c-4cdd-8327-0b5fdc05a7f0%26pd_rd_w%3DuIJcu%26pd_rd_wg%3DQDbOI%26pf_rd_p%3D9877e0e3-4e2c-4fe3-bc39-5d1afac8a97a%26pf_rd_r%3DQKP0Q0VE6BXG3Q3NN3KW%26qid%3D1708158083%26sbo%3DRZvfv%252F%252FHxDF%252BO5021pAnSA%253D%253D%26sr%3D1-1-2c727eeb-987f-452f-86bd-c2978cc9d8b9-spons%26sp_csd%3Dd2lkZ2V0TmFtZT1zcF9zZWFyY2hfdGhlbWF0aWM%26psc%3D1,"JOYIN 13 in 1 Dinosaur Truck Toys for Kids 3-5, 12 Pull Back Dinosaur Vehicles, Transport Carrier Truck, Music & Roaring Sound, Lights, Mini Dinosaur Car Set, Helicopter - Boy Toys Birthday Gifts",B0B9HV6SVG,https://m.media-amazon.com/images/I/81dPdCGZnVL._AC_UL320_.jpg,$39.99,True,List:$49.99,4.6 out of 5 stars,989
https://www.amazon.com/sspa/click?ie=UTF8&spc=MTo1MDU0NTQ4NzU0MzcxMDQ3OjE3MDgxNTgwODM6c3Bfc2VhcmNoX3RoZW1hdGljOjMwMDA2MjkxNDMwODkwMjo6MTo6&url=%2FBarbie-Fashionistas-Brunette-Stickers-Accessories%2Fdp%2FB09CG49L1C%2Fref%3Dsxin_14_pa_sp_search_thematic_sspa%3Fcontent-id%3Damzn1.sym.9877e0e3-4e2c-4fe3-bc39-5d1afac8a97a%253Aamzn1.sym.9877e0e3-4e2c-4fe3-bc39-5d1afac8a97a%26cv_ct_cx%3Dtoy%2Bdolls%26keywords%3Dtoy%2Bdolls%26pd_rd_i%3DB09CG49L1C%26pd_rd_r%3Dbff774b2-4c3c-4cdd-8327-0b5fdc05a7f0%26pd_rd_w%3DuIJcu%26pd_rd_wg%3DQDbOI%26pf_rd_p%3D9877e0e3-4e2c-4fe3-bc39-5d1afac8a97a%26pf_rd_r%3DQKP0Q0VE6BXG3Q3NN3KW%26qid%3D1708158083%26sbo%3DRZvfv%252F%252FHxDF%252BO5021pAnSA%253D%253D%26sr%3D1-2-2c727eeb-987f-452f-86bd-c2978cc9d8b9-spons%26sp_csd%3Dd2lkZ2V0TmFtZT1zcF9zZWFyY2hfdGhlbWF0aWM%26psc%3D1,Barbie Fashionistas Doll and Scooter Travel Playset with Pet Puppy and Themed Accessories (Amazon Exclusive),B09CG49L1C,https://m.media-amazon.com/images/I/71PSy3yvTIL._AC_UL320_.jpg,$31.43,True,List:$34.99,4.8 out of 5 stars,663
https://www.amazon.com/sspa/click?ie=UTF8&spc=MTo1MDU0NTQ4NzU0MzcxMDQ3OjE3MDgxNTgwODM6c3Bfc2VhcmNoX3RoZW1hdGljOjIwMDE3NTMzMzk1MDA5ODo6Mjo6&url=%2FBABESIDE-Reborn-Handmade-Realistic-Newborn%2Fdp%2FB0BZVM9JLG%2Fref%3Dsxin_14_pa_sp_search_thematic_sspa%3Fcontent-id%3Damzn1.sym.9877e0e3-4e2c-4fe3-bc39-5d1afac8a97a%253Aamzn1.sym.9877e0e3-4e2c-4fe3-bc39-5d1afac8a97a%26cv_ct_cx%3Dtoy%2Bdolls%26keywords%3Dtoy%2Bdolls%26pd_rd_i%3DB0BZVM9JLG%26pd_rd_r%3Dbff774b2-4c3c-4cdd-8327-0b5fdc05a7f0%26pd_rd_w%3DuIJcu%26pd_rd_wg%3DQDbOI%26pf_rd_p%3D9877e0e3-4e2c-4fe3-bc39-5d1afac8a97a%26pf_rd_r%3DQKP0Q0VE6BXG3Q3NN3KW%26qid%3D1708158083%26sbo%3DRZvfv%252F%252FHxDF%252BO5021pAnSA%253D%253D%26sr%3D1-3-2c727eeb-987f-452f-86bd-c2978cc9d8b9-spons%26sp_csd%3Dd2lkZ2V0TmFtZT1zcF9zZWFyY2hfdGhlbWF0aWM%26psc%3D1,"BABESIDE Reborn Baby Dolls - Bailyn, 20 Inch Handmade Realistic Baby Doll Soft Body Life Like Baby Dolls, Realistic Newborn Baby Dolls for Girls Boys Kids Age 3+",B0BZVM9JLG,https://m.media-amazon.com/images/I/71vpNgkkwZL._AC_UL320_.jpg,$38.99,True,Typical:$49.99,4.7 out of 5 stars,160
https://www.amazon.com/sspa/click?ie=UTF8&spc=MTo1MDU0NTQ4NzU0MzcxMDQ3OjE3MDgxNTgwODM6c3Bfc2VhcmNoX3RoZW1hdGljOjMwMDAwMTMzNjU4NjEwMjo6Mzo6&url=%2FBABESIDE-Lifelike-Reborn-Baby-Dolls%2Fdp%2FB0BNPVR1G2%2Fref%3Dsxin_14_pa_sp_search_thematic_sspa%3Fcontent-id%3Damzn1.sym.9877e0e3-4e2c-4fe3-bc39-5d1afac8a97a%253Aamzn1.sym.9877e0e3-4e2c-4fe3-bc39-5d1afac8a97a%26cv_ct_cx%3Dtoy%2Bdolls%26keywords%3Dtoy%2Bdolls%26pd_rd_i%3DB0BNPVR1G2%26pd_rd_r%3Dbff774b2-4c3c-4cdd-8327-0b5fdc05a7f0%26pd_rd_w%3DuIJcu%26pd_rd_wg%3DQDbOI%26pf_rd_p%3D9877e0e3-4e2c-4fe3-bc39-5d1afac8a97a%26pf_rd_r%3DQKP0Q0VE6BXG3Q3NN3KW%26qid%3D1708158083%26sbo%3DRZvfv%252F%252FHxDF%252BO5021pAnSA%253D%253D%26sr%3D1-4-2c727eeb-987f-452f-86bd-c2978cc9d8b9-spons%26sp_csd%3Dd2lkZ2V0TmFtZT1zcF9zZWFyY2hfdGhlbWF0aWM%26psc%3D1,"BABESIDE 17"" Realistic Reborn Baby Dolls - Soft Body, Anatomically Correct, with Diaper, Soothe Toy, Bottle, Pacifier & Birth Certificate",B0BNPVR1G2,https://m.media-amazon.com/images/I/71bjyeCsiHL._AC_UL320_.jpg,$44.99,True,Typical:$49.99,4.3 out of 5 stars,159
https://www.amazon.com/sspa/click?ie=UTF8&spc=MTo1MDU0NTQ4NzU0MzcxMDQ3OjE3MDgxNTgwODM6c3Bfc2VhcmNoX3RoZW1hdGljOjMwMDA0NjMxMzEwNDQwMjo6NDo6&url=%2FBarbie-Chelsea-Playset-Accessories-Transforms%2Fdp%2FB0BLJRDJRY%2Fref%3Dsxin_14_pa_sp_search_thematic_sspa%3Fcontent-id%3Damzn1.sym.9877e0e3-4e2c-4fe3-bc39-5d1afac8a97a%253Aamzn1.sym.9877e0e3-4e2c-4fe3-bc39-5d1afac8a97a%26cv_ct_cx%3Dtoy%2Bdolls%26keywords%3Dtoy%2Bdolls%26pd_rd_i%3DB0BLJRDJRY%26pd_rd_r%3Dbff774b2-4c3c-4cdd-8327-0b5fdc05a7f0%26pd_rd_w%3DuIJcu%26pd_rd_wg%3DQDbOI%26pf_rd_p%3D9877e0e3-4e2c-4fe3-bc39-5d1afac8a97a%26pf_rd_r%3DQKP0Q0VE6BXG3Q3NN3KW%26qid%3D1708158083%26sbo%3DRZvfv%252F%252FHxDF%252BO5021pAnSA%253D%253D%26sr%3D1-5-2c727eeb-987f-452f-86bd-c2978cc9d8b9-spons%26sp_csd%3Dd2lkZ2V0TmFtZT1zcF9zZWFyY2hfdGhlbWF0aWM%26psc%3D1,"Barbie Camper, Chelsea 2-in-1 Playset with Small Doll, 2 Pets & 15 Accessories, Vehicle Transforms into Camp Site (Amazon Exclusive)",B0BLJRDJRY,https://m.media-amazon.com/images/I/612ug8VajLL._AC_UL320_.jpg,$30.60,True,List:$34.99,4.8 out of 5 stars,599
https://www.amazon.com/JC-Toys-Cuddle-Designed-Berenguer/dp/B00EWLNMGC/ref=sr_1_4?keywords=toy+dolls&qid=1708158083&sr=8-4,"JC Toys Twins 13"" Realistic Soft Body Baby Dolls Berenguer Boutique | Twins Gift Set with Removable Outfits and Accessories | Pink and Blue | Caucasian | Ages 2+",B00EWLNMGC,https://m.media-amazon.com/images/I/81SUGEcQWUL._AC_UL320_.jpg,$21.99,True,List:$24.99,4.7 out of 5 stars,6460
https://www.amazon.com/DREAM-COLLECTION-Baby-Doll-Stroller/dp/B07L9VRJFC/ref=sr_1_5?keywords=toy+dolls&qid=1708158083&sr=8-5,"Dream Collection, Baby Doll Care Gift Set with Stroller - Lifelike Baby Doll and Accessories for Realistic Pretend Play, Posable Soft Toy - 12”",B07L9VRJFC,https://m.media-amazon.com/images/I/61tcgweU4JL._AC_UL320_.jpg,$28.99,True,Typical:$38.33,4.5 out of 5 stars,2146
https://www.amazon.com/Mattel-Daylight-Fd-Queen-Doll/dp/B0BN1223GJ/ref=sr_1_6?keywords=toy+dolls&qid=1708158083&sr=8-6,"Mattel Disney Wish Queen Amaya of Rosas Fashion Doll, Posable Doll in Removable Outfit & Shoes with Accessories",B0BN1223GJ,https://m.media-amazon.com/images/I/91SJJDuAmcL._AC_UL320_.jpg,$7.61,True,List:$19.99,4.8 out of 5 stars,441
https://www.amazon.com/L-L-Surprise-Change-Sisters/dp/B0BBJBRYVR/ref=sr_1_7?keywords=toy+dolls&qid=1708158083&sr=8-7,L.O.L. Surprise! LOL Surprise Bubble Foam Lil Sisters Doll - Collectible Baby Sister Great Gift for Girls Age 4+,B0BBJBRYVR,https://m.media-amazon.com/images/I/81NsSdnruYL._AC_UL320_.jpg,$3.29,True,List:$4.99,4.6 out of 5 stars,756
https://www.amazon.com/Disney-Encanto-Maribel-Doll-Articulated/dp/B08YN8VBC9/ref=sr_1_8?keywords=toy+dolls&qid=1708158083&sr=8-8,Disney Encanto Mirabel - 14 Inch Articulated Fashion Doll with Glasses & Shoes,B08YN8VBC9,https://m.media-amazon.com/images/I/71IcXkfMfEL._AC_UL320_.jpg,$13.99,True,List:$19.99,4.8 out of 5 stars,2556
https://www.amazon.com/Disney-Fashion-Accessory-Signature-Inspired/dp/B0B2BPFHNG/ref=sr_1_9?keywords=toy+dolls&qid=1708158083&sr=8-9,"Mattel Disney Princess Dolls, Elsa Posable Fashion Doll with Signature Clothing and Accessories, Mattel Disney's Frozen Movie Toys",B0B2BPFHNG,https://m.media-amazon.com/images/I/81t2O0EbsiL._AC_UL320_.jpg,$10.59,True,List:$11.99,4.8 out of 5 stars,4490
https://www.amazon.com/Enjoyin-Washable-Accessories-Bassinet-Pacifier/dp/B0BNVW7WYB/ref=sr_1_10?keywords=toy+dolls&qid=1708158083&sr=8-10,"12'' Baby Doll Playset with Washable Doll Accessories Includes Carrier Bassinet Bed, Pacifier, Blanket, and Pillow, First Baby Dolls for Toddlers 36 Months and Up",B0BNVW7WYB,https://m.media-amazon.com/images/I/61ZxzZpKMXL._AC_UL320_.jpg,$29.99,True,List:$34.99,4.7 out of 5 stars,262
https://www.amazon.com/Albums-1983-1987-TOY-DOLLS/dp/B079851WNN/ref=sr_1_11?keywords=toy+dolls&qid=1708158083&sr=8-11,Albums 1983-1987,B079851WNN,https://m.media-amazon.com/images/I/711pIryAw1L._AC_UL320_.jpg,$30.97,True,,4.8 out of 5 stars,52
https://www.amazon.com/KOILLIEUS-inches-Action-Figures-Babies/dp/B0B4W8NYZT/ref=sr_1_12?keywords=toy+dolls&qid=1708158083&sr=8-12,"4 Inch Mini Baby Dolls 6pcs Gift Set, Cute Small Baby Doll Toys with Animal Clothes, Suitability Kids 3 and up A Edition",B0B4W8NYZT,https://m.media-amazon.com/images/I/71jRx02tuEL._AC_UL320_.jpg,$19.99,True,5% coupon applied at checkoutSave 5% with coupon,4.7 out of 5 stars,641
https://www.amazon.com/Magic-Mixies-Pixlings-Single-Purple/dp/B0BQSM2BQ1/ref=sr_1_13?keywords=toy+dolls&qid=1708158083&sr=8-13,"Magic Mixies Unia The Unicorn Pixling - Reveal 6.5"" Doll from Potion Bottle",B0BQSM2BQ1,https://m.media-amazon.com/images/I/71fkiCCDBGL._AC_UL320_.jpg,$17.99,True,,4.7 out of 5 stars,1722
https://www.amazon.com/Disney-Encanto-Isabela-Fashion-Doll/dp/B08TR9428W/ref=sr_1_14?keywords=toy+dolls&qid=1708158083&sr=8-14,"Disney Encanto Isabela Fashion Doll with Dress, Shoes & Hair Pin",B08TR9428W,https://m.media-amazon.com/images/I/718utWZVfBL._AC_UL320_.jpg,$4.97,True,List:$12.99,4.8 out of 5 stars,2798
https://www.amazon.com/DONTNO-Clothes-Accessories-Feeding-Bottles/dp/B09X14JYCQ/ref=sr_1_15?keywords=toy+dolls&qid=1708158083&sr=8-15,"12 Inch Baby Doll with Clothes and Accessories, Reborn Alive Baby Doll Feeding and Caring Set with Baby Bottles Diaper Nipple for Little Girls Pretend Play Set",B09X14JYCQ,https://m.media-amazon.com/images/I/8175re8U9FL._AC_UL320_.jpg,$26.99,True,$2.00 coupon applied at checkoutSave $2.00 with coupon$30.99,3.9 out of 5 stars,245
https://www.amazon.com/inch-Soft-Body-Doll-Gift/dp/B01MD1SY0C/ref=sr_1_16?keywords=toy+dolls&qid=1708158083&sr=8-16,"The New York Doll Collection 11 inch Soft Body Doll in Gift Box - Award Winner & Toy 11"" Baby Doll (Caucasian)",B01MD1SY0C,https://m.media-amazon.com/images/I/71vqp27yUVL._AC_UL320_.jpg,$13.99,True,List:$16.99,4.6 out of 5 stars,13255
https://www.amazon.com/Mattel-Daylight-Village-House-Playset/dp/B0BMZZZLQ1/ref=sr_1_17?keywords=toy+dolls&qid=1708158083&sr=8-17,"Mattel Disney Wish Mini Doll & Dollhouse Playset, Asha of Rosas Cottage with Micro Doll, Star Figure & 15+ Furniture & Accessories, Travel Toys",B0BMZZZLQ1,https://m.media-amazon.com/images/I/51hi9t1mn4L._AC_UL320_.jpg,$12.69,True,List:$24.99,4.4 out of 5 stars,186
https://www.amazon.com/Lazada-Stuffed-Dolls-Animal-Kitty/dp/B09G9YJ1Q9/ref=sr_1_18?keywords=toy+dolls&qid=1708158083&sr=8-18,"Lazada Stuffed Cat Dolls Animal Kitty Plush Toy Baby Girl Gifts Gray with Hair Band 16""",B09G9YJ1Q9,https://m.media-amazon.com/images/I/71ycrJIqwLL._AC_UL320_.jpg,$27.99,True,List:$37.99,4.8 out of 5 stars,1505
https://www.amazon.com/eDollable-Realistic-Accessories-Pacifier-Toddlers/dp/B0C6DKTP7J/ref=sr_1_19?keywords=toy+dolls&qid=1708158083&sr=8-19,"Realistic Baby Doll Accessories Set Toys for 12 inch Dolls Includes Bib,Pacifier,Diaper and Feeding Bottle Perfect for Kids, Toddlers, and Girls",B0C6DKTP7J,https://m.media-amazon.com/images/I/61oZvSUWBZL._AC_UL320_.jpg,$9.99,True,,3.8 out of 5 stars,31
https://www.amazon.com/DUDOK-Anime-Figurines-Lightyear-Figures/dp/B0CLRDYCXB/ref=sr_1_20?keywords=toy+dolls&qid=1708158083&sr=8-20,"7 Pack Toy Anime Story Figurines,Woody Toy Anime Story Doll,Buzz Anime Lightyear Toy,PVC Toy Anime Story Toys Figures Set",B0CLRDYCXB,https://m.media-amazon.com/images/I/61-Pvog3zbL._AC_UL320_.jpg,$13.50,True,Typical:$14.99,3.7 out of 5 stars,26
https://www.amazon.com/Click-Play-Magic-Disappearing-Bottle/dp/B0819ZBS2K/ref=sr_1_21?keywords=toy+dolls&qid=1708158083&sr=8-21,"Click N' Play Magic Toy Set, Play Baby Bottles with Disappearing Milk & Juice, Doll Accessories for Kids & Toddlers, Great Gift for Little Girls Ages 2-4",B0819ZBS2K,https://m.media-amazon.com/images/I/61+Ev91JaDL._AC_UL320_.jpg,$9.82,True,List:$14.00,4.7 out of 5 stars,5063
https://www.amazon.com/My-Avastars-Fashion-Doll-Pink_Playz/dp/B0C3FPL1VD/ref=sr_1_22?keywords=toy+dolls&qid=1708158083&sr=8-22,Fashion Doll - Pink_Playz with 2 Outfits and 100+ Ways to Customize,B0C3FPL1VD,https://m.media-amazon.com/images/I/71VW10GKXIL._AC_UL320_.jpg,$18.01,True,List:$24.99,4.6 out of 5 stars,1488
https://www.amazon.com/Playset-Clothes-Accessories-Toddlers-Bassinet/dp/B0CGTS34H5/ref=sr_1_23?keywords=toy+dolls&qid=1708158083&sr=8-23,"12 Inch Baby Doll Playset with Dolls Clothes and Accessories First Baby Dolls for Toddlers 3 Years and Up Includes Bassinet Bed, Blanket, Bottles, Nipple, Diaper, Toys",B0CGTS34H5,https://m.media-amazon.com/images/I/71yrzpttkIL._AC_UL320_.jpg,$27.99,True,List:$29.99,4.1 out of 5 stars,23
https://www.amazon.com/LOL-Surprise-OMG-Sweet-Nails/dp/B0CG7TRT52/ref=sr_1_24?keywords=toy+dolls&qid=1708158083&sr=8-24,"LOL Surprise OMG Sweet Nails – Candylicious Sprinkles Shop with 15 Surprises, Including Real Nail Polish, Press On Nails, Sticker Sheets, Glitter, 1 Fashion Doll & more! – Great Gift for Kids Ages 4+",B0CG7TRT52,https://m.media-amazon.com/images/I/71vzj66u0PL._AC_UL320_.jpg,$26.97,True,,4.8 out of 5 stars,43
https://www.amazon.com/Floral-Baby-Doll-Accessories-Set/dp/B0BXM1NKW5/ref=sr_1_25?keywords=toy+dolls&qid=1708158083&sr=8-25,"Floral Baby Doll Accessories Set - 3-1 Furniture with Crib, High Chair, Bouncer Seat Bed for 18” Play Toys 18"" Dolls",B0BXM1NKW5,https://m.media-amazon.com/images/I/812snRLZymL._AC_UL320_.jpg,$49.99,True,List:$58.42,4.7 out of 5 stars,3142
https://www.amazon.com/Barbie-Chelsea-Open-Top-Unicorn-Themed-Accessories/dp/B08TZQ3YCD/ref=sr_1_26?keywords=toy+dolls&qid=1708158083&sr=8-26,"Barbie Club Chelsea Doll (6-inch Blonde) with Open-Top Rainbow Unicorn-Themed Car, Pet Puppy, Sticker Sheet & Accessories, For 3 to 7 Year Olds",B08TZQ3YCD,https://m.media-amazon.com/images/I/71QCkSGpzJL._AC_UL320_.jpg,$14.97,True,List:$18.99,4.8 out of 5 stars,4632
https://www.amazon.com/Tuko-Happy-Birthday-Years-6Packs/dp/B0C5CM35TC/ref=sr_1_27?keywords=toy+dolls&qid=1708158083&sr=8-27,"Happy Birthday, Doll Toys for 3+ Years Old Girls Gift, 4Packs",B0C5CM35TC,https://m.media-amazon.com/images/I/71T1Jl19nkL._AC_UL320_.jpg,$6.99,True,,4.5 out of 5 stars,341
https://www.amazon.com/18-Piece-Baby-Doll-Bath-Playset/dp/B0CG1S7B4B/ref=sr_1_28?keywords=toy+dolls&qid=1708158083&sr=8-28,"18-Piece Baby Doll Bath Playset - Bathtub, Bathrobe, Bath Toys, Feeding Bottle, and More - Pretend Play Set for 3-6 Year Old Girls",B0CG1S7B4B,https://m.media-amazon.com/images/I/81k0ZEe+YuL._AC_UL320_.jpg,$24.99,True,List:$31.99,4.2 out of 5 stars,275
https://www.amazon.com/Little-Dolls-Mini-Princess-Girls/dp/B0B5B6H6F4/ref=sr_1_29?keywords=toy+dolls&qid=1708158083&sr=8-29,"Mini Princess Dolls for Girls - Little Dolls Set with Princess Toy Dolls for Dollhouse - Small Doll Mini Princess Figures with Tiaras, Jewlery Accessories – Tiny 5.5” Miniature Mini Dolls Set",B0B5B6H6F4,https://m.media-amazon.com/images/I/91Ib+oujBcL._AC_UL320_.jpg,$13.99,True,List:$24.99,4.6 out of 5 stars,536
https://www.amazon.com/CoComelon-Roto-Plush-Style-1/dp/B0BQKNH7QW/ref=sr_1_30?keywords=toy+dolls&qid=1708158083&sr=8-30,"Cocomelon My Friend Nina Doll, Soft Plush Body - Music, Sounds, and Phrases in Spanish and English - Attached Bunny Plush Included - Toys for Preschoolers",B0BQKNH7QW,https://m.media-amazon.com/images/I/71jz9fsEx9L._AC_UL320_.jpg,$19.99,True,,4.7 out of 5 stars,33063
https://www.amazon.com/Barbie-Dreamtopia-Chelsea-6-5-inch-GJJ89/dp/B07ZPQ2KN1/ref=sr_1_31?keywords=toy+dolls&qid=1708158083&sr=8-31,"Barbie Dreamtopia Chelsea Mermaid Doll, 6.5-inch with Teal Hair and Tail",B07ZPQ2KN1,https://m.media-amazon.com/images/I/61O1HgERYFL._AC_UL320_.jpg,$8.82,True,List:$9.99,4.7 out of 5 stars,8732
https://www.amazon.com/Doll-Travel-PlaySet-Accessories-Caucasian/dp/B08N57WDLZ/ref=sr_1_32?keywords=toy+dolls&qid=1708158083&sr=8-32,Doll Travel PlaySet - Baby Doll Car Seat Carrier Backpack with 12 Inch Soft Body Doll Includes Doll Bottles and Toy Accessories … (Caucasian),B08N57WDLZ,https://m.media-amazon.com/images/I/71POHJsdILL._AC_UL320_.jpg,$34.99,True,,4.6 out of 5 stars,567
https://www.amazon.com/Mattel-HPX26-Daylight-Singing-Doll/dp/B0BMZZV6R3/ref=sr_1_33?keywords=toy+dolls&qid=1708158083&sr=8-33,"Mattel Disney Wish Singing Asha of Rosas Fashion Doll & Star Figure, Posable with Removable Outfit, Sings “This Wish” in English",B0BMZZV6R3,https://m.media-amazon.com/images/I/81sCZgmCTLL._AC_UL320_.jpg,$12.94,True,List:$24.99,4.7 out of 5 stars,118
https://www.amazon.com/Mermaid-Fashion-Signature-Inspired-Disneys/dp/B0B481DVM5/ref=sr_1_34?keywords=toy+dolls&qid=1708158083&sr=8-34,"Mattel Ariel Fashion Doll on Land In Signature Blue Dress, Toys Inspired by Disney's the Little Mermaid",B0B481DVM5,https://m.media-amazon.com/images/I/618ShbIfGHL._AC_UL320_.jpg,$10.99,True,List:$16.99,4.8 out of 5 stars,915
https://www.amazon.com/linzy-Educational-Adorable-Removable-Closures-Perfect/dp/B0BZ7DGDGK/ref=sr_1_35?keywords=toy+dolls&qid=1708158083&sr=8-35,"linzy Toys 16"" Educational Doll/Adorable Plush Doll Comes with a Removable Outfit Packed with Closures-Perfect for Testing a Little One's Problem Solving and Motor Skills",B0BZ7DGDGK,https://m.media-amazon.com/images/I/710CsoIMsAL._AC_UL320_.jpg,$16.99,False,,4.9 out of 5 stars,17
https://www.amazon.com/Jirachi-Lifelike-Realistic-Silicone-Accessories/dp/B0C9LX5RMV/ref=sr_1_36?keywords=toy+dolls&qid=1708158083&sr=8-36,"Reborn Baby Dolls, Lifelike Baby Girl, Realistic Newborn Baby Doll Silicone Full Body with Toy Accessories Gift Set for Kids Age 3+",B0C9LX5RMV,https://m.media-amazon.com/images/I/61rw0i-5qFL._AC_UL320_.jpg,$39.99,True,Typical:$49.99,4.3 out of 5 stars,80
https://www.amazon.com/Hapgo-Stylist-Pretend-Styling-Accessories/dp/B0CKS8DVXW/ref=sr_1_37?keywords=toy+dolls&qid=1708158083&sr=8-37,"Girls Beauty Salon Set, Doll Head Hair Stylist Toy Kit, 27 PCS Pretend Play Hair Styling Set with Blow Dryer, Barber Apron and Styling Accessories Toys for Girls Ages 3-9",B0CKS8DVXW,https://m.media-amazon.com/images/I/71dyJ0krjHL._AC_UL320_.jpg,$25.99,True,10% coupon applied at checkoutSave 10% with coupon$32.99,4.8 out of 5 stars,30
https://www.amazon.com/Princess-Outdoor-Butterfly-Infrared-Induction/dp/B0CNNFZNJH/ref=sr_1_38?keywords=toy+dolls&qid=1708158083&sr=8-38,"Magic Flying Fairy Princess Doll, Xmas Flying Fairy Toys for Girls, Flying Fairy Dolls Toys for Kids Indoor and Outdoor, Sky Dancers Flying Butterfly Pixie Dolls Infrared Induction Control Toy",B0CNNFZNJH,https://m.media-amazon.com/images/I/61YvQVlIHXL._AC_UL320_.jpg,$14.99,True,,1.6 out of 5 stars,15
https://www.amazon.com/Shemira-17-Inch-Vinyl-Baby-Doll/dp/B0CB8KVMFZ/ref=sr_1_39?keywords=toy+dolls&qid=1708158083&sr=8-39,"Shemira 17-Inch Vinyl Baby Doll - Lifelike Newborn Dolls for Girls Age 3+, Ideal Gift for Kids, Poseable with Full Body",B0CB8KVMFZ,https://m.media-amazon.com/images/I/71P2RcBznnL._AC_UL320_.jpg,$23.99,True,,4.4 out of 5 stars,85
https://www.amazon.com/Disney-Princess-Tiana-Fashion-Doll/dp/B0BRSRHP5T/ref=sr_1_40?keywords=toy+dolls&qid=1708158083&sr=8-40,Disney Princess Disney 100 My Friend Tiana Doll 14 inch Tall Includes Removable Outfit and Tiara,B0BRSRHP5T,https://m.media-amazon.com/images/I/71JZGOWeUtL._AC_UL320_.jpg,$14.99,True,Typical:$18.79,4.7 out of 5 stars,33
https://www.amazon.com/L-L-Surprise-Flying-Doll/dp/B0BN1G6L9P/ref=sr_1_41?keywords=toy+dolls&qid=1708158083&sr=8-41,"L.O.L. Surprise! Magic Flyers: Sky Starling- Hand Guided Flying Doll, Collectible Doll, Touch Bottle Unboxing, Great Gift for Girls Age 6+",B0BN1G6L9P,https://m.media-amazon.com/images/I/81zN4D-zZAL._AC_UL320_.jpg,$23.49,True,List:$29.99,4.6 out of 5 stars,442
https://www.amazon.com/Disney-Princess-Belle-Fashion-Doll/dp/B0BRSRFKP3/ref=sr_1_42?keywords=toy+dolls&qid=1708158083&sr=8-42,"Disney Princess D100 My Friend Belle Doll 14 inch Tall Includes Removable Outfit, Tiara, Shoes & Brush",B0BRSRFKP3,https://m.media-amazon.com/images/I/71myz6lN+lL._AC_UL320_.jpg,$14.99,False,Typical:$18.79,4.7 out of 5 stars,85
https://www.amazon.com/Cry-Babies-Magic-Tears-Talent/dp/B0BSVQX6TS/ref=sr_1_43?keywords=toy+dolls&qid=1708158083&sr=8-43,"Cry Babies Magic Tears Talent Babies, Stella - 6+ Surprises, Accessories, Great Gift for Kids Ages 3+",B0BSVQX6TS,https://m.media-amazon.com/images/I/71J96oZcA3L._AC_UL320_.jpg,$6.10,True,List:$9.99,4.8 out of 5 stars,325
https://www.amazon.com/L-L-Surprise-Loves-Sweets/dp/B0BN1HBXV2/ref=sr_1_44?keywords=toy+dolls&qid=1708158083&sr=8-44,"L.O.L. Surprise! Loves Mini Sweets Series 3 with 7 Surprises, Accessories, Limited Edition Doll, Candy Theme, Collectible Doll- Great Gift for Girls Age 4+",B0BN1HBXV2,https://m.media-amazon.com/images/I/71Rha276CtL._AC_UL320_.jpg,$6.19,True,List:$9.99,4.7 out of 5 stars,194
https://www.amazon.com/DreamWorks-Trolls-Together-Stretchy-Glitter-Filled/dp/B0BSJTLMVV/ref=sr_1_45?keywords=toy+dolls&qid=1708158083&sr=8-45,"Magic Mixies DreamWorks Trolls Band Together Squishy, Stretchy Glitter-Filled Hair Doll - Stretchy Hair Poppy",B0BSJTLMVV,https://m.media-amazon.com/images/I/810XYkH81gL._AC_UL320_.jpg,$12.99,True,List:$13.99,4.7 out of 5 stars,97
https://www.amazon.com/DISNEY-PRINCESS-20-Pieces-Officially-Licensed/dp/B0BJN1RK3W/ref=sr_1_46?keywords=toy+dolls&qid=1708158083&sr=8-46,"DISNEY PRINCESS Shimmer Spa Ariel 8-inch Styling Head, 20-Pieces, Red Hair, Pretend Play, Officially Licensed Kids Toys for Ages 3 Up by Just Play",B0BJN1RK3W,https://m.media-amazon.com/images/I/91mTsliRAML._AC_UL320_.jpg,$24.74,True,List:$29.99,4.5 out of 5 stars,73
https://www.amazon.com/L-L-Surprise-Confetti-Birthday/dp/B0BN1GGDFZ/ref=sr_1_47?keywords=toy+dolls&qid=1708158083&sr=8-47,"LOL Surprise Mix & Make Birthday Cake Tots with Collectible Doll, DIY Cake Dress, Cake Making and Decorating, Ingredients and Glitter Sprinkles, Cake Dress Doll- Great Gift for Girls Age 3+",B0BN1GGDFZ,https://m.media-amazon.com/images/I/81UmTMEFOQL._AC_UL320_.jpg,$9.97,True,,4.5 out of 5 stars,49
https://www.amazon.com/CoComelon-Feature-Plush-Style-1/dp/B0BQJZZT2X/ref=sr_1_48?keywords=toy+dolls&qid=1708158083&sr=8-48,"Cocomelon Peek-A-Boo JJ 10” Feature Plush - Featuring Favorite Song, Phrases, and Sounds - Play Peek-A-Boo with JJ - Toys for Preschool and Kids - Amazon Exclusive",B0BQJZZT2X,https://m.media-amazon.com/images/I/718qcB09trL._AC_UL320_.jpg,$18.69,True,List:$24.99,4.7 out of 5 stars,372
https://www.amazon.com/Tuko-Happy-Birthday-Years-6Packs/dp/B0C5CM35TC/ref=sr_1_49?dib=eyJ2IjoiMSJ9.R7hYl_SezaHEUbSDeB78bzYkAVVhs64sEZPRrXzAxTivQbmI4Fb32NUT8geTU6lvuMh5Sgq60WCtyqstyXEfBD3w7T36erYXDOXkOmIgfYu4o5_VWzhnEW2Rd2oM9totjBbMHLGqYOQdN8Bk_k0SJ3n_bt__oJXjQf68a0TrEWvU5gCjdJzOf0b02M5AhbkBaBquSdxSHl5LYJyiOqjmhoqrnDYta8K7NwUPh18v4IgVH2Ug8X1xh3e_1syxz4kBp2iS0ezWJn0oM5lL3qw_lW6YUMITrHQwr138O52ZdcI.prnlJujRY_BnFBHPRQM7uWebilPjRBslXA3fUuGYTS8&dib_tag=se&keywords=toy+dolls&qid=1708158444&sr=8-49,"Happy Birthday, Doll Toys for 3+ Years Old Girls Gift, 4Packs",B0C5CM35TC,https://m.media-amazon.com/images/I/71T1Jl19nkL._AC_UL320_.jpg,$6.99,True,,4.5 out of 5 stars,341
https://www.amazon.com/Barbie-Babysitters-Babysitter-Brunette-Accessories/dp/B09NLCRC9L/ref=sr_1_50?dib=eyJ2IjoiMSJ9.R7hYl_SezaHEUbSDeB78bzYkAVVhs64sEZPRrXzAxTivQbmI4Fb32NUT8geTU6lvuMh5Sgq60WCtyqstyXEfBD3w7T36erYXDOXkOmIgfYu4o5_VWzhnEW2Rd2oM9totjBbMHLGqYOQdN8Bk_k0SJ3n_bt__oJXjQf68a0TrEWvU5gCjdJzOf0b02M5AhbkBaBquSdxSHl5LYJyiOqjmhoqrnDYta8K7NwUPh18v4IgVH2Ug8X1xh3e_1syxz4kBp2iS0ezWJn0oM5lL3qw_lW6YUMITrHQwr138O52ZdcI.prnlJujRY_BnFBHPRQM7uWebilPjRBslXA3fUuGYTS8&dib_tag=se&keywords=toy+dolls&qid=1708158444&sr=8-50,"Barbie Skipper Babysitters Inc. Playset with Skipper Babysitter Doll (Brunette), Stroller, Baby Doll & 5 Accessories, Toy for 3 Year Olds & Up",B09NLCRC9L,https://m.media-amazon.com/images/I/71jLfBGEgLL._AC_UL320_.jpg,$12.49,True,List:$24.99,4.8 out of 5 stars,2437
https://www.amazon.com/Mermaid-Fashion-Signature-Inspired-Disneys/dp/B0B481DVM5/ref=sr_1_51?dib=eyJ2IjoiMSJ9.R7hYl_SezaHEUbSDeB78bzYkAVVhs64sEZPRrXzAxTivQbmI4Fb32NUT8geTU6lvuMh5Sgq60WCtyqstyXEfBD3w7T36erYXDOXkOmIgfYu4o5_VWzhnEW2Rd2oM9totjBbMHLGqYOQdN8Bk_k0SJ3n_bt__oJXjQf68a0TrEWvU5gCjdJzOf0b02M5AhbkBaBquSdxSHl5LYJyiOqjmhoqrnDYta8K7NwUPh18v4IgVH2Ug8X1xh3e_1syxz4kBp2iS0ezWJn0oM5lL3qw_lW6YUMITrHQwr138O52ZdcI.prnlJujRY_BnFBHPRQM7uWebilPjRBslXA3fUuGYTS8&dib_tag=se&keywords=toy+dolls&qid=1708158444&sr=8-51,"Mattel Ariel Fashion Doll on Land In Signature Blue Dress, Toys Inspired by Disney's the Little Mermaid",B0B481DVM5,https://m.media-amazon.com/images/I/618ShbIfGHL._AC_UL320_.jpg,$10.99,True,List:$16.99,4.8 out of 5 stars,915
