url,name,asin,image,price,isPrime,offer,customerReview,customerReviewCount
https://www.amazon.com/SUNMORY-Dimmable-Standing-Shelves-Bookshelf/dp/B08Z36X6B4/ref=sr_1_1?keywords=living+room&qid=1707636580&sr=8-1,"SUNMORY Floor Lamp with Shelves, Modern Square Standing Lamp with 3 Color Temperature Bulb, Corner Display Bookshelf Lamp for Living Room and Bedroom(Black)",B08Z36X6B4,https://m.media-amazon.com/images/I/71YNhyHG-IL._AC_UL320_.jpg,$45.99,True,10% coupon applied at checkoutSave 10% with coupon$89.99,4.6 out of 5 stars,4044
https://www.amazon.com/Lwenki-Holder-Decorative-Shelf-Large/dp/B09ZRT5QPG/ref=sr_1_2?keywords=living+room&qid=1707636580&sr=8-2,"Key Holder for Wall, Decorative Key and Mail Holder with Shelf Has Large Hooks for Bags, Coats, Umbrella – Paulownia Wood Key Hanger with Mounting Hardware (9.8”W x 6.7”H x 4.2”D)",B09ZRT5QPG,https://m.media-amazon.com/images/I/61sHXVsbXAL._AC_UL320_.jpg,$12.99,True,,4.6 out of 5 stars,2600
https://www.amazon.com/GETOVIN-Length-Standing-Dressing-Bedroom/dp/B0CR9ZT87B/ref=sr_1_3?keywords=living+room&qid=1707636580&sr=8-3,"65""x22"" Full Length Mirror Large Floor Mirror with Stand Wall Mirror Full Body Mirror Standing Mirror Dressing Mirror Arched for Living Room Bedroom",B0CR9ZT87B,https://m.media-amazon.com/images/I/715W1o59d+L._AC_UL320_.jpg,$59.90,False,,3.0 out of 5 stars,2
https://www.amazon.com/Sweetcrispy-Coffee-Tables-Storage-Compartment/dp/B0CLRRG7HL/ref=sr_1_4?keywords=living+room&qid=1707636580&sr=8-4,"Sweetcrispy Coffee Table Black, Lift Top Coffee Tables for Living Room, Small Rising Wooden Dining Center Tables with Storage Shelf and Hidden Compartment",B0CLRRG7HL,https://m.media-amazon.com/images/I/714jaxloP-L._AC_UL320_.jpg,$54.89,True,List:$69.99,4.4 out of 5 stars,768
https://www.amazon.com/HARRITPURE-Arched-Top-Standing-Aluminum-Cloakroom/dp/B09GFSN4HW/ref=sr_1_5?keywords=living+room&qid=1707636580&sr=8-5,"64""x21"" Arched Full Length Mirror Free Standing Leaning Mirror Hanging Mounted Mirror Aluminum Frame Modern Simple Home Decor for Living Room Bedroom Cloakroom, Gold",B09GFSN4HW,https://m.media-amazon.com/images/I/81srWhZnbeL._AC_UL320_.jpg,4 sizes,True,$20.00 coupon applied at checkoutSave $20.00 with coupon$89.99,4.5 out of 5 stars,1821
https://www.amazon.com/Ambimall-Temperatures-Standing-Adjustable-Classroom/dp/B0C4DGFFCM/ref=sr_1_6?keywords=living+room&qid=1707636580&sr=8-6,"Ambimall Floor Lamps for Living Room with 3 Color Temperatures, Standing Lamp Tall with Adjustable Linen Shade, Tall Lamps for Living Room Bedroom Office Classroom Dorm Room, 9W Bulb Included",B0C4DGFFCM,https://m.media-amazon.com/images/I/81Yzs4AFWEL._AC_UL320_.jpg,$39.99,True,Join Prime to buy this item at $29.99,4.5 out of 5 stars,1177
https://www.amazon.com/Chicrug-Bedroom-Shedding-Children-Decorative/dp/B097479QQY/ref=sr_1_7?keywords=living+room&qid=1707636580&sr=8-7,"Chicrug Soft Runner Rugs for Bedroom Living Room Plush Fluffy Rug 2x6 Feet, Shag Furry Area Rug Carpet Non Shedding for Nursery Children Kids Girls Room Home Decorative, Grey",B097479QQY,https://m.media-amazon.com/images/I/81P4e+zxnHL._AC_UL320_.jpg,11 sizes,True,List:$1.53,4.1 out of 5 stars,4717
https://www.amazon.com/Backlight-Maylit-6-56ft-Accent-Lighting/dp/B074KFP426/ref=sr_1_8?keywords=living+room&qid=1707636580&sr=8-8,"Tv Led Backlight, Maylit 8.2ft Led Strip Lights for 40-60in Tv, USB Powered Tv Lights kit with Remote, RGB Bias Lighting for Room Decor",B074KFP426,https://m.media-amazon.com/images/I/71V7jRrIvtL._AC_UL320_.jpg,$13.99,True,$2.00 coupon applied at checkoutSave $2.00 with coupon$2.13,4.5 out of 5 stars,14852
https://www.amazon.com/WOPITUES-Floating-Farmhouse-Bathroom-Room-Rustic/dp/B0C4T4BVT3/ref=sr_1_9?keywords=living+room&qid=1707636580&sr=8-9,"WOPITUES Wood Floating Shelves Set of 6, Shelves for Wall Decor, Farmhouse Shelf for Bedroom, Bathroom Storage Shelves, Book Shelves for Living Room - Rustic Brown",B0C4T4BVT3,https://m.media-amazon.com/images/I/71G7N2u54uL._AC_UL320_.jpg,$26.99,True,($4.50$4.50/Count)$4.50,4.5 out of 5 stars,1503
https://www.amazon.com/Ophanie-Living-Carpets-Bedroom-Aesthetic/dp/B0B6W18FYY/ref=sr_1_10?keywords=living+room&qid=1707636580&sr=8-10,"Ophanie Living Room Rugs 5x8 Grey, Fluffy Shag Fuzzy Plush Soft Throw Area Rug, Gray Large Shaggy Floor Big Carpets for Bedroom, Kids Home Decor Aesthetic, Nursery",B0B6W18FYY,https://m.media-amazon.com/images/I/917+UWB+exL._AC_UL320_.jpg,7 sizes,True,Join Prime to buy this item at $39.99$61.99,4.3 out of 5 stars,25378
https://www.amazon.com/RYOFOBETTO-Bathroom-Shelves-Floating-Mounted/dp/B0CGT6XPC1/ref=sr_1_11?keywords=living+room&qid=1707636580&sr=8-11,"Bathroom Shelves, Floating Shelves Over Toilet Paper Holder, Wall Mounted Rustic Wood Storage Basket Shelves for Bedroom, Living Room & Kitchen, Set of 3 (Light Brown)",B0CGT6XPC1,https://m.media-amazon.com/images/I/71WOGm33RQL._AC_UL320_.jpg,$24.99,True,,4.4 out of 5 stars,138
https://www.amazon.com/Casaphoria-Decorative-Laundry-Blanket-Storage/dp/B09BZP7Q7D/ref=sr_1_12?keywords=living+room&qid=1707636580&sr=8-12,"Casaphoria XXXLarge Cotton Rope Basket for Living Room - Woven Storage Basket with Handle for Blankets, Towels and Pillows Laundry Hamper | White and Brown (22"" x 22"" x 14"")",B09BZP7Q7D,https://m.media-amazon.com/images/I/81R+6MKIDtL._AC_UL320_.jpg,$24.55,True,,4.6 out of 5 stars,2291
https://www.amazon.com/AROEVE-Purifiers-Portable-Purifier-Kitchen/dp/B09GM8Y8BN/ref=sr_1_13?keywords=living+room&qid=1707636580&sr=8-13,"AROEVE Air Purifiers for Home, HEPA Air Purifiers Air Cleaner For Smoke Pollen Dander Hair Smell Portable Air Purifier with Sleep Mode Speed Control For Bedroom Office Living Room, MK01- Black",B09GM8Y8BN,https://m.media-amazon.com/images/I/71TI8UbR4DL._AC_UL320_.jpg,$49.99,True,$10.00 coupon applied at checkoutSave $10.00 with coupon$49.99,4.6 out of 5 stars,27799
https://www.amazon.com/HOOBRO-Charging-Station-Nightstand-BF09UBZP201/dp/B0B9GXYT5D/ref=sr_1_14?keywords=living+room&qid=1707636580&sr=8-14,"Side/End Table with Charging Station, Set of 2 with USB Ports and Outlets, Nightstand with 2-Layer Storage Shelves for Small Spaces, Living Room, Bedroom, Rustic Brown BF09UBZP201",B0B9GXYT5D,https://m.media-amazon.com/images/I/715bGiI3RxL._AC_UL320_.jpg,$49.98,True,15% coupon applied at checkoutSave 15% with coupon$65.99,4.5 out of 5 stars,888
https://www.amazon.com/Blanket-Ladder-Wooden-Decorative-Brown/dp/B0C8ZFT28H/ref=sr_1_15?keywords=living+room&qid=1707636580&sr=8-15,"6-Tier Blanket Ladder Wooden, 5.7FT(66.5'') Blanket Quilt Towel Holder Rack Decorative Ladder, Easy Assembly, Rustic Farmhouse Ladder Shelf for The Living Room Bedroom Bathroom Home Decor, Brown",B0C8ZFT28H,https://m.media-amazon.com/images/I/61JDdeqLZGL._AC_UL320_.jpg,$47.99,True,Save 5% on 2 select item(s)$53.98,4.1 out of 5 stars,245
https://www.amazon.com/Qaubauyt-Adjustment-Colorful-Standing-Lampshade/dp/B0BDL1K1QQ/ref=sr_1_16?keywords=living+room&qid=1707636580&sr=8-16,"Floor Lamp for Living Room Bedroom,Modern LED Floor Lamp with Remote Control and Stepless Dimmable Colors Temperature & Brightness,Standing Lamps Tall Lamp, 9W Bulb Included(White)",B0BDL1K1QQ,https://m.media-amazon.com/images/I/71rMHyp0WqL._AC_UL320_.jpg,$31.99,True,,4.1 out of 5 stars,825
https://www.amazon.com/Digital-Display-Charger-Brightness-Electronic/dp/B099NTPWWD/ref=sr_1_17?keywords=living+room&qid=1707636580&sr=8-17,"SZELAM Digital Alarm Clock,LED and Mirror Desk Clock Large Display,with Dual USB Charger Ports,3 Levels Brightness,12/24H,Modern Electronic Clock for Bedroom Home Living Room Office - Gold",B099NTPWWD,https://m.media-amazon.com/images/I/61JsbsKt7wS._AC_UL320_.jpg,$22.95,True,10% coupon applied at checkoutSave 10% with coupon$24.95,4.3 out of 5 stars,29951
https://www.amazon.com/Fixwal-Floating-Shelves-Bathroom-Carbonized/dp/B0C1677BQ7/ref=sr_1_18?keywords=living+room&qid=1707636580&sr=8-18,"Fixwal Corner Floating Shelves, Rustic Wood Wall Shelves for Bathroom, Kitchen, Bedroom or Living Room (Dark Carbonized Black)",B0C1677BQ7,https://m.media-amazon.com/images/I/81eJo0lc4QL._AC_UL320_.jpg,$36.99,True,List:$39.99,4.4 out of 5 stars,621
https://www.amazon.com/VASAGLE-Charging-Station-Outlets-Nightstand/dp/B0C2CHYBWM/ref=sr_1_19?keywords=living+room&qid=1707636580&sr=8-19,"VASAGLE Side Table with Charging Station, 3-Tier End Table with USB Ports and Outlets, Nightstand for Living Room, Bedroom, 11.8 x 13.4 x 22.8 Inches, Plug-in Series, Camel Brown and Black",B0C2CHYBWM,https://m.media-amazon.com/images/I/81HH5FhX9aL._AC_UL320_.jpg,$45.99,True,Join Prime to buy this item at $36.79,4.6 out of 5 stars,1497
https://www.amazon.com/VASAGLE-Storage-Bedroom-Industrial-ULET272B01/dp/B08JTWKY2H/ref=sr_1_20?keywords=living+room&qid=1707636580&sr=8-20,"VASAGLE Side Tables Set of 2, Small End Table, Nightstand for Living Room, Bedroom, Office, Bathroom, Rustic Brown and Black ULET272B01",B08JTWKY2H,https://m.media-amazon.com/images/I/71RuQYgt6pL._AC_UL320_.jpg,$49.99,True,Join Prime to buy this item at $39.99,4.5 out of 5 stars,4532
https://www.amazon.com/QEEIG-Shaped-Tables-Bedroom-Farmhouse/dp/B0BV6KN8Q8/ref=sr_1_21?keywords=living+room&qid=1707636580&sr=8-21,"QEEIG Narrow C Shaped Side Table Set of 2 Living Room Sets Slim Couch Tables Skunny Thin Small Farmhouse 7 inch Width, Rustic Brown",B0BV6KN8Q8,https://m.media-amazon.com/images/I/61E1dVaTeHL._AC_UL320_.jpg,$39.80,True,List:$59.82,4.4 out of 5 stars,368
https://www.amazon.com/CHENGU-Minimalist-Abstract-Drawing-Bathroom/dp/B0C4TN199P/ref=sr_1_22?keywords=living+room&qid=1707636580&sr=8-22,"CHENGU 3 Pieces Metal Minimalist Abstract Woman Wall Art Line Drawing Wall Art Decor Single Line Female Home Hanging Wall Art Decor for Kitchen Bathroom Living Room (Black,Classic Style)",B0C4TN199P,https://m.media-amazon.com/images/I/81Y7kIr9vHL._AC_UL320_.jpg,31 sizes,True,,4.2 out of 5 stars,1105
https://www.amazon.com/Miortior-Corner-Remote-Control-Million/dp/B0C9QDV7GF/ref=sr_1_23?keywords=living+room&qid=1707636580&sr=8-23,"Corner Floor Lamp, 2 Pack Smart LED Corner Lamp Works with App/Remote/Button Control, RGB Floor Lamp with 16 Million DIY Colors, 68+ Scene, Music Sync for Living Room, Gaming Room, etc",B0C9QDV7GF,https://m.media-amazon.com/images/I/61IBd9m-GVL._AC_UL320_.jpg,$89.99,True,($45.00$45.00/Count)$45.00,4.3 out of 5 stars,893
https://www.amazon.com/Industrial-Elegant-Teardrop-Vintage-Farmhouse/dp/B08BL5YM3V/ref=sr_1_24?keywords=living+room&qid=1707636580&sr=8-24,"Lakumu Industrial Tree Floor Lamp for Living Room, with 3 Elegant Teardrop Cage Heads & ST58 Edison LED Bulbs, Sturdy Base Tall Vintage Pole Light Great for Farmhouse Rustic Bedroom Office",B08BL5YM3V,https://m.media-amazon.com/images/I/71LrNHBLxBL._AC_UL320_.jpg,$39.58,True,List:$74.99,4.6 out of 5 stars,4917
https://www.amazon.com/Heylor-Suitable-Entryway-Hallway-Bedroom/dp/B0B4S552QX/ref=sr_1_25?keywords=living+room&qid=1707636580&sr=8-25,"Key Holder for Wall, Mail and Key Hanger Wall Mount with Double Key Hook and Hat Coat Rack Shelf Decor,Key Organizer Suitable for Entryway, Hallway, Dog Leashes,House and Living Room, Black",B0B4S552QX,https://m.media-amazon.com/images/I/71iVMYV1-IL._AC_UL320_.jpg,$19.99,True,20% coupon applied at checkoutSave 20% with coupon,4.7 out of 5 stars,504
https://www.amazon.com/Greenco-Corner-Shelves-Espresso-Finish/dp/B01GIJBK50/ref=sr_1_26?keywords=living+room&qid=1707636580&sr=8-26,"Corner Shelf, Greenco 5 Tier Shelves for Wall Storage, Easy-to-Assemble Floating Wall Mount Shelves for Offices, Bedrooms, Bathrooms, Kitchens, Living Rooms and Dorm Rooms, Espresso Finish",B01GIJBK50,https://m.media-amazon.com/images/I/718cQsxYvQL._AC_UL320_.jpg,$28.21,True,List:$29.99,4.5 out of 5 stars,61843
https://www.amazon.com/Yaheetech-Rustic-Coffee-Compartment-Storage/dp/B07ZFNN72Z/ref=sr_1_27?keywords=living+room&qid=1707636580&sr=8-27,"Yaheetech Vintage Coffee Table, Lift Top Coffee Table with Large Hidden Storage Shelf, Lift Tabletop Dining Table for Living Room, Home Small Space, 38.6in, Rustic Brown",B07ZFNN72Z,https://m.media-amazon.com/images/I/618l72H8vnL._AC_UL320_.jpg,2 sizes,False,List:$99.99,4.5 out of 5 stars,16003
https://www.amazon.com/Rottogoon-Standing-Industrial-Reading-Included/dp/B086ZLGLV3/ref=sr_1_28?keywords=living+room&qid=1707636580&sr=8-28,"Floor Lamp for Living Room with 3 Color Temperatures LED Bulb, Standing Lamp Tall Industrial Floor Lamp Reading for Bedroom, Office (9W LED Bulb, Beige Lampshade Included) -Black",B086ZLGLV3,https://m.media-amazon.com/images/I/61pJwYkeP9L._AC_UL320_.jpg,$39.99,True,25% coupon applied at checkoutSave 25% with coupon$69.99,4.5 out of 5 stars,8638
https://www.amazon.com/Minimalist-Abstract-Drawing-Hanging-Bathroom/dp/B0C1H44YMM/ref=sr_1_29?keywords=living+room&qid=1707636580&sr=8-29,"3 Pcs Metal Wall Art Decor Minimalist Abstract Woman Wall Art metal Modern Line Drawing Wall Art Decor Female Single Line Wall Home Hanging for Bedroom Kitchen Bathroom Living Room(Black, Lively)",B0C1H44YMM,https://m.media-amazon.com/images/I/71eP-8q+eKL._AC_UL320_.jpg,12 sizes,True,,4.6 out of 5 stars,610
https://www.amazon.com/Fancy-Homi-Decorative-Farmhouse-Corduroy/dp/B0C2PS76FG/ref=sr_1_30?keywords=living+room&qid=1707636580&sr=8-30,"Fancy Homi 4 Packs Neutral Decorative Throw Pillow Covers 18x18 Inch for Living Room Couch Bed Sofa, Rustic Farmhouse Boho Home Decor, Soft Plush Striped Corduroy Square Cushion Case 45x45 cm",B0C2PS76FG,https://m.media-amazon.com/images/I/71YAboIsyAL._AC_UL320_.jpg,$21.99,True,List:$5.50,4.6 out of 5 stars,599
https://www.amazon.com/VASAGLE-Blanket-Ladder-Decorative-Farmhouse/dp/B0C4NDWF3X/ref=sr_1_31?keywords=living+room&qid=1707636580&sr=8-31,"VASAGLE Blanket Ladder Decorative Farmhouse for The Living Room, 5-Tier Ladder Shelf, Ladder Rack for Storage and Decor, Ebony Black ULLS018B56",B0C4NDWF3X,https://m.media-amazon.com/images/I/61aVz47WQFL._AC_UL320_.jpg,$39.99,True,List:$42.99,3.8 out of 5 stars,176
https://www.amazon.com/Aesthetic-Decorations-Weddings-Christmas-Holidays/dp/B08Q7DCKB6/ref=sr_1_32?keywords=living+room&qid=1707636580&sr=8-32,"Bonsai Tree Light for Room Decor, Aesthetic Lamps for Living Room, Cute Night Light for House Decor, Good Ideas for Gifts, Home Decorations, Weddings,Christmas, Holidays and More (Warm White, 108 LED)",B08Q7DCKB6,https://m.media-amazon.com/images/I/71-ugcKLoOL._AC_UL320_.jpg,$20.99,True,List:$29.99,4.3 out of 5 stars,1522
https://www.amazon.com/MIULEE-Blackout-Textured-Insulated-Darkening/dp/B0BNX3TGBY/ref=sr_1_33?keywords=living+room&qid=1707636580&sr=8-33,MIULEE 100% Blackout Linen Textured Curtains for Bedroom Solid Thermal Insulated Ivory Grommet Room Darkening Curtains & Drapes Luxury Decor for Living Room Nursery 52 x 84 Inch (2 Panels),B0BNX3TGBY,https://m.media-amazon.com/images/I/81tEEgJKQwL._AC_UL320_.jpg,12 sizes,True,20% coupon applied at checkoutSave 20% with coupon,4.6 out of 5 stars,4750
https://www.amazon.com/Bqweun-Artificial-Hanging-Succulents-Succulent/dp/B0CG9BZ51C/ref=sr_1_34?keywords=living+room&qid=1707636580&sr=8-34,"2 Pcs Artificial Hanging Succulents Plants, Faux String of Pearls Plants in Pot with a Lanyard, Hanging Fake Succulent Plants for Bedroom, Small Wall, Living Room Decor",B0CG9BZ51C,https://m.media-amazon.com/images/I/71ci6aPYgzL._AC_UL320_.jpg,$18.99,True,Typical:$9.50,4.0 out of 5 stars,3
https://www.amazon.com/OMERAI-Washable-Abstract-Ultra-Thin-Resistant/dp/B0BXX5M9QH/ref=sr_1_35?keywords=living+room&qid=1707636580&sr=8-35,Washable Rug 5'x7' Abstract Machine Washable Rugs Ultra-Thin Area Rugs for Living Room Non Slip Stain Resistant Modern Carpet for Bedroom Dining Room Office Kitchen Brown Rug Washable (Brown),B0BXX5M9QH,https://m.media-amazon.com/images/I/613VEbtq4mL._AC_UL320_.jpg,4 sizes,True,20% coupon applied at checkoutSave 20% with coupon,4.2 out of 5 stars,240
https://www.amazon.com/Bamworld-Stands-Outdoor-Multiple-Balcony/dp/B09234GQXV/ref=sr_1_36?keywords=living+room&qid=1707636580&sr=8-36,Bamworld Plant Stand Indoor Plant Shelf Outdoor Wood Tiered Plant Rack for Multiple Plants 3 Tiers Ladder Plant Holder for 7 Plant Pots Boho Home Decor for Gardening Gifts,B09234GQXV,https://m.media-amazon.com/images/I/713E9YWv2iL._AC_UL320_.jpg,$22.99,True,8% coupon applied at checkoutSave 8% with coupon$32.99,4.5 out of 5 stars,15238
https://www.amazon.com/MEGASKET-Storage-Baskets-Blanket-Organizer/dp/B0C5JPPRG2/ref=sr_1_37?keywords=living+room&qid=1707636580&sr=8-37,"Large Dark Grey Storage Basket, Woven Cotton Rope Baskets for Storage, Big Blanket Organizer Storage Basket for Living Room, Kids Room Toy Storage Organizer Box, Blanket Keeper (22""x14"")",B0C5JPPRG2,https://m.media-amazon.com/images/I/81Y-nIEBZaL._AC_UL320_.jpg,$29.99,True,10% coupon applied at checkoutSave 10% with coupon$39.99,4.6 out of 5 stars,398
https://www.amazon.com/Vantic-Shaped-Storage-Sturdy-Bedroom/dp/B0CJBYTFWD/ref=sr_1_38?keywords=living+room&qid=1707636580&sr=8-38,"Vantic C Shaped End Table, Small Couch Side Table with Storage Bag, Sturdy Slide Under Sofa Table with Metal Frame for Living Room & Bedroom (16"" L x 11.6"" W x 28"" H), Greige",B0CJBYTFWD,https://m.media-amazon.com/images/I/61CGO0lm1dL._AC_UL320_.jpg,$39.99,True,5% coupon applied at checkoutSave 5% with coupon,4.4 out of 5 stars,290
https://www.amazon.com/FOLKSMATE-Standing-Minimalist-Bedroom-lampshade/dp/B0BZRGWPK1/ref=sr_1_39?keywords=living+room&qid=1707636580&sr=8-39,"FOLKSMATE Floor Lamp for Living Room, LED Modern Simple Standing Lamps, Tall Lamp for Bedroom, Kid, Office, Reading Room Black Pole Light Without Bulb",B0BZRGWPK1,https://m.media-amazon.com/images/I/61KMVp4mR5L._AC_UL320_.jpg,$25.99,True,20% coupon applied at checkoutSave 20% with coupon$27.99,4.5 out of 5 stars,618
https://www.amazon.com/Pibeyer-Crystal-Rectangle-Mirrored-Decoration/dp/B0BBQNXYX3/ref=sr_1_40?keywords=living+room&qid=1707636580&sr=8-40,"Crystal Crush Diamond Wall Candle Holder Set of 2, Rectangle Silver Mirrored Candle Sconces, Home Wall Decoration for Living Room,Dining Room & Bedroom",B0BBQNXYX3,https://m.media-amazon.com/images/I/71npwpx7V5L._AC_UL320_.jpg,$32.00,True,List:$16.00,4.7 out of 5 stars,813
https://www.amazon.com/upsimples-Floating-Shelves-Brackets-Bathroom/dp/B0BX59CFN1/ref=sr_1_41?keywords=living+room&qid=1707636580&sr=8-41,"upsimples Floating Shelves for Wall Decor Storage, Dark Brown Wall Mounted Shelves Set of 5, Sturdy Small Wood Shelves Hanging for Bedroom, Living Room, Bathroom, Kitchen, Corner, Book",B0BX59CFN1,https://m.media-amazon.com/images/I/71dh0MG5W0L._AC_UL320_.jpg,$22.99,True,10% coupon applied at checkoutSave 10% with coupon,4.7 out of 5 stars,960
https://www.amazon.com/Simple-Standing-Hanging-Bedroom-Without/dp/B07Z5NQPDS/ref=sr_1_42?keywords=living+room&qid=1707636580&sr=8-42,"LED Floor Lamp Simple Design, Modern Floor Lamp with Shade, Tall Lamps for Living Room Bedroom Office Dining Room Kitchen, Black Pole Lamp with Foot Switch(Without Bulb)",B07Z5NQPDS,https://m.media-amazon.com/images/I/41M4oGNowVL._AC_UL320_.jpg,$33.99,True,10% coupon applied at checkoutSave 10% with coupon$49.99,4.5 out of 5 stars,5038
https://www.amazon.com/BMOSU-Entryway-Stackable-Premium-Organizer/dp/B09Z27VDJN/ref=sr_1_43?keywords=living+room&qid=1707636580&sr=8-43,"BMOSU Bamboo Shoe Rack for Entryway Stackable Shoe shelf Premium Storage Organizer for Hallway Closet Living Room Bedroom Organizer(Natural, 3-Tier L-33.3"")",B09Z27VDJN,https://m.media-amazon.com/images/I/718gpROo19L._AC_UL320_.jpg,8 sizes,True,10% coupon applied at checkoutSave 10% with coupon,4.6 out of 5 stars,2228
https://www.amazon.com/Nexlux-Backlight-Lighting-Controller-Decoration/dp/B071LBF331/ref=sr_1_44?keywords=living+room&qid=1707636580&sr=8-44,"LED Lights for 58 Inch TV, Backlight 8.2ft USB LED Light Strip Indoor Use APP Controlled with Remote, DIY Colors TV LED for Gaming Lights",B071LBF331,https://m.media-amazon.com/images/I/51x1zhcqpnL._AC_UL320_.jpg,$13.98,True,$3.00 coupon applied at checkoutSave $3.00 with coupon$1.43,4.4 out of 5 stars,7941
https://www.amazon.com/FlyDOIT-Thickened-Memory-Foam-Aesthetic-Minimalist/dp/B0CMZXSFDX/ref=sr_1_45?keywords=living+room&qid=1707636580&sr=8-45,"Area Rugs for Bedroom Living Room, 4x6 Black Super Soft Comfy Thickened Memory-Foam Indoor Carpets, Modern Aesthetic Minimalist Carpet for Boys Girls Adults Apartment Nursery Home Décor",B0CMZXSFDX,https://m.media-amazon.com/images/I/71wdEwp5AhL._AC_UL320_.jpg,7 sizes,True,10% coupon applied at checkoutSave 10% with coupon,3.8 out of 5 stars,79
https://www.amazon.com/Goodpick-Storage-Blanket-laundry-Foldable/dp/B0C2Y1VTTW/ref=sr_1_46?keywords=living+room&qid=1707636580&sr=8-46,"Goodpick Large Storage Basket, 83L Blanket Basket for Living Room, Woven Storage Basket, Large Laundry Basket for Clothes, Christmas Tree Basket, 21.7 x 13.8 inches",B0C2Y1VTTW,https://m.media-amazon.com/images/I/81pjew1vEDL._AC_UL320_.jpg,$25.99,True,$3.00 coupon applied at checkoutSave $3.00 with coupon,4.7 out of 5 stars,363
https://www.amazon.com/100-Blackout-Shield-Curtains-Insulated/dp/B0BYMLNDW4/ref=sr_1_47?keywords=living+room&qid=1707636580&sr=8-47,"100% Blackout Shield Linen Blackout Curtains for Bedroom 84 Inches Long,Back Tab/Rod Pocket Living Room Drapes,Thermal Insulated Textured Blackout Curtains 2 Panels Set,50"" W x 84"" L,Beige",B0BYMLNDW4,https://m.media-amazon.com/images/I/71JHh2doOuL._AC_UL320_.jpg,8 sizes,True,Typical:$39.99,4.6 out of 5 stars,902
https://www.amazon.com/Hzuaneri-Charging-Station-Nightstand-ET15201B/dp/B0CKXHV1D4/ref=sr_1_48?keywords=living+room&qid=1707636580&sr=8-48,"End Table with Charging Station, Set of 2, 3 Tier Storage Bed Side Table with USB Port & Outlet, Nightstand for Living Room, Narrow Side Table, Rustic Brown and Black ET15201B",B0CKXHV1D4,https://m.media-amazon.com/images/I/813Ll2Wya6L._AC_UL320_.jpg,2 sizes,True,,4.6 out of 5 stars,6
